"No.","Time","Source","Destination","Protocol","Length","Info"
"1","0.000000000","192.168.129.132","192.168.129.2","DNS","74","Standard query 0x6bcb A www.mako.co.il"
"2","0.000603610","192.168.129.132","192.168.129.2","DNS","74","Standard query 0x85c1 HTTPS www.mako.co.il"
"3","0.005975867","192.168.129.2","192.168.129.132","DNS","211","Standard query response 0x85c1 HTTPS www.mako.co.il CNAME wilcard.mako.co.il.edgekey.net CNAME e974.b.akamaiedge.net SOA n0b.akamaiedge.net"
"4","0.006312446","192.168.129.2","192.168.129.132","DNS","166","Standard query response 0x6bcb A www.mako.co.il CNAME wilcard.mako.co.il.edgekey.net CNAME e974.b.akamaiedge.net A 23.56.225.242"
"5","0.012358515","192.168.129.132","23.56.225.242","TCP","74","44326  >  443 [SYN] Seq=0 Win=64240 Len=0 MSS=1460 SACK_PERM TSval=3058958283 TSecr=0 WS=128"
"6","0.012950411","192.168.129.132","23.56.225.242","TCP","74","44342  >  443 [SYN] Seq=0 Win=64240 Len=0 MSS=1460 SACK_PERM TSval=3058958283 TSecr=0 WS=128"
"7","0.059977810","23.56.225.242","192.168.129.132","TCP","60","443  >  44342 [SYN, ACK] Seq=0 Ack=1 Win=64240 Len=0 MSS=1460"
"8","0.059977979","23.56.225.242","192.168.129.132","TCP","60","443  >  44326 [SYN, ACK] Seq=0 Ack=1 Win=64240 Len=0 MSS=1460"
"9","0.060146447","192.168.129.132","23.56.225.242","TCP","54","44342  >  443 [ACK] Seq=1 Ack=1 Win=64240 Len=0"
"10","0.060274595","192.168.129.132","23.56.225.242","TCP","54","44326  >  443 [ACK] Seq=1 Ack=1 Win=64240 Len=0"
"11","0.061159871","192.168.129.132","23.56.225.242","TLSv1.3","2081","Client Hello (SNI=www.mako.co.il)"
"12","0.061508270","23.56.225.242","192.168.129.132","TCP","60","443  >  44342 [ACK] Seq=1 Ack=1461 Win=64240 Len=0"
"13","0.061508360","23.56.225.242","192.168.129.132","TCP","60","443  >  44342 [ACK] Seq=1 Ack=2028 Win=64240 Len=0"
"14","0.061817329","192.168.129.132","23.56.225.242","TLSv1.3","2081","Client Hello (SNI=www.mako.co.il)"
"15","0.062019782","23.56.225.242","192.168.129.132","TCP","60","443  >  44326 [ACK] Seq=1 Ack=1461 Win=64240 Len=0"
"16","0.062019999","23.56.225.242","192.168.129.132","TCP","60","443  >  44326 [ACK] Seq=1 Ack=2028 Win=64240 Len=0"
"17","0.167311011","23.56.225.242","192.168.129.132","TLSv1.3","318","Server Hello, Change Cipher Spec, Encrypted Extensions, Finished"
"18","0.167418454","192.168.129.132","23.56.225.242","TCP","54","44326  >  443 [ACK] Seq=2028 Ack=265 Win=63976 Len=0"
"19","0.168375981","192.168.129.132","23.56.225.242","TLSv1.3","134","Change Cipher Spec, Finished"
"20","0.168696865","23.56.225.242","192.168.129.132","TCP","60","443  >  44326 [ACK] Seq=265 Ack=2108 Win=64240 Len=0"
"21","0.171164192","192.168.129.132","23.56.225.242","HTTP2","146","Magic, SETTINGS[0], WINDOW_UPDATE[0]"
"22","0.171427574","23.56.225.242","192.168.129.132","TCP","60","443  >  44326 [ACK] Seq=265 Ack=2200 Win=64240 Len=0"
"23","0.171615771","192.168.129.132","23.56.225.242","HTTP2","888","HEADERS[1]: GET /mako-vod-keshet/parliament"
"24","0.171919236","23.56.225.242","192.168.129.132","TCP","60","443  >  44326 [ACK] Seq=265 Ack=3034 Win=64240 Len=0"
"25","0.182719670","23.56.225.242","192.168.129.132","TLSv1.3","318","Server Hello, Change Cipher Spec, Encrypted Extensions, Finished"
"26","0.182795402","192.168.129.132","23.56.225.242","TCP","54","44342  >  443 [ACK] Seq=2028 Ack=265 Win=63976 Len=0"
"27","0.184252223","192.168.129.132","23.56.225.242","TLSv1.3","134","Change Cipher Spec, Finished"
"28","0.184693901","23.56.225.242","192.168.129.132","TCP","60","443  >  44342 [ACK] Seq=265 Ack=2108 Win=64240 Len=0"
"29","0.215794540","23.56.225.242","192.168.129.132","TLSv1.3","341","New Session Ticket"
"30","0.229905017","23.56.225.242","192.168.129.132","TLSv1.3","341","New Session Ticket"
"31","0.256411841","192.168.129.132","23.56.225.242","TCP","54","44326  >  443 [ACK] Seq=3034 Ack=552 Win=63976 Len=0"
"32","0.261241327","23.56.225.242","192.168.129.132","HTTP2","146","SETTINGS[0]"
"33","0.261373662","192.168.129.132","23.56.225.242","TCP","54","44326  >  443 [ACK] Seq=3034 Ack=644 Win=63976 Len=0"
"34","0.261692157","192.168.129.132","23.56.225.242","HTTP2","85","SETTINGS[0]"
"35","0.262108478","23.56.225.242","192.168.129.132","TCP","60","443  >  44326 [ACK] Seq=644 Ack=3065 Win=64240 Len=0"
"36","0.270326433","192.168.129.132","23.56.225.242","TCP","54","44342  >  443 [ACK] Seq=2108 Ack=552 Win=63976 Len=0"
"37","0.432262038","23.56.225.242","192.168.129.132","HTTP2","17798","DATA[1]"
"38","0.432402473","192.168.129.132","23.56.225.242","TCP","54","44326  >  443 [ACK] Seq=3065 Ack=18388 Win=65535 Len=0"
"39","0.435070483","23.56.225.242","192.168.129.132","TLSv1.3","2169","DATA[1] (text/html)"
"40","0.435127346","192.168.129.132","23.56.225.242","TCP","54","44326  >  443 [ACK] Seq=3065 Ack=20503 Win=65535 Len=0"
"41","0.609816051","192.168.129.132","192.168.129.2","DNS","74","Standard query 0x581b A rcs.mako.co.il"
"42","0.610468785","192.168.129.132","192.168.129.2","DNS","74","Standard query 0xda43 HTTPS rcs.mako.co.il"
"43","0.617060114","192.168.129.2","192.168.129.132","DNS","166","Standard query response 0x581b A rcs.mako.co.il CNAME wilcard.mako.co.il.edgekey.net CNAME e974.b.akamaiedge.net A 23.56.225.242"
"44","0.617060287","192.168.129.2","192.168.129.132","DNS","211","Standard query response 0xda43 HTTPS rcs.mako.co.il CNAME wilcard.mako.co.il.edgekey.net CNAME e974.b.akamaiedge.net SOA n0b.akamaiedge.net"
"45","0.618784499","192.168.129.132","23.56.225.242","HTTP2","526","HEADERS[3]: GET /mako-vod/_next/static/css/b8722c3c09620fe9.css"
"46","0.619119691","192.168.129.132","23.56.225.242","HTTP2","222","HEADERS[5]: GET /mako-vod/_next/static/media/plus.a635e74d.png"
"47","0.619719504","23.56.225.242","192.168.129.132","TCP","60","443  >  44326 [ACK] Seq=20503 Ack=3537 Win=64240 Len=0"
"48","0.619719952","23.56.225.242","192.168.129.132","TCP","60","443  >  44326 [ACK] Seq=20503 Ack=3705 Win=64240 Len=0"
"49","0.619829058","192.168.129.132","192.168.129.2","DNS","74","Standard query 0xd678 A img.mako.co.il"
"50","0.620046356","192.168.129.132","192.168.129.2","DNS","74","Standard query 0x3b56 HTTPS img.mako.co.il"
"51","0.625433222","192.168.129.132","23.56.225.242","HTTP2","180","HEADERS[7]: GET /js/domo/domo-1.0.0.js"
"52","0.626033568","23.56.225.242","192.168.129.132","TCP","60","443  >  44326 [ACK] Seq=20503 Ack=3831 Win=64240 Len=0"
"53","0.628630695","192.168.129.2","192.168.129.132","DNS","211","Standard query response 0x3b56 HTTPS img.mako.co.il CNAME wilcard.mako.co.il.edgekey.net CNAME e974.b.akamaiedge.net SOA n0b.akamaiedge.net"
"54","0.628630787","192.168.129.2","192.168.129.132","DNS","169","Standard query response 0xd678 A img.mako.co.il CNAME wilcard.mako.co.il.edgekey.net CNAME e974.b.akamaiedge.net A 23.56.225.242"
"55","0.631066656","192.168.129.132","23.56.225.242","HTTP2","151","HEADERS[9]: GET /2024/10/10/logo-12-desktop.png"
"56","0.631687589","23.56.225.242","192.168.129.132","TCP","60","443  >  44326 [ACK] Seq=20503 Ack=3928 Win=64240 Len=0"
"57","0.949812782","23.56.225.242","192.168.129.132","HTTP2","3342","HEADERS[3]: 200 OK"
"58","0.949915041","192.168.129.132","23.56.225.242","TCP","54","44326  >  443 [ACK] Seq=3928 Ack=23791 Win=65535 Len=0"
"59","0.952587038","23.56.225.242","192.168.129.132","TCP","2958","443  >  44326 [PSH, ACK] Seq=23791 Ack=3928 Win=64240 Len=2904 [TCP PDU reassembled in 67]"
"60","0.952649856","192.168.129.132","23.56.225.242","TCP","54","44326  >  443 [ACK] Seq=3928 Ack=26695 Win=65535 Len=0"
"61","0.954714226","23.56.225.242","192.168.129.132","TCP","2958","443  >  44326 [PSH, ACK] Seq=26695 Ack=3928 Win=64240 Len=2904 [TCP PDU reassembled in 67]"
"62","0.954873774","192.168.129.132","23.56.225.242","TCP","54","44326  >  443 [ACK] Seq=3928 Ack=29599 Win=65535 Len=0"
"63","0.957173353","23.56.225.242","192.168.129.132","TCP","2958","443  >  44326 [PSH, ACK] Seq=29599 Ack=3928 Win=64240 Len=2904 [TCP PDU reassembled in 67]"
"64","0.957330764","192.168.129.132","23.56.225.242","TCP","54","44326  >  443 [ACK] Seq=3928 Ack=32503 Win=65535 Len=0"
"65","0.958652727","23.56.225.242","192.168.129.132","TCP","2958","443  >  44326 [PSH, ACK] Seq=32503 Ack=3928 Win=64240 Len=2904 [TCP PDU reassembled in 67]"
"66","0.958721697","192.168.129.132","23.56.225.242","TCP","54","44326  >  443 [ACK] Seq=3928 Ack=35407 Win=65535 Len=0"
"67","0.961786713","23.56.225.242","192.168.129.132","TLSv1.3","2958","DATA[3]"
"68","0.961866205","192.168.129.132","23.56.225.242","TCP","54","44326  >  443 [ACK] Seq=3928 Ack=38311 Win=65535 Len=0"
"69","0.963842591","23.56.225.242","192.168.129.132","HTTP2","2958","DATA[3] (text/css), HEADERS[5]: 200 OK"
"70","0.963904945","192.168.129.132","23.56.225.242","TCP","54","44326  >  443 [ACK] Seq=3928 Ack=41215 Win=65535 Len=0"
"71","0.968219593","23.56.225.242","192.168.129.132","HTTP2","2958","DATA[5] (PNG), HEADERS[9]: 200 OK"
"72","0.968266095","192.168.129.132","23.56.225.242","TCP","54","44326  >  443 [ACK] Seq=3928 Ack=44119 Win=65535 Len=0"
"73","0.969175127","23.56.225.242","192.168.129.132","TCP","2958","443  >  44326 [PSH, ACK] Seq=44119 Ack=3928 Win=64240 Len=2904 [TCP PDU reassembled in 77]"
"74","0.969305333","192.168.129.132","23.56.225.242","TCP","54","44326  >  443 [ACK] Seq=3928 Ack=47023 Win=65535 Len=0"
"75","0.969966411","23.56.225.242","192.168.129.132","TCP","2958","443  >  44326 [PSH, ACK] Seq=47023 Ack=3928 Win=64240 Len=2904 [TCP PDU reassembled in 77]"
"76","0.970034081","192.168.129.132","23.56.225.242","TCP","54","44326  >  443 [ACK] Seq=3928 Ack=49927 Win=65535 Len=0"
"77","0.972861534","23.56.225.242","192.168.129.132","HTTP2","2958","DATA[9] (PNG), HEADERS[7]: 200 OK"
"78","0.972935062","192.168.129.132","23.56.225.242","TCP","54","44326  >  443 [ACK] Seq=3928 Ack=52831 Win=65535 Len=0"
"79","0.975104517","23.56.225.242","192.168.129.132","TCP","2958","443  >  44326 [PSH, ACK] Seq=52831 Ack=3928 Win=64240 Len=2904 [TCP PDU reassembled in 87]"
"80","0.975274273","192.168.129.132","23.56.225.242","TCP","54","44326  >  443 [ACK] Seq=3928 Ack=55735 Win=65535 Len=0"
"81","0.977638918","23.56.225.242","192.168.129.132","TCP","2958","443  >  44326 [PSH, ACK] Seq=55735 Ack=3928 Win=64240 Len=2904 [TCP PDU reassembled in 87]"
"82","0.977696143","192.168.129.132","23.56.225.242","TCP","54","44326  >  443 [ACK] Seq=3928 Ack=58639 Win=65535 Len=0"
"83","0.979132958","23.56.225.242","192.168.129.132","TCP","2958","443  >  44326 [PSH, ACK] Seq=58639 Ack=3928 Win=64240 Len=2904 [TCP PDU reassembled in 87]"
"84","0.979240316","192.168.129.132","23.56.225.242","TCP","54","44326  >  443 [ACK] Seq=3928 Ack=61543 Win=65535 Len=0"
"85","0.981392464","23.56.225.242","192.168.129.132","TCP","2958","443  >  44326 [PSH, ACK] Seq=61543 Ack=3928 Win=64240 Len=2904 [TCP PDU reassembled in 87]"
"86","0.981461805","192.168.129.132","23.56.225.242","TCP","54","44326  >  443 [ACK] Seq=3928 Ack=64447 Win=65535 Len=0"
"87","0.985046580","23.56.225.242","192.168.129.132","TLSv1.3","2958","DATA[7]"
"88","0.985129693","192.168.129.132","23.56.225.242","TCP","54","44326  >  443 [ACK] Seq=3928 Ack=67351 Win=65535 Len=0"
"89","0.994592813","23.56.225.242","192.168.129.132","TCP","2958","443  >  44326 [PSH, ACK] Seq=67351 Ack=3928 Win=64240 Len=2904 [TCP PDU reassembled in 99]"
"90","0.994756333","192.168.129.132","23.56.225.242","TCP","54","44326  >  443 [ACK] Seq=3928 Ack=70255 Win=65535 Len=0"
"91","0.995083128","23.56.225.242","192.168.129.132","TCP","2958","443  >  44326 [PSH, ACK] Seq=70255 Ack=3928 Win=64240 Len=2904 [TCP PDU reassembled in 99]"
"92","0.995196058","192.168.129.132","23.56.225.242","TCP","54","44326  >  443 [ACK] Seq=3928 Ack=73159 Win=65535 Len=0"
"93","0.999596891","23.56.225.242","192.168.129.132","TCP","2958","443  >  44326 [PSH, ACK] Seq=73159 Ack=3928 Win=64240 Len=2904 [TCP PDU reassembled in 99]"
"94","0.999597059","23.56.225.242","192.168.129.132","TCP","2958","443  >  44326 [PSH, ACK] Seq=76063 Ack=3928 Win=64240 Len=2904 [TCP PDU reassembled in 99]"
"95","0.999734773","192.168.129.132","23.56.225.242","TCP","54","44326  >  443 [ACK] Seq=3928 Ack=76063 Win=65535 Len=0"
"96","0.999891055","192.168.129.132","23.56.225.242","TCP","54","44326  >  443 [ACK] Seq=3928 Ack=78967 Win=65535 Len=0"
"97","1.002354859","23.56.225.242","192.168.129.132","TCP","2958","443  >  44326 [PSH, ACK] Seq=78967 Ack=3928 Win=64240 Len=2904 [TCP PDU reassembled in 99]"
"98","1.002473039","192.168.129.132","23.56.225.242","TCP","54","44326  >  443 [ACK] Seq=3928 Ack=81871 Win=65535 Len=0"
"99","1.008633148","23.56.225.242","192.168.129.132","TLSv1.3","5862","DATA[7]"
"100","1.008633375","23.56.225.242","192.168.129.132","TCP","2958","443  >  44326 [PSH, ACK] Seq=87679 Ack=3928 Win=64240 Len=2904 [TCP PDU reassembled in 109]"
"101","1.008727237","192.168.129.132","23.56.225.242","TCP","54","44326  >  443 [ACK] Seq=3928 Ack=87679 Win=65535 Len=0"
"102","1.008826149","192.168.129.132","23.56.225.242","TCP","54","44326  >  443 [ACK] Seq=3928 Ack=90583 Win=65535 Len=0"
"103","1.012373526","23.56.225.242","192.168.129.132","TCP","2958","443  >  44326 [PSH, ACK] Seq=90583 Ack=3928 Win=64240 Len=2904 [TCP PDU reassembled in 109]"
"104","1.012468538","192.168.129.132","23.56.225.242","TCP","54","44326  >  443 [ACK] Seq=3928 Ack=93487 Win=65535 Len=0"
"105","1.013291968","23.56.225.242","192.168.129.132","TCP","2958","443  >  44326 [PSH, ACK] Seq=93487 Ack=3928 Win=64240 Len=2904 [TCP PDU reassembled in 109]"
"106","1.013370220","192.168.129.132","23.56.225.242","TCP","54","44326  >  443 [ACK] Seq=3928 Ack=96391 Win=65535 Len=0"
"107","1.015913566","23.56.225.242","192.168.129.132","TCP","2958","443  >  44326 [PSH, ACK] Seq=96391 Ack=3928 Win=64240 Len=2904 [TCP PDU reassembled in 109]"
"108","1.015996678","192.168.129.132","23.56.225.242","TCP","54","44326  >  443 [ACK] Seq=3928 Ack=99295 Win=65535 Len=0"
"109","1.018233541","23.56.225.242","192.168.129.132","TLSv1.3","2958","DATA[7]"
"110","1.018281670","192.168.129.132","23.56.225.242","TCP","54","44326  >  443 [ACK] Seq=3928 Ack=102199 Win=65535 Len=0"
"111","1.022281981","23.56.225.242","192.168.129.132","HTTP2","2220","DATA[7] (application/x-javascript)"
"112","1.022390825","192.168.129.132","23.56.225.242","TCP","54","44326  >  443 [ACK] Seq=3928 Ack=104365 Win=65535 Len=0"
"113","1.230643741","192.168.129.132","23.56.225.242","HTTP2","162","HEADERS[11]: GET /mako-vod/_next/static/media/vChecked.8673d80f.png"
"114","1.230905665","192.168.129.132","23.56.225.242","HTTP2","167","HEADERS[13]: GET /mako-vod/_next/static/chunks/webpack-e8a3675f58ffd38e.js"
"115","1.231328480","23.56.225.242","192.168.129.132","TCP","60","443  >  44326 [ACK] Seq=104365 Ack=4036 Win=64240 Len=0"
"116","1.231328922","23.56.225.242","192.168.129.132","TCP","60","443  >  44326 [ACK] Seq=104365 Ack=4149 Win=64240 Len=0"
"117","1.231378189","192.168.129.132","23.56.225.242","HTTP2","723","HEADERS[25]: GET /mako-vod/_next/static/chunks/524-7f18b27bbaeb3ab7.js"
"118","1.231546955","192.168.129.132","23.56.225.242","HTTP2","163","HEADERS[27]: GET /mako-vod/_next/static/chunks/165-025c23538ec6d36f.js"
"119","1.231856950","192.168.129.132","23.56.225.242","HTTP2","192","HEADERS[29]: GET /mako-vod/_next/static/chunks/pages/%5Bmako_vod_channel%5D/%5Bprogram%5D-ed7758ab8faf74fd.js"
"120","1.231885021","23.56.225.242","192.168.129.132","TCP","60","443  >  44326 [ACK] Seq=104365 Ack=4818 Win=64240 Len=0"
"121","1.231885607","23.56.225.242","192.168.129.132","TCP","60","443  >  44326 [ACK] Seq=104365 Ack=4927 Win=64240 Len=0"
"122","1.232041221","192.168.129.132","23.56.225.242","HTTP2","260","HEADERS[33]: GET /mako-vod/_next/static/6.1.0/_ssgManifest.js"
"123","1.232318143","23.56.225.242","192.168.129.132","TCP","60","443  >  44326 [ACK] Seq=104365 Ack=5065 Win=64240 Len=0"
"124","1.232318425","23.56.225.242","192.168.129.132","TCP","60","443  >  44326 [ACK] Seq=104365 Ack=5271 Win=64240 Len=0"
"125","1.232455307","192.168.129.132","23.56.225.242","HTTP2","162","HEADERS[35]: GET /18f5227b-e27b-445a-a53f-f845fbe69b40/stormcaster.js"
"126","1.232823929","23.56.225.242","192.168.129.132","TCP","60","443  >  44326 [ACK] Seq=104365 Ack=5379 Win=64240 Len=0"
"127","1.276105931","23.56.225.242","192.168.129.132","HTTP2","1721","DATA[11] (PNG)"
"128","1.276140833","192.168.129.132","23.56.225.242","TCP","54","44326  >  443 [ACK] Seq=5379 Ack=106032 Win=65535 Len=0"
"129","1.316688748","192.168.129.132","23.56.225.242","HTTP2","164","HEADERS[37]: GET /mako-vod/_next/static/media/profile.a12fdafa.png"
"130","1.317386427","23.56.225.242","192.168.129.132","TCP","60","443  >  44326 [ACK] Seq=106032 Ack=5489 Win=64240 Len=0"
"131","1.317521620","192.168.129.132","23.56.225.242","HTTP2","142","HEADERS[39]: GET /images/svg/12plus/prev_arrow.svg"
"132","1.317970886","23.56.225.242","192.168.129.132","TCP","60","443  >  44326 [ACK] Seq=106032 Ack=5577 Win=64240 Len=0"
"133","1.318007429","192.168.129.132","23.56.225.242","HTTP2","142","HEADERS[41]: GET /images/svg/12plus/next_arrow.svg"
"134","1.318497975","23.56.225.242","192.168.129.132","TCP","60","443  >  44326 [ACK] Seq=106032 Ack=5665 Win=64240 Len=0"
"135","1.321635968","23.56.225.242","192.168.129.132","HTTP2","2204","DATA[13]"
"136","1.321671563","192.168.129.132","23.56.225.242","TCP","54","44326  >  443 [ACK] Seq=5665 Ack=108182 Win=65535 Len=0"
"137","1.322467178","23.56.225.242","192.168.129.132","HTTP2","2958","HEADERS[15]: 200 OK"
"138","1.322508541","192.168.129.132","23.56.225.242","TCP","54","44326  >  443 [ACK] Seq=5665 Ack=111086 Win=65535 Len=0"
"139","1.322781570","23.56.225.242","192.168.129.132","TCP","2958","443  >  44326 [PSH, ACK] Seq=111086 Ack=5665 Win=64240 Len=2904 [TCP PDU reassembled in 145]"
"140","1.322806604","192.168.129.132","23.56.225.242","TCP","54","44326  >  443 [ACK] Seq=5665 Ack=113990 Win=65535 Len=0"
"141","1.323656317","23.56.225.242","192.168.129.132","TCP","2958","443  >  44326 [PSH, ACK] Seq=113990 Ack=5665 Win=64240 Len=2904 [TCP PDU reassembled in 145]"
"142","1.323694773","192.168.129.132","23.56.225.242","TCP","54","44326  >  443 [ACK] Seq=5665 Ack=116894 Win=65535 Len=0"
"143","1.324862572","23.56.225.242","192.168.129.132","TCP","2958","443  >  44326 [PSH, ACK] Seq=116894 Ack=5665 Win=64240 Len=2904 [TCP PDU reassembled in 145]"
"144","1.324902418","192.168.129.132","23.56.225.242","TCP","54","44326  >  443 [ACK] Seq=5665 Ack=119798 Win=65535 Len=0"
"145","1.326758797","23.56.225.242","192.168.129.132","TLSv1.3","5862","DATA[15]"
"146","1.326797808","192.168.129.132","23.56.225.242","TCP","54","44326  >  443 [ACK] Seq=5665 Ack=125606 Win=65535 Len=0"
"147","1.328656121","23.56.225.242","192.168.129.132","TCP","5862","443  >  44326 [PSH, ACK] Seq=125606 Ack=5665 Win=64240 Len=5808 [TCP PDU reassembled in 155]"
"148","1.328701350","192.168.129.132","23.56.225.242","TCP","54","44326  >  443 [ACK] Seq=5665 Ack=131414 Win=65535 Len=0"
"149","1.329296794","23.56.225.242","192.168.129.132","TCP","2958","443  >  44326 [PSH, ACK] Seq=131414 Ack=5665 Win=64240 Len=2904 [TCP PDU reassembled in 155]"
"150","1.329337428","192.168.129.132","23.56.225.242","TCP","54","44326  >  443 [ACK] Seq=5665 Ack=134318 Win=65535 Len=0"
"151","1.330263370","23.56.225.242","192.168.129.132","TCP","2958","443  >  44326 [PSH, ACK] Seq=134318 Ack=5665 Win=64240 Len=2904 [TCP PDU reassembled in 155]"
"152","1.330303495","192.168.129.132","23.56.225.242","TCP","54","44326  >  443 [ACK] Seq=5665 Ack=137222 Win=65535 Len=0"
"153","1.330623540","23.56.225.242","192.168.129.132","TCP","2958","443  >  44326 [PSH, ACK] Seq=137222 Ack=5665 Win=64240 Len=2904 [TCP PDU reassembled in 155]"
"154","1.330658352","192.168.129.132","23.56.225.242","TCP","54","44326  >  443 [ACK] Seq=5665 Ack=140126 Win=65535 Len=0"
"155","1.332872380","23.56.225.242","192.168.129.132","TLSv1.3","5862","DATA[15]"
"156","1.332917618","192.168.129.132","23.56.225.242","TCP","54","44326  >  443 [ACK] Seq=5665 Ack=145934 Win=65535 Len=0"
"157","1.333721911","23.56.225.242","192.168.129.132","TCP","2958","443  >  44326 [PSH, ACK] Seq=145934 Ack=5665 Win=64240 Len=2904 [TCP PDU reassembled in 165]"
"158","1.333758112","192.168.129.132","23.56.225.242","TCP","54","44326  >  443 [ACK] Seq=5665 Ack=148838 Win=65535 Len=0"
"159","1.334897726","23.56.225.242","192.168.129.132","TCP","2958","443  >  44326 [PSH, ACK] Seq=148838 Ack=5665 Win=64240 Len=2904 [TCP PDU reassembled in 165]"
"160","1.334924849","192.168.129.132","23.56.225.242","TCP","54","44326  >  443 [ACK] Seq=5665 Ack=151742 Win=65535 Len=0"
"161","1.335829511","23.56.225.242","192.168.129.132","TCP","2958","443  >  44326 [PSH, ACK] Seq=151742 Ack=5665 Win=64240 Len=2904 [TCP PDU reassembled in 165]"
"162","1.335881256","192.168.129.132","23.56.225.242","TCP","54","44326  >  443 [ACK] Seq=5665 Ack=154646 Win=65535 Len=0"
"163","1.336894880","23.56.225.242","192.168.129.132","TCP","2958","443  >  44326 [PSH, ACK] Seq=154646 Ack=5665 Win=64240 Len=2904 [TCP PDU reassembled in 165]"
"164","1.336932561","192.168.129.132","23.56.225.242","TCP","54","44326  >  443 [ACK] Seq=5665 Ack=157550 Win=65535 Len=0"
"165","1.337485949","23.56.225.242","192.168.129.132","TLSv1.3","2958","HEADERS[17]: 200 OK"
"166","1.337515019","192.168.129.132","23.56.225.242","TCP","54","44326  >  443 [ACK] Seq=5665 Ack=160454 Win=65535 Len=0"
"167","1.338523156","23.56.225.242","192.168.129.132","TCP","2958","443  >  44326 [PSH, ACK] Seq=160454 Ack=5665 Win=64240 Len=2904 [TCP PDU reassembled in 175]"
"168","1.338573526","192.168.129.132","23.56.225.242","TCP","54","44326  >  443 [ACK] Seq=5665 Ack=163358 Win=65535 Len=0"
"169","1.339358967","23.56.225.242","192.168.129.132","TCP","2958","443  >  44326 [PSH, ACK] Seq=163358 Ack=5665 Win=64240 Len=2904 [TCP PDU reassembled in 175]"
"170","1.339409363","192.168.129.132","23.56.225.242","TCP","54","44326  >  443 [ACK] Seq=5665 Ack=166262 Win=65535 Len=0"
"171","1.340969015","23.56.225.242","192.168.129.132","TCP","2958","443  >  44326 [PSH, ACK] Seq=166262 Ack=5665 Win=64240 Len=2904 [TCP PDU reassembled in 175]"
"172","1.340969190","23.56.225.242","192.168.129.132","TCP","2958","443  >  44326 [PSH, ACK] Seq=169166 Ack=5665 Win=64240 Len=2904 [TCP PDU reassembled in 175]"
"173","1.341030755","192.168.129.132","23.56.225.242","TCP","54","44326  >  443 [ACK] Seq=5665 Ack=169166 Win=65535 Len=0"
"174","1.341194681","192.168.129.132","23.56.225.242","TCP","54","44326  >  443 [ACK] Seq=5665 Ack=172070 Win=65535 Len=0"
"175","1.341728398","23.56.225.242","192.168.129.132","TLSv1.3","2958","DATA[17]"
"176","1.341764109","192.168.129.132","23.56.225.242","TCP","54","44326  >  443 [ACK] Seq=5665 Ack=174974 Win=65535 Len=0"
"177","1.343136870","23.56.225.242","192.168.129.132","TCP","2958","443  >  44326 [PSH, ACK] Seq=174974 Ack=5665 Win=64240 Len=2904 [TCP PDU reassembled in 187]"
"178","1.343164621","192.168.129.132","23.56.225.242","TCP","54","44326  >  443 [ACK] Seq=5665 Ack=177878 Win=65535 Len=0"
"179","1.344374720","23.56.225.242","192.168.129.132","TCP","2958","443  >  44326 [PSH, ACK] Seq=177878 Ack=5665 Win=64240 Len=2904 [TCP PDU reassembled in 187]"
"180","1.344427491","192.168.129.132","23.56.225.242","TCP","54","44326  >  443 [ACK] Seq=5665 Ack=180782 Win=65535 Len=0"
"181","1.345419441","23.56.225.242","192.168.129.132","TCP","2958","443  >  44326 [PSH, ACK] Seq=180782 Ack=5665 Win=64240 Len=2904 [TCP PDU reassembled in 187]"
"182","1.345420243","23.56.225.242","192.168.129.132","TCP","2958","443  >  44326 [PSH, ACK] Seq=183686 Ack=5665 Win=64240 Len=2904 [TCP PDU reassembled in 187]"
"183","1.345483434","192.168.129.132","23.56.225.242","TCP","54","44326  >  443 [ACK] Seq=5665 Ack=183686 Win=65535 Len=0"
"184","1.345655530","192.168.129.132","23.56.225.242","TCP","54","44326  >  443 [ACK] Seq=5665 Ack=186590 Win=65535 Len=0"
"185","1.346160022","23.56.225.242","192.168.129.132","TCP","2958","443  >  44326 [PSH, ACK] Seq=186590 Ack=5665 Win=64240 Len=2904 [TCP PDU reassembled in 187]"
"186","1.346200350","192.168.129.132","23.56.225.242","TCP","54","44326  >  443 [ACK] Seq=5665 Ack=189494 Win=65535 Len=0"
"187","1.347367593","23.56.225.242","192.168.129.132","TLSv1.3","2958","DATA[17]"
"188","1.347400444","192.168.129.132","23.56.225.242","TCP","54","44326  >  443 [ACK] Seq=5665 Ack=192398 Win=65535 Len=0"
"189","1.348545897","23.56.225.242","192.168.129.132","TCP","2958","443  >  44326 [PSH, ACK] Seq=192398 Ack=5665 Win=64240 Len=2904 [TCP PDU reassembled in 191]"
"190","1.348601739","192.168.129.132","23.56.225.242","TCP","54","44326  >  443 [ACK] Seq=5665 Ack=195302 Win=65535 Len=0"
"191","1.349423200","23.56.225.242","192.168.129.132","HTTP2","2958","DATA[17], HEADERS[21]: 200 OK"
"192","1.349475628","192.168.129.132","23.56.225.242","TCP","54","44326  >  443 [ACK] Seq=5665 Ack=198206 Win=65535 Len=0"
"193","1.350306310","23.56.225.242","192.168.129.132","TCP","2958","443  >  44326 [PSH, ACK] Seq=198206 Ack=5665 Win=64240 Len=2904 [TCP PDU reassembled in 201]"
"194","1.350334644","192.168.129.132","23.56.225.242","TCP","54","44326  >  443 [ACK] Seq=5665 Ack=201110 Win=65535 Len=0"
"195","1.351458788","23.56.225.242","192.168.129.132","TCP","2958","443  >  44326 [PSH, ACK] Seq=201110 Ack=5665 Win=64240 Len=2904 [TCP PDU reassembled in 201]"
"196","1.351492028","192.168.129.132","23.56.225.242","TCP","54","44326  >  443 [ACK] Seq=5665 Ack=204014 Win=65535 Len=0"
"197","1.351907156","23.56.225.242","192.168.129.132","TCP","2958","443  >  44326 [PSH, ACK] Seq=204014 Ack=5665 Win=64240 Len=2904 [TCP PDU reassembled in 201]"
"198","1.351935425","192.168.129.132","23.56.225.242","TCP","54","44326  >  443 [ACK] Seq=5665 Ack=206918 Win=65535 Len=0"
"199","1.352721917","23.56.225.242","192.168.129.132","TCP","2958","443  >  44326 [PSH, ACK] Seq=206918 Ack=5665 Win=64240 Len=2904 [TCP PDU reassembled in 201]"
"200","1.352741162","192.168.129.132","23.56.225.242","TCP","54","44326  >  443 [ACK] Seq=5665 Ack=209822 Win=65535 Len=0"
"201","1.353600972","23.56.225.242","192.168.129.132","TLSv1.3","2958","DATA[21]"
"202","1.353623284","192.168.129.132","23.56.225.242","TCP","54","44326  >  443 [ACK] Seq=5665 Ack=212726 Win=65535 Len=0"
"203","1.354958747","23.56.225.242","192.168.129.132","TCP","2958","443  >  44326 [PSH, ACK] Seq=212726 Ack=5665 Win=64240 Len=2904 [TCP PDU reassembled in 209]"
"204","1.355005909","192.168.129.132","23.56.225.242","TCP","54","44326  >  443 [ACK] Seq=5665 Ack=215630 Win=65535 Len=0"
"205","1.358525511","23.56.225.242","192.168.129.132","TCP","5862","443  >  44326 [PSH, ACK] Seq=215630 Ack=5665 Win=64240 Len=5808 [TCP PDU reassembled in 209]"
"206","1.358526362","23.56.225.242","192.168.129.132","TCP","2958","443  >  44326 [PSH, ACK] Seq=221438 Ack=5665 Win=64240 Len=2904 [TCP PDU reassembled in 209]"
"207","1.358601666","192.168.129.132","23.56.225.242","TCP","54","44326  >  443 [ACK] Seq=5665 Ack=221438 Win=65535 Len=0"
"208","1.358810673","192.168.129.132","23.56.225.242","TCP","54","44326  >  443 [ACK] Seq=5665 Ack=224342 Win=65535 Len=0"
"209","1.359529677","23.56.225.242","192.168.129.132","HTTP2","2958","DATA[21], HEADERS[19]: 200 OK"
"210","1.359576617","192.168.129.132","23.56.225.242","TCP","54","44326  >  443 [ACK] Seq=5665 Ack=227246 Win=65535 Len=0"
"211","1.361993766","23.56.225.242","192.168.129.132","TCP","2958","443  >  44326 [PSH, ACK] Seq=227246 Ack=5665 Win=64240 Len=2904 [TCP PDU reassembled in 219]"
"212","1.362054765","192.168.129.132","23.56.225.242","TCP","54","44326  >  443 [ACK] Seq=5665 Ack=230150 Win=65535 Len=0"
"213","1.367002841","23.56.225.242","192.168.129.132","TCP","2958","443  >  44326 [PSH, ACK] Seq=230150 Ack=5665 Win=64240 Len=2904 [TCP PDU reassembled in 219]"
"214","1.367034884","192.168.129.132","23.56.225.242","TCP","54","44326  >  443 [ACK] Seq=5665 Ack=233054 Win=65535 Len=0"
"215","1.367448897","23.56.225.242","192.168.129.132","TCP","2958","443  >  44326 [PSH, ACK] Seq=233054 Ack=5665 Win=64240 Len=2904 [TCP PDU reassembled in 219]"
"216","1.367484646","192.168.129.132","23.56.225.242","TCP","54","44326  >  443 [ACK] Seq=5665 Ack=235958 Win=65535 Len=0"
"217","1.368552317","23.56.225.242","192.168.129.132","TCP","5862","443  >  44326 [PSH, ACK] Seq=235958 Ack=5665 Win=64240 Len=5808 [TCP PDU reassembled in 219]"
"218","1.368579260","192.168.129.132","23.56.225.242","TCP","54","44326  >  443 [ACK] Seq=5665 Ack=241766 Win=65535 Len=0"
"219","1.369477126","23.56.225.242","192.168.129.132","TLSv1.3","2958","DATA[19]"
"220","1.369477858","23.56.225.242","192.168.129.132","TCP","2958","443  >  44326 [PSH, ACK] Seq=244670 Ack=5665 Win=64240 Len=2904 [TCP PDU reassembled in 229]"
"221","1.369523319","192.168.129.132","23.56.225.242","TCP","54","44326  >  443 [ACK] Seq=5665 Ack=244670 Win=65535 Len=0"
"222","1.369640503","192.168.129.132","23.56.225.242","TCP","54","44326  >  443 [ACK] Seq=5665 Ack=247574 Win=65535 Len=0"
"223","1.371457188","23.56.225.242","192.168.129.132","TCP","2958","443  >  44326 [PSH, ACK] Seq=247574 Ack=5665 Win=64240 Len=2904 [TCP PDU reassembled in 229]"
"224","1.371497551","192.168.129.132","23.56.225.242","TCP","54","44326  >  443 [ACK] Seq=5665 Ack=250478 Win=65535 Len=0"
"225","1.371705544","23.56.225.242","192.168.129.132","TCP","2958","443  >  44326 [PSH, ACK] Seq=250478 Ack=5665 Win=64240 Len=2904 [TCP PDU reassembled in 229]"
"226","1.371727796","192.168.129.132","23.56.225.242","TCP","54","44326  >  443 [ACK] Seq=5665 Ack=253382 Win=65535 Len=0"
"227","1.372589841","23.56.225.242","192.168.129.132","TCP","2958","443  >  44326 [PSH, ACK] Seq=253382 Ack=5665 Win=64240 Len=2904 [TCP PDU reassembled in 229]"
"228","1.372611858","192.168.129.132","23.56.225.242","TCP","54","44326  >  443 [ACK] Seq=5665 Ack=256286 Win=65535 Len=0"
"229","1.373665233","23.56.225.242","192.168.129.132","TLSv1.3","2958","DATA[19]"
"230","1.373685415","192.168.129.132","23.56.225.242","TCP","54","44326  >  443 [ACK] Seq=5665 Ack=259190 Win=65535 Len=0"
"231","1.374688029","23.56.225.242","192.168.129.132","TCP","2958","443  >  44326 [PSH, ACK] Seq=259190 Ack=5665 Win=64240 Len=2904 [TCP PDU reassembled in 241]"
"232","1.374708473","192.168.129.132","23.56.225.242","TCP","54","44326  >  443 [ACK] Seq=5665 Ack=262094 Win=65535 Len=0"
"233","1.376201732","23.56.225.242","192.168.129.132","TCP","2958","443  >  44326 [PSH, ACK] Seq=262094 Ack=5665 Win=64240 Len=2904 [TCP PDU reassembled in 241]"
"234","1.376259331","192.168.129.132","23.56.225.242","TCP","54","44326  >  443 [ACK] Seq=5665 Ack=264998 Win=65535 Len=0"
"235","1.376732147","23.56.225.242","192.168.129.132","TCP","2958","443  >  44326 [PSH, ACK] Seq=264998 Ack=5665 Win=64240 Len=2904 [TCP PDU reassembled in 241]"
"236","1.376769824","192.168.129.132","23.56.225.242","TCP","54","44326  >  443 [ACK] Seq=5665 Ack=267902 Win=65535 Len=0"
"237","1.377448345","23.56.225.242","192.168.129.132","TCP","2958","443  >  44326 [PSH, ACK] Seq=267902 Ack=5665 Win=64240 Len=2904 [TCP PDU reassembled in 241]"
"238","1.377477504","192.168.129.132","23.56.225.242","TCP","54","44326  >  443 [ACK] Seq=5665 Ack=270806 Win=65535 Len=0"
"239","1.379267702","23.56.225.242","192.168.129.132","TCP","2958","443  >  44326 [PSH, ACK] Seq=270806 Ack=5665 Win=64240 Len=2904 [TCP PDU reassembled in 241]"
"240","1.379307199","192.168.129.132","23.56.225.242","TCP","54","44326  >  443 [ACK] Seq=5665 Ack=273710 Win=65535 Len=0"
"241","1.379430197","23.56.225.242","192.168.129.132","TLSv1.3","2958","DATA[19]"
"242","1.379437993","192.168.129.132","23.56.225.242","TCP","54","44326  >  443 [ACK] Seq=5665 Ack=276614 Win=65535 Len=0"
"243","1.382387045","23.56.225.242","192.168.129.132","TCP","5862","443  >  44326 [PSH, ACK] Seq=276614 Ack=5665 Win=64240 Len=5808 [TCP PDU reassembled in 251]"
"244","1.382443428","192.168.129.132","23.56.225.242","TCP","54","44326  >  443 [ACK] Seq=5665 Ack=282422 Win=65535 Len=0"
"245","1.382739609","23.56.225.242","192.168.129.132","TCP","2958","443  >  44326 [PSH, ACK] Seq=282422 Ack=5665 Win=64240 Len=2904 [TCP PDU reassembled in 251]"
"246","1.382763223","192.168.129.132","23.56.225.242","TCP","54","44326  >  443 [ACK] Seq=5665 Ack=285326 Win=65535 Len=0"
"247","1.382986076","23.56.225.242","192.168.129.132","TCP","2958","443  >  44326 [PSH, ACK] Seq=285326 Ack=5665 Win=64240 Len=2904 [TCP PDU reassembled in 251]"
"248","1.383002846","192.168.129.132","23.56.225.242","TCP","54","44326  >  443 [ACK] Seq=5665 Ack=288230 Win=65535 Len=0"
"249","1.384503556","23.56.225.242","192.168.129.132","TCP","2958","443  >  44326 [PSH, ACK] Seq=288230 Ack=5665 Win=64240 Len=2904 [TCP PDU reassembled in 251]"
"250","1.384547342","192.168.129.132","23.56.225.242","TCP","54","44326  >  443 [ACK] Seq=5665 Ack=291134 Win=65535 Len=0"
"251","1.385294168","23.56.225.242","192.168.129.132","TLSv1.3","2958","DATA[19]"
"252","1.385398753","192.168.129.132","23.56.225.242","TCP","54","44326  >  443 [ACK] Seq=5665 Ack=294038 Win=65535 Len=0"
"253","1.385918363","23.56.225.242","192.168.129.132","TCP","2958","443  >  44326 [PSH, ACK] Seq=294038 Ack=5665 Win=64240 Len=2904 [TCP PDU reassembled in 259]"
"254","1.385951714","192.168.129.132","23.56.225.242","TCP","54","44326  >  443 [ACK] Seq=5665 Ack=296942 Win=65535 Len=0"
"255","1.386421041","23.56.225.242","192.168.129.132","TCP","2958","443  >  44326 [PSH, ACK] Seq=296942 Ack=5665 Win=64240 Len=2904 [TCP PDU reassembled in 259]"
"256","1.386452880","192.168.129.132","23.56.225.242","TCP","54","44326  >  443 [ACK] Seq=5665 Ack=299846 Win=65535 Len=0"
"257","1.389076263","23.56.225.242","192.168.129.132","TCP","5862","443  >  44326 [PSH, ACK] Seq=299846 Ack=5665 Win=64240 Len=5808 [TCP PDU reassembled in 259]"
"258","1.389112053","192.168.129.132","23.56.225.242","TCP","54","44326  >  443 [ACK] Seq=5665 Ack=305654 Win=65535 Len=0"
"259","1.390513063","23.56.225.242","192.168.129.132","TLSv1.3","2958","DATA[19]"
"260","1.390546552","192.168.129.132","23.56.225.242","TCP","54","44326  >  443 [ACK] Seq=5665 Ack=308558 Win=65535 Len=0"
"261","1.391335551","23.56.225.242","192.168.129.132","TCP","2958","443  >  44326 [PSH, ACK] Seq=308558 Ack=5665 Win=64240 Len=2904 [TCP PDU reassembled in 269]"
"262","1.391360949","192.168.129.132","23.56.225.242","TCP","54","44326  >  443 [ACK] Seq=5665 Ack=311462 Win=65535 Len=0"
"263","1.391622062","23.56.225.242","192.168.129.132","TCP","2958","443  >  44326 [PSH, ACK] Seq=311462 Ack=5665 Win=64240 Len=2904 [TCP PDU reassembled in 269]"
"264","1.391740121","192.168.129.132","23.56.225.242","TCP","54","44326  >  443 [ACK] Seq=5665 Ack=314366 Win=65535 Len=0"
"265","1.392048029","23.56.225.242","192.168.129.132","TCP","2958","443  >  44326 [PSH, ACK] Seq=314366 Ack=5665 Win=64240 Len=2904 [TCP PDU reassembled in 269]"
"266","1.392061153","192.168.129.132","23.56.225.242","TCP","54","44326  >  443 [ACK] Seq=5665 Ack=317270 Win=65535 Len=0"
"267","1.394331513","23.56.225.242","192.168.129.132","TCP","5862","443  >  44326 [PSH, ACK] Seq=317270 Ack=5665 Win=64240 Len=5808 [TCP PDU reassembled in 269]"
"268","1.394383062","192.168.129.132","23.56.225.242","TCP","54","44326  >  443 [ACK] Seq=5665 Ack=323078 Win=65535 Len=0"
"269","1.395135461","23.56.225.242","192.168.129.132","TLSv1.3","5862","DATA[19]"
"270","1.395169370","192.168.129.132","23.56.225.242","TCP","54","44326  >  443 [ACK] Seq=5665 Ack=328886 Win=65535 Len=0"
"271","1.395905559","23.56.225.242","192.168.129.132","TCP","2958","443  >  44326 [PSH, ACK] Seq=328886 Ack=5665 Win=64240 Len=2904 [TCP PDU reassembled in 274]"
"272","1.395937651","192.168.129.132","23.56.225.242","TCP","54","44326  >  443 [ACK] Seq=5665 Ack=331790 Win=65535 Len=0"
"273","1.398828484","23.56.225.242","192.168.129.132","TCP","5862","443  >  44326 [PSH, ACK] Seq=331790 Ack=5665 Win=64240 Len=5808 [TCP PDU reassembled in 274]"
"274","1.398828952","23.56.225.242","192.168.129.132","TLSv1.3","4410","DATA[19]"
"275","1.398875573","192.168.129.132","23.56.225.242","TCP","54","44326  >  443 [ACK] Seq=5665 Ack=337598 Win=65535 Len=0"
"276","1.398988378","192.168.129.132","23.56.225.242","TCP","54","44326  >  443 [ACK] Seq=5665 Ack=341954 Win=65535 Len=0"
"277","1.400460510","23.56.225.242","192.168.129.132","TCP","4410","443  >  44326 [PSH, ACK] Seq=341954 Ack=5665 Win=64240 Len=4356 [TCP PDU reassembled in 283]"
"278","1.400508815","192.168.129.132","23.56.225.242","TCP","54","44326  >  443 [ACK] Seq=5665 Ack=346310 Win=65535 Len=0"
"279","1.401593908","23.56.225.242","192.168.129.132","TCP","5862","443  >  44326 [PSH, ACK] Seq=346310 Ack=5665 Win=64240 Len=5808 [TCP PDU reassembled in 283]"
"280","1.401622941","192.168.129.132","23.56.225.242","TCP","54","44326  >  443 [ACK] Seq=5665 Ack=352118 Win=65535 Len=0"
"281","1.401929419","23.56.225.242","192.168.129.132","TCP","2958","443  >  44326 [PSH, ACK] Seq=352118 Ack=5665 Win=64240 Len=2904 [TCP PDU reassembled in 283]"
"282","1.401948785","192.168.129.132","23.56.225.242","TCP","54","44326  >  443 [ACK] Seq=5665 Ack=355022 Win=65535 Len=0"
"283","1.402363550","23.56.225.242","192.168.129.132","TLSv1.3","2958","DATA[19]"
"284","1.402394077","192.168.129.132","23.56.225.242","TCP","54","44326  >  443 [ACK] Seq=5665 Ack=357926 Win=65535 Len=0"
"285","1.403418341","23.56.225.242","192.168.129.132","TCP","2958","443  >  44326 [PSH, ACK] Seq=357926 Ack=5665 Win=64240 Len=2904 [TCP PDU reassembled in 287]"
"286","1.403464412","192.168.129.132","23.56.225.242","TCP","54","44326  >  443 [ACK] Seq=5665 Ack=360830 Win=65535 Len=0"
"287","1.406981741","23.56.225.242","192.168.129.132","TLSv1.3","14574","DATA[19]"
"288","1.407149055","192.168.129.132","23.56.225.242","TCP","54","44326  >  443 [ACK] Seq=5665 Ack=375350 Win=65535 Len=0"
"289","1.407539157","23.56.225.242","192.168.129.132","TCP","2958","443  >  44326 [PSH, ACK] Seq=375350 Ack=5665 Win=64240 Len=2904 [TCP PDU reassembled in 295]"
"290","1.407582724","192.168.129.132","23.56.225.242","TCP","54","44326  >  443 [ACK] Seq=5665 Ack=378254 Win=65535 Len=0"
"291","1.409118720","23.56.225.242","192.168.129.132","TCP","5862","443  >  44326 [PSH, ACK] Seq=378254 Ack=5665 Win=64240 Len=5808 [TCP PDU reassembled in 295]"
"292","1.409170086","192.168.129.132","23.56.225.242","TCP","54","44326  >  443 [ACK] Seq=5665 Ack=384062 Win=65535 Len=0"
"293","1.409749520","23.56.225.242","192.168.129.132","TCP","2958","443  >  44326 [PSH, ACK] Seq=384062 Ack=5665 Win=64240 Len=2904 [TCP PDU reassembled in 295]"
"294","1.409789611","192.168.129.132","23.56.225.242","TCP","54","44326  >  443 [ACK] Seq=5665 Ack=386966 Win=65535 Len=0"
"295","1.411293101","23.56.225.242","192.168.129.132","TLSv1.3","2958","DATA[19]"
"296","1.411344236","192.168.129.132","23.56.225.242","TCP","54","44326  >  443 [ACK] Seq=5665 Ack=389870 Win=65535 Len=0"
"297","1.411706905","23.56.225.242","192.168.129.132","TCP","5862","443  >  44326 [PSH, ACK] Seq=389870 Ack=5665 Win=64240 Len=5808 [TCP PDU reassembled in 303]"
"298","1.411738890","192.168.129.132","23.56.225.242","TCP","54","44326  >  443 [ACK] Seq=5665 Ack=395678 Win=65535 Len=0"
"299","1.412633205","23.56.225.242","192.168.129.132","TCP","5862","443  >  44326 [PSH, ACK] Seq=395678 Ack=5665 Win=64240 Len=5808 [TCP PDU reassembled in 303]"
"300","1.412672582","192.168.129.132","23.56.225.242","TCP","54","44326  >  443 [ACK] Seq=5665 Ack=401486 Win=65535 Len=0"
"301","1.412893133","23.56.225.242","192.168.129.132","TCP","2958","443  >  44326 [PSH, ACK] Seq=401486 Ack=5665 Win=64240 Len=2904 [TCP PDU reassembled in 303]"
"302","1.412914815","192.168.129.132","23.56.225.242","TCP","54","44326  >  443 [ACK] Seq=5665 Ack=404390 Win=65535 Len=0"
"303","1.414244488","23.56.225.242","192.168.129.132","TLSv1.3","10218","DATA[19]"
"304","1.414282546","192.168.129.132","23.56.225.242","TCP","54","44326  >  443 [ACK] Seq=5665 Ack=414554 Win=65535 Len=0"
"305","1.416551441","23.56.225.242","192.168.129.132","TCP","7314","443  >  44326 [PSH, ACK] Seq=414554 Ack=5665 Win=64240 Len=7260 [TCP PDU reassembled in 307]"
"306","1.416585925","192.168.129.132","23.56.225.242","TCP","54","44326  >  443 [ACK] Seq=5665 Ack=421814 Win=65535 Len=0"
"307","1.417557359","23.56.225.242","192.168.129.132","TLSv1.3","4410","DATA[19]"
"308","1.417558140","23.56.225.242","192.168.129.132","TCP","2958","443  >  44326 [PSH, ACK] Seq=426170 Ack=5665 Win=64240 Len=2904 [TCP PDU reassembled in 313]"
"309","1.417620536","192.168.129.132","23.56.225.242","TCP","54","44326  >  443 [ACK] Seq=5665 Ack=426170 Win=65535 Len=0"
"310","1.417768355","192.168.129.132","23.56.225.242","TCP","54","44326  >  443 [ACK] Seq=5665 Ack=429074 Win=65535 Len=0"
"311","1.418608956","23.56.225.242","192.168.129.132","TCP","7314","443  >  44326 [PSH, ACK] Seq=429074 Ack=5665 Win=64240 Len=7260 [TCP PDU reassembled in 313]"
"312","1.418629224","192.168.129.132","23.56.225.242","TCP","54","44326  >  443 [ACK] Seq=5665 Ack=436334 Win=65535 Len=0"
"313","1.418972601","23.56.225.242","192.168.129.132","TLSv1.3","7314","DATA[19]"
"314","1.418999255","192.168.129.132","23.56.225.242","TCP","54","44326  >  443 [ACK] Seq=5665 Ack=443594 Win=65535 Len=0"
"315","1.420064751","23.56.225.242","192.168.129.132","TCP","7314","443  >  44326 [PSH, ACK] Seq=443594 Ack=5665 Win=64240 Len=7260 [TCP PDU reassembled in 317]"
"316","1.420086428","192.168.129.132","23.56.225.242","TCP","54","44326  >  443 [ACK] Seq=5665 Ack=450854 Win=65535 Len=0"
"317","1.421384151","23.56.225.242","192.168.129.132","TLSv1.3","7314","DATA[19]"
"318","1.421445361","192.168.129.132","23.56.225.242","TCP","54","44326  >  443 [ACK] Seq=5665 Ack=458114 Win=65535 Len=0"
"319","1.422074625","23.56.225.242","192.168.129.132","TCP","7314","443  >  44326 [PSH, ACK] Seq=458114 Ack=5665 Win=64240 Len=7260 [TCP PDU reassembled in 321]"
"320","1.422119548","192.168.129.132","23.56.225.242","TCP","54","44326  >  443 [ACK] Seq=5665 Ack=465374 Win=65535 Len=0"
"321","1.423325315","23.56.225.242","192.168.129.132","TLSv1.3","14574","DATA[19]"
"322","1.423373070","192.168.129.132","23.56.225.242","TCP","54","44326  >  443 [ACK] Seq=5665 Ack=479894 Win=65535 Len=0"
"323","1.424055664","23.56.225.242","192.168.129.132","HTTP2","7314","DATA[19]"
"324","1.424089837","192.168.129.132","23.56.225.242","TCP","54","44326  >  443 [ACK] Seq=5665 Ack=487154 Win=65535 Len=0"
"325","1.425644618","23.56.225.242","192.168.129.132","HTTP2","13122","DATA[23], DATA[27]"
"326","1.425695654","192.168.129.132","23.56.225.242","TCP","54","44326  >  443 [ACK] Seq=5665 Ack=500222 Win=65535 Len=0"
"327","1.427139468","23.56.225.242","192.168.129.132","HTTP2","10218","HEADERS[29]: 200 OK, HEADERS[35]: 200 OK"
"328","1.427139919","23.56.225.242","192.168.129.132","TCP","4410","443  >  44326 [PSH, ACK] Seq=510386 Ack=5665 Win=64240 Len=4356 [TCP PDU reassembled in 331]"
"329","1.427198103","192.168.129.132","23.56.225.242","TCP","54","44326  >  443 [ACK] Seq=5665 Ack=510386 Win=65535 Len=0"
"330","1.427335869","192.168.129.132","23.56.225.242","TCP","54","44326  >  443 [ACK] Seq=5665 Ack=514742 Win=65535 Len=0"
"331","1.431886640","23.56.225.242","192.168.129.132","TLSv1.3","7314","DATA[35]"
"332","1.431925350","192.168.129.132","23.56.225.242","TCP","54","44326  >  443 [ACK] Seq=5665 Ack=522002 Win=65535 Len=0"
"333","1.432177226","23.56.225.242","192.168.129.132","TCP","11670","443  >  44326 [PSH, ACK] Seq=522002 Ack=5665 Win=64240 Len=11616 [TCP PDU reassembled in 334]"
"334","1.432253323","23.56.225.242","192.168.129.132","TLSv1.3","7314","DATA[19]"
"335","1.432253451","23.56.225.242","192.168.129.132","TCP","2958","443  >  44326 [PSH, ACK] Seq=540878 Ack=5665 Win=64240 Len=2904 [TCP PDU reassembled in 338]"
"336","1.432253485","23.56.225.242","192.168.129.132","TCP","1506","443  >  44326 [PSH, ACK] Seq=543782 Ack=5665 Win=64240 Len=1452 [TCP PDU reassembled in 338]"
"337","1.432336421","23.56.225.242","192.168.129.132","TCP","5862","443  >  44326 [PSH, ACK] Seq=545234 Ack=5665 Win=64240 Len=5808 [TCP PDU reassembled in 338]"
"338","1.432586205","23.56.225.242","192.168.129.132","TLSv1.3","7314","DATA[19]"
"339","1.435067741","23.56.225.242","192.168.129.132","TCP","5862","443  >  44326 [PSH, ACK] Seq=558302 Ack=5665 Win=64240 Len=5808 [TCP PDU reassembled in 340]"
"340","1.436128879","23.56.225.242","192.168.129.132","TLSv1.3","7314","DATA[19]"
"341","1.436343657","23.56.225.242","192.168.129.132","TCP","4938","443  >  44326 [PSH, ACK] Seq=571370 Ack=5665 Win=64240 Len=4884 [TCP PDU reassembled in 343]"
"342","1.438144131","192.168.129.132","23.56.225.242","TCP","54","44326  >  443 [ACK] Seq=5665 Ack=576254 Win=65535 Len=0"
"343","1.439471113","23.56.225.242","192.168.129.132","TLSv1.3","10218","DATA[19]"
"344","1.439471434","23.56.225.242","192.168.129.132","TCP","4410","443  >  44326 [PSH, ACK] Seq=586418 Ack=5665 Win=64240 Len=4356 [TCP PDU reassembled in 348]"
"345","1.439514155","192.168.129.132","23.56.225.242","TCP","54","44326  >  443 [ACK] Seq=5665 Ack=586418 Win=65535 Len=0"
"346","1.442580549","23.56.225.242","192.168.129.132","TCP","4410","443  >  44326 [PSH, ACK] Seq=590774 Ack=5665 Win=64240 Len=4356 [TCP PDU reassembled in 348]"
"347","1.442580751","23.56.225.242","192.168.129.132","TCP","2958","443  >  44326 [PSH, ACK] Seq=595130 Ack=5665 Win=64240 Len=2904 [TCP PDU reassembled in 348]"
"348","1.445341347","23.56.225.242","192.168.129.132","TLSv1.3","7314","DATA[19]"
"349","1.446739991","23.56.225.242","192.168.129.132","TCP","7314","443  >  44326 [PSH, ACK] Seq=605294 Ack=5665 Win=64240 Len=7260 [TCP PDU reassembled in 350]"
"350","1.446833103","23.56.225.242","192.168.129.132","TLSv1.3","7314","DATA[19]"
"351","1.446879018","192.168.129.132","23.56.225.242","HTTP2","90","PRIORITY[41]"
"352","1.447340664","23.56.225.242","192.168.129.132","TCP","60","443  >  44326 [ACK] Seq=619814 Ack=5701 Win=64240 Len=0"
"353","1.448253038","192.168.129.132","23.56.225.242","HTTP2","90","PRIORITY[39]"
"354","1.448445047","192.168.129.132","23.56.225.242","HTTP2","126","PRIORITY[37]"
"355","1.448527030","23.56.225.242","192.168.129.132","TCP","60","443  >  44326 [ACK] Seq=619814 Ack=5737 Win=64240 Len=0"
"356","1.448838641","23.56.225.242","192.168.129.132","TCP","60","443  >  44326 [ACK] Seq=619814 Ack=5809 Win=64240 Len=0"
"357","1.451840310","23.56.225.242","192.168.129.132","TLSv1.3","15498","DATA[19]"
"358","1.451889384","192.168.129.132","23.56.225.242","TCP","54","44326  >  443 [ACK] Seq=5809 Ack=635258 Win=65535 Len=0"
"359","1.452585717","23.56.225.242","192.168.129.132","TCP","8766","443  >  44326 [PSH, ACK] Seq=635258 Ack=5809 Win=64240 Len=8712 [TCP PDU reassembled in 365]"
"360","1.453955793","192.168.129.132","23.56.225.242","TCP","54","44326  >  443 [ACK] Seq=5809 Ack=643970 Win=65535 Len=0"
"361","1.454766578","192.168.129.132","23.56.225.242","HTTP2","233","HEADERS[43]: GET /fonts/Keshet-12-Regular.woff2"
"362","1.454967421","192.168.129.132","23.56.225.242","HTTP2","147","HEADERS[45]: GET /fonts/Keshet-12-Bold.woff2"
"363","1.455136976","23.56.225.242","192.168.129.132","TCP","60","443  >  44326 [ACK] Seq=643970 Ack=5988 Win=64240 Len=0"
"364","1.455137132","23.56.225.242","192.168.129.132","TCP","60","443  >  44326 [ACK] Seq=643970 Ack=6081 Win=64240 Len=0"
"365","1.458823376","23.56.225.242","192.168.129.132","TLSv1.3","16554","DATA[19]"
"366","1.458862408","192.168.129.132","23.56.225.242","TCP","54","44326  >  443 [ACK] Seq=6081 Ack=660470 Win=65535 Len=0"
"367","1.460997279","23.56.225.242","192.168.129.132","TLSv1.3","10218","DATA[19]"
"368","1.461034255","192.168.129.132","23.56.225.242","TCP","54","44326  >  443 [ACK] Seq=6081 Ack=670634 Win=65535 Len=0"
"369","1.461280110","23.56.225.242","192.168.129.132","TCP","5862","443  >  44326 [PSH, ACK] Seq=670634 Ack=6081 Win=64240 Len=5808 [TCP PDU reassembled in 371]"
"370","1.461301864","192.168.129.132","23.56.225.242","TCP","54","44326  >  443 [ACK] Seq=6081 Ack=676442 Win=65535 Len=0"
"371","1.462272873","23.56.225.242","192.168.129.132","TLSv1.3","8766","DATA[19]"
"372","1.462302209","192.168.129.132","23.56.225.242","TCP","54","44326  >  443 [ACK] Seq=6081 Ack=685154 Win=65535 Len=0"
"373","1.465477572","23.56.225.242","192.168.129.132","TLSv1.3","16950","DATA[19]"
"374","1.465530676","192.168.129.132","23.56.225.242","TCP","54","44326  >  443 [ACK] Seq=6081 Ack=702050 Win=65535 Len=0"
"375","1.466596357","23.56.225.242","192.168.129.132","TCP","10218","443  >  44326 [PSH, ACK] Seq=702050 Ack=6081 Win=64240 Len=10164 [TCP PDU reassembled in 377]"
"376","1.466653424","192.168.129.132","23.56.225.242","TCP","54","44326  >  443 [ACK] Seq=6081 Ack=712214 Win=65535 Len=0"
"377","1.467438117","23.56.225.242","192.168.129.132","TLSv1.3","10218","DATA[19]"
"378","1.467476933","192.168.129.132","23.56.225.242","TCP","54","44326  >  443 [ACK] Seq=6081 Ack=722378 Win=65535 Len=0"
"379","1.468534418","23.56.225.242","192.168.129.132","TCP","4410","443  >  44326 [PSH, ACK] Seq=722378 Ack=6081 Win=64240 Len=4356 [TCP PDU reassembled in 380]"
"380","1.468534950","23.56.225.242","192.168.129.132","TLSv1.3","7314","DATA[19]"
"381","1.468589138","192.168.129.132","23.56.225.242","TCP","54","44326  >  443 [ACK] Seq=6081 Ack=726734 Win=65535 Len=0"
"382","1.468798478","192.168.129.132","23.56.225.242","TCP","54","44326  >  443 [ACK] Seq=6081 Ack=733994 Win=65535 Len=0"
"383","1.469546318","23.56.225.242","192.168.129.132","TCP","11670","443  >  44326 [PSH, ACK] Seq=733994 Ack=6081 Win=64240 Len=11616 [TCP PDU reassembled in 385]"
"384","1.469589033","192.168.129.132","23.56.225.242","TCP","54","44326  >  443 [ACK] Seq=6081 Ack=745610 Win=65535 Len=0"
"385","1.470143802","23.56.225.242","192.168.129.132","TLSv1.3","10218","DATA[19]"
"386","1.470192157","192.168.129.132","23.56.225.242","TCP","54","44326  >  443 [ACK] Seq=6081 Ack=755774 Win=65535 Len=0"
"387","1.471439605","23.56.225.242","192.168.129.132","TLSv1.3","11670","DATA[19]"
"388","1.471482883","192.168.129.132","23.56.225.242","TCP","54","44326  >  443 [ACK] Seq=6081 Ack=767390 Win=65535 Len=0"
"389","1.471615520","23.56.225.242","192.168.129.132","TCP","8766","443  >  44326 [PSH, ACK] Seq=767390 Ack=6081 Win=64240 Len=8712 [TCP PDU reassembled in 393]"
"390","1.471615683","23.56.225.242","192.168.129.132","TCP","2958","443  >  44326 [PSH, ACK] Seq=776102 Ack=6081 Win=64240 Len=2904 [TCP PDU reassembled in 393]"
"391","1.471644097","192.168.129.132","23.56.225.242","TCP","54","44326  >  443 [ACK] Seq=6081 Ack=776102 Win=65535 Len=0"
"392","1.471723019","192.168.129.132","23.56.225.242","TCP","54","44326  >  443 [ACK] Seq=6081 Ack=779006 Win=65535 Len=0"
"393","1.472385613","23.56.225.242","192.168.129.132","HTTP2","11670","DATA[19]"
"394","1.472433806","192.168.129.132","23.56.225.242","TCP","54","44326  >  443 [ACK] Seq=6081 Ack=790622 Win=65535 Len=0"
"395","1.473619322","23.56.225.242","192.168.129.132","TLSv1.3","13122","DATA[35]"
"396","1.473666021","192.168.129.132","23.56.225.242","TCP","54","44326  >  443 [ACK] Seq=6081 Ack=803690 Win=65535 Len=0"
"397","1.474168846","23.56.225.242","192.168.129.132","TLSv1.3","13122","DATA[35]"
"398","1.474311943","192.168.129.132","23.56.225.242","TCP","54","44326  >  443 [ACK] Seq=6081 Ack=816758 Win=65535 Len=0"
"399","1.475397145","23.56.225.242","192.168.129.132","TLSv1.3","16026","DATA[35]"
"400","1.475517793","192.168.129.132","23.56.225.242","TCP","54","44326  >  443 [ACK] Seq=6081 Ack=832730 Win=65535 Len=0"
"401","1.476249551","23.56.225.242","192.168.129.132","TCP","10218","443  >  44326 [PSH, ACK] Seq=832730 Ack=6081 Win=64240 Len=10164 [TCP PDU reassembled in 404]"
"402","1.476371265","192.168.129.132","23.56.225.242","TCP","54","44326  >  443 [ACK] Seq=6081 Ack=842894 Win=65535 Len=0"
"403","1.477200649","23.56.225.242","192.168.129.132","TCP","2958","443  >  44326 [PSH, ACK] Seq=842894 Ack=6081 Win=64240 Len=2904 [TCP PDU reassembled in 404]"
"404","1.477201040","23.56.225.242","192.168.129.132","TLSv1.3","13122","DATA[35]"
"405","1.477273744","192.168.129.132","23.56.225.242","TCP","54","44326  >  443 [ACK] Seq=6081 Ack=845798 Win=65535 Len=0"
"406","1.477433295","192.168.129.132","23.56.225.242","TCP","54","44326  >  443 [ACK] Seq=6081 Ack=858866 Win=65535 Len=0"
"407","1.478533717","23.56.225.242","192.168.129.132","TCP","13122","443  >  44326 [PSH, ACK] Seq=858866 Ack=6081 Win=64240 Len=13068 [TCP PDU reassembled in 409]"
"408","1.478593658","192.168.129.132","23.56.225.242","TCP","54","44326  >  443 [ACK] Seq=6081 Ack=871934 Win=65535 Len=0"
"409","1.479394969","23.56.225.242","192.168.129.132","TLSv1.3","7314","DATA[19]"
"410","1.479436788","192.168.129.132","23.56.225.242","TCP","54","44326  >  443 [ACK] Seq=6081 Ack=879194 Win=65535 Len=0"
"411","1.479635222","23.56.225.242","192.168.129.132","TCP","4410","443  >  44326 [PSH, ACK] Seq=879194 Ack=6081 Win=64240 Len=4356 [TCP PDU reassembled in 414]"
"412","1.479649066","192.168.129.132","23.56.225.242","TCP","54","44326  >  443 [ACK] Seq=6081 Ack=883550 Win=65535 Len=0"
"413","1.480349977","23.56.225.242","192.168.129.132","TCP","1506","443  >  44326 [PSH, ACK] Seq=883550 Ack=6081 Win=64240 Len=1452 [TCP PDU reassembled in 414]"
"414","1.480350120","23.56.225.242","192.168.129.132","TLSv1.3","5894","DATA[19]"
"415","1.480391458","192.168.129.132","23.56.225.242","TCP","54","44326  >  443 [ACK] Seq=6081 Ack=890842 Win=65535 Len=0"
"416","1.480606550","23.56.225.242","192.168.129.132","TCP","2926","443  >  44326 [PSH, ACK] Seq=890842 Ack=6081 Win=64240 Len=2872 [TCP PDU reassembled in 420]"
"417","1.480606650","23.56.225.242","192.168.129.132","TCP","2958","443  >  44326 [PSH, ACK] Seq=893714 Ack=6081 Win=64240 Len=2904 [TCP PDU reassembled in 420]"
"418","1.480620095","192.168.129.132","23.56.225.242","TCP","54","44326  >  443 [ACK] Seq=6081 Ack=893714 Win=65535 Len=0"
"419","1.480667935","192.168.129.132","23.56.225.242","TCP","54","44326  >  443 [ACK] Seq=6081 Ack=896618 Win=65535 Len=0"
"420","1.481664335","23.56.225.242","192.168.129.132","HTTP2","8766","DATA[19], HEADERS[37]: 200 OK"
"421","1.481664521","23.56.225.242","192.168.129.132","HTTP2","4410","DATA[37] (PNG), HEADERS[39]: 200 OK"
"422","1.481695895","192.168.129.132","23.56.225.242","TCP","54","44326  >  443 [ACK] Seq=6081 Ack=905330 Win=65535 Len=0"
"423","1.481800462","192.168.129.132","23.56.225.242","TCP","54","44326  >  443 [ACK] Seq=6081 Ack=909686 Win=65535 Len=0"
"424","1.481938442","23.56.225.242","192.168.129.132","HTTP2/XML","715","DATA[39], DATA[41]"
"425","1.505829814","23.56.225.242","192.168.129.132","HTTP2","4766","HEADERS[43]: 200 OK"
"426","1.505863346","192.168.129.132","23.56.225.242","TCP","54","44326  >  443 [ACK] Seq=6081 Ack=915059 Win=65535 Len=0"
"427","1.506122860","23.56.225.242","192.168.129.132","TCP","11670","443  >  44326 [PSH, ACK] Seq=915059 Ack=6081 Win=64240 Len=11616 [TCP PDU reassembled in 429]"
"428","1.506167098","192.168.129.132","23.56.225.242","TCP","54","44326  >  443 [ACK] Seq=6081 Ack=926675 Win=65535 Len=0"
"429","1.506973871","23.56.225.242","192.168.129.132","TLSv1.3","519","DATA[43]"
"430","1.506974365","23.56.225.242","192.168.129.132","TCP","5862","443  >  44326 [PSH, ACK] Seq=927140 Ack=6081 Win=64240 Len=5808 [TCP PDU reassembled in 431]"
"431","1.506974455","23.56.225.242","192.168.129.132","HTTP2","8929","DATA[43]"
"432","1.507034872","192.168.129.132","23.56.225.242","TCP","54","44326  >  443 [ACK] Seq=6081 Ack=932948 Win=65535 Len=0"
"433","1.507189419","192.168.129.132","23.56.225.242","TCP","54","44326  >  443 [ACK] Seq=6081 Ack=941823 Win=65535 Len=0"
"434","1.507543838","23.56.225.242","192.168.129.132","HTTP2","16026","HEADERS[45]: 200 OK"
"435","1.507582205","192.168.129.132","23.56.225.242","TCP","54","44326  >  443 [ACK] Seq=6081 Ack=957795 Win=65535 Len=0"
"436","1.508686928","23.56.225.242","192.168.129.132","TLSv1.3","15862","DATA[45]"
"437","1.508730996","192.168.129.132","23.56.225.242","TCP","54","44326  >  443 [ACK] Seq=6081 Ack=973603 Win=65535 Len=0"
"438","1.571263147","192.168.129.132","23.56.225.242","HTTP2","149","HEADERS[47]: GET /fonts/Keshet-12-SemiBold.woff2"
"439","1.571711053","23.56.225.242","192.168.129.132","TCP","60","443  >  44326 [ACK] Seq=973603 Ack=6176 Win=64240 Len=0"
"440","1.618475962","23.56.225.242","192.168.129.132","HTTP2","7671","HEADERS[47]: 200 OK"
"441","1.618476428","23.56.225.242","192.168.129.132","TCP","5862","443  >  44326 [PSH, ACK] Seq=981220 Ack=6176 Win=64240 Len=5808 [TCP PDU reassembled in 444]"
"442","1.618566068","192.168.129.132","23.56.225.242","TCP","54","44326  >  443 [ACK] Seq=6176 Ack=981220 Win=65535 Len=0"
"443","1.618643533","192.168.129.132","23.56.225.242","TCP","54","44326  >  443 [ACK] Seq=6176 Ack=987028 Win=65535 Len=0"
"444","1.618723680","23.56.225.242","192.168.129.132","TLSv1.3","3392","[TLS segment of a reassembled PDU]"
"445","1.618736094","192.168.129.132","23.56.225.242","TCP","54","44326  >  443 [ACK] Seq=6176 Ack=990366 Win=65535 Len=0"
"446","1.628039875","23.56.225.242","192.168.129.132","HTTP2","14605","DATA[47]"
"447","1.628121931","192.168.129.132","23.56.225.242","TCP","54","44326  >  443 [ACK] Seq=6176 Ack=1004917 Win=65535 Len=0"
"448","1.628273529","23.56.225.242","192.168.129.132","HTTP2","65","DATA[47]"
"449","1.668267879","192.168.129.132","23.56.225.242","TCP","54","44326  >  443 [ACK] Seq=6176 Ack=1004928 Win=65535 Len=0"
"450","1.978644203","192.168.129.132","23.56.225.242","HTTP2","199","HEADERS[49]: POST /c99a4269-161c-4242-a3f0-28d44fa6ce24?"
"451","1.979014296","192.168.129.132","23.56.225.242","HTTP2","1756","DATA[49] (application/x-www-form-urlencoded)"
"452","1.979301402","23.56.225.242","192.168.129.132","TCP","60","443  >  44326 [ACK] Seq=1004928 Ack=6321 Win=64240 Len=0"
"453","1.979483472","23.56.225.242","192.168.129.132","TCP","60","443  >  44326 [ACK] Seq=1004928 Ack=7781 Win=64240 Len=0"
"454","1.979483753","23.56.225.242","192.168.129.132","TCP","60","443  >  44326 [ACK] Seq=1004928 Ack=8023 Win=64240 Len=0"
"455","1.988506607","192.168.129.132","23.56.225.242","HTTP2","161","HEADERS[51]: POST /c99a4269-161c-4242-a3f0-28d44fa6ce24?"
"456","1.988856488","192.168.129.132","23.56.225.242","HTTP2","2581","DATA[51] (application/x-www-form-urlencoded)"
"457","1.988990634","23.56.225.242","192.168.129.132","TCP","60","443  >  44326 [ACK] Seq=1004928 Ack=8130 Win=64240 Len=0"
"458","1.989229805","23.56.225.242","192.168.129.132","TCP","60","443  >  44326 [ACK] Seq=1004928 Ack=9590 Win=64240 Len=0"
"459","1.989230217","23.56.225.242","192.168.129.132","TCP","60","443  >  44326 [ACK] Seq=1004928 Ack=10657 Win=64240 Len=0"
"460","2.069839041","23.56.225.242","192.168.129.132","HTTP2","855","DATA[49] (text/plain)"
"461","2.069933660","192.168.129.132","23.56.225.242","TCP","54","44326  >  443 [ACK] Seq=10657 Ack=1005729 Win=65535 Len=0"
"462","2.095020943","23.56.225.242","192.168.129.132","HTTP2","615","DATA[51] (text/plain)"
"463","2.095107104","192.168.129.132","23.56.225.242","TCP","54","44326  >  443 [ACK] Seq=10657 Ack=1006290 Win=65535 Len=0"
"464","2.454545798","192.168.129.132","192.168.129.2","DNS","75","Standard query 0x5782 A mass.mako.co.il"
"465","2.454942774","192.168.129.132","192.168.129.2","DNS","75","Standard query 0x325c HTTPS mass.mako.co.il"
"466","2.463466424","192.168.129.2","192.168.129.132","DNS","167","Standard query response 0x5782 A mass.mako.co.il CNAME wilcard.mako.co.il.edgekey.net CNAME e974.b.akamaiedge.net A 23.56.225.242"
"467","2.463466984","192.168.129.2","192.168.129.132","DNS","212","Standard query response 0x325c HTTPS mass.mako.co.il CNAME wilcard.mako.co.il.edgekey.net CNAME e974.b.akamaiedge.net SOA n0b.akamaiedge.net"
"468","2.469578162","192.168.129.132","23.56.225.242","TCP","74","60592  >  443 [SYN] Seq=0 Win=64240 Len=0 MSS=1460 SACK_PERM TSval=3058960740 TSecr=0 WS=128"
"469","2.521088153","23.56.225.242","192.168.129.132","TCP","60","443  >  60592 [SYN, ACK] Seq=0 Ack=1 Win=64240 Len=0 MSS=1460"
"470","2.521421389","192.168.129.132","23.56.225.242","TCP","54","60592  >  443 [ACK] Seq=1 Ack=1 Win=64240 Len=0"
"471","2.526561604","192.168.129.132","23.56.225.242","TLSv1.3","2114","Client Hello (SNI=mass.mako.co.il)"
"472","2.527168272","23.56.225.242","192.168.129.132","TCP","60","443  >  60592 [ACK] Seq=1 Ack=1461 Win=64240 Len=0"
"473","2.527168831","23.56.225.242","192.168.129.132","TCP","60","443  >  60592 [ACK] Seq=1 Ack=2061 Win=64240 Len=0"
"474","2.572981475","192.168.129.132","23.56.225.242","TCP","74","60598  >  443 [SYN] Seq=0 Win=64240 Len=0 MSS=1460 SACK_PERM TSval=3058960843 TSecr=0 WS=128"
"475","2.596838752","192.168.129.132","23.56.225.242","HTTP2","144","HEADERS[53]: GET /2023/07/11/Parliament_3a_X5_re.jpg"
"476","2.598271849","23.56.225.242","192.168.129.132","TCP","60","443  >  44326 [ACK] Seq=1006290 Ack=10747 Win=64240 Len=0"
"477","2.598308796","192.168.129.132","23.56.225.242","HTTP2","142","HEADERS[55]: GET /2021/05/23/haparmlament_logo.png"
"478","2.598815344","23.56.225.242","192.168.129.132","TCP","60","443  >  44326 [ACK] Seq=1006290 Ack=10835 Win=64240 Len=0"
"479","2.623499120","23.56.225.242","192.168.129.132","TCP","60","443  >  60598 [SYN, ACK] Seq=0 Ack=1 Win=64240 Len=0 MSS=1460"
"480","2.623499308","23.56.225.242","192.168.129.132","TLSv1.3","318","Server Hello, Change Cipher Spec, Encrypted Extensions, Finished"
"481","2.623556985","192.168.129.132","23.56.225.242","TCP","54","60598  >  443 [ACK] Seq=1 Ack=1 Win=64240 Len=0"
"482","2.623721085","192.168.129.132","23.56.225.242","TCP","54","60592  >  443 [ACK] Seq=2061 Ack=265 Win=63976 Len=0"
"483","2.631233059","192.168.129.132","23.56.225.242","TLSv1.3","2114","Client Hello (SNI=mass.mako.co.il)"
"484","2.631769441","23.56.225.242","192.168.129.132","TCP","60","443  >  60598 [ACK] Seq=1 Ack=1461 Win=64240 Len=0"
"485","2.631769847","23.56.225.242","192.168.129.132","TCP","60","443  >  60598 [ACK] Seq=1 Ack=2061 Win=64240 Len=0"
"486","2.632347836","192.168.129.132","23.56.225.242","TLSv1.3","134","Change Cipher Spec, Finished"
"487","2.633020357","23.56.225.242","192.168.129.132","TCP","60","443  >  60592 [ACK] Seq=265 Ack=2141 Win=64240 Len=0"
"488","2.637459781","192.168.129.132","23.56.225.242","HTTP2","146","Magic, SETTINGS[0], WINDOW_UPDATE[0]"
"489","2.638029348","23.56.225.242","192.168.129.132","TCP","60","443  >  60592 [ACK] Seq=265 Ack=2233 Win=64240 Len=0"
"490","2.638100195","192.168.129.132","23.56.225.242","TCP","54","60598  >  443 [FIN, ACK] Seq=2061 Ack=1 Win=64240 Len=0"
"491","2.638688164","23.56.225.242","192.168.129.132","TCP","60","443  >  60598 [ACK] Seq=1 Ack=2062 Win=64239 Len=0"
"492","2.640127029","192.168.129.132","23.56.225.242","HTTP2","500","HEADERS[1]: GET /ClicksStatistics/isAbroad.jsp"
"493","2.640708092","192.168.129.132","23.56.225.242","HTTP2","186","HEADERS[3]: GET /ClicksStatistics/entitlementsServicesV2.jsp?et=gdt&deviceId=d75782f5-ec03-474c-8ad0-1f4e3192bda6&appGroup=1"
"494","2.640974972","23.56.225.242","192.168.129.132","TCP","60","443  >  60592 [ACK] Seq=265 Ack=2679 Win=64240 Len=0"
"495","2.640975392","23.56.225.242","192.168.129.132","TCP","60","443  >  60592 [ACK] Seq=265 Ack=2811 Win=64240 Len=0"
"496","2.645473316","23.56.225.242","192.168.129.132","HTTP2","297","HEADERS[53]: 200 OK"
"497","2.645690501","192.168.129.132","23.56.225.242","TCP","54","44326  >  443 [ACK] Seq=10835 Ack=1006533 Win=65535 Len=0"
"498","2.645980170","23.56.225.242","192.168.129.132","TCP","13122","443  >  44326 [PSH, ACK] Seq=1006533 Ack=10835 Win=64240 Len=13068 [TCP PDU reassembled in 500]"
"499","2.646011570","192.168.129.132","23.56.225.242","TCP","54","44326  >  443 [ACK] Seq=10835 Ack=1019601 Win=65535 Len=0"
"500","2.646343125","23.56.225.242","192.168.129.132","TLSv1.3","3392","[TLS segment of a reassembled PDU]"
"501","2.646343300","23.56.225.242","192.168.129.132","HTTP2","8766","DATA[53]"
"502","2.646374546","192.168.129.132","23.56.225.242","TCP","54","44326  >  443 [ACK] Seq=10835 Ack=1022939 Win=65535 Len=0"
"503","2.646466652","192.168.129.132","23.56.225.242","TCP","54","44326  >  443 [ACK] Seq=10835 Ack=1031651 Win=65535 Len=0"
"504","2.646603217","23.56.225.242","192.168.129.132","TLSv1.3","7779","[TLS segment of a reassembled PDU]"
"505","2.646603407","23.56.225.242","192.168.129.132","HTTP2","20382","DATA[53]"
"506","2.646628508","192.168.129.132","23.56.225.242","TCP","54","44326  >  443 [ACK] Seq=10835 Ack=1039376 Win=65535 Len=0"
"507","2.646708470","192.168.129.132","23.56.225.242","TCP","54","44326  >  443 [ACK] Seq=10835 Ack=1059704 Win=65535 Len=0"
"508","2.647614737","23.56.225.242","192.168.129.132","TLSv1.3","14574","DATA[53]"
"509","2.647652568","192.168.129.132","23.56.225.242","TCP","54","44326  >  443 [ACK] Seq=10835 Ack=1074224 Win=65535 Len=0"
"510","2.647791858","23.56.225.242","192.168.129.132","TCP","5862","443  >  44326 [PSH, ACK] Seq=1074224 Ack=10835 Win=64240 Len=5808 [TCP PDU reassembled in 512]"
"511","2.647813862","192.168.129.132","23.56.225.242","TCP","54","44326  >  443 [ACK] Seq=10835 Ack=1080032 Win=65535 Len=0"
"512","2.648091164","23.56.225.242","192.168.129.132","TLSv1.3","13194","DATA[53]"
"513","2.648117327","192.168.129.132","23.56.225.242","TCP","54","44326  >  443 [ACK] Seq=10835 Ack=1093172 Win=65535 Len=0"
"514","2.648436119","23.56.225.242","192.168.129.132","TCP","2886","443  >  44326 [PSH, ACK] Seq=1093172 Ack=10835 Win=64240 Len=2832 [TCP PDU reassembled in 518]"
"515","2.648436220","23.56.225.242","192.168.129.132","TCP","4410","443  >  44326 [PSH, ACK] Seq=1096004 Ack=10835 Win=64240 Len=4356 [TCP PDU reassembled in 518]"
"516","2.648470350","192.168.129.132","23.56.225.242","TCP","54","44326  >  443 [ACK] Seq=10835 Ack=1096004 Win=65535 Len=0"
"517","2.648551810","192.168.129.132","23.56.225.242","TCP","54","44326  >  443 [ACK] Seq=10835 Ack=1100360 Win=65535 Len=0"
"518","2.650376112","23.56.225.242","192.168.129.132","TLSv1.3","20382","DATA[53]"
"519","2.650421682","192.168.129.132","23.56.225.242","TCP","54","44326  >  443 [ACK] Seq=10835 Ack=1120688 Win=65535 Len=0"
"520","2.650597568","23.56.225.242","192.168.129.132","TLSv1.3","10218","DATA[53]"
"521","2.650597728","23.56.225.242","192.168.129.132","TLSv1.3","10218","DATA[53]"
"522","2.650626073","192.168.129.132","23.56.225.242","TCP","54","44326  >  443 [ACK] Seq=10835 Ack=1130852 Win=65535 Len=0"
"523","2.650703552","192.168.129.132","23.56.225.242","TCP","54","44326  >  443 [ACK] Seq=10835 Ack=1141016 Win=65535 Len=0"
"524","2.651630514","23.56.225.242","192.168.129.132","TCP","4410","443  >  44326 [PSH, ACK] Seq=1141016 Ack=10835 Win=64240 Len=4356 [TCP PDU reassembled in 525]"
"525","2.651630923","23.56.225.242","192.168.129.132","TLSv1.3","13122","DATA[53]"
"526","2.651694826","192.168.129.132","23.56.225.242","TCP","54","44326  >  443 [ACK] Seq=10835 Ack=1145372 Win=65535 Len=0"
"527","2.651827038","192.168.129.132","23.56.225.242","TCP","54","44326  >  443 [ACK] Seq=10835 Ack=1158440 Win=65535 Len=0"
"528","2.652034998","23.56.225.242","192.168.129.132","TCP","2958","443  >  44326 [PSH, ACK] Seq=1158440 Ack=10835 Win=64240 Len=2904 [TCP PDU reassembled in 530]"
"529","2.652035462","23.56.225.242","192.168.129.132","TCP","7314","443  >  44326 [PSH, ACK] Seq=1161344 Ack=10835 Win=64240 Len=7260 [TCP PDU reassembled in 530]"
"530","2.652035555","23.56.225.242","192.168.129.132","TLSv1.3","4410","DATA[53]"
"531","2.652069474","192.168.129.132","23.56.225.242","TCP","54","44326  >  443 [ACK] Seq=10835 Ack=1161344 Win=65535 Len=0"
"532","2.652237146","192.168.129.132","23.56.225.242","TCP","54","44326  >  443 [ACK] Seq=10835 Ack=1168604 Win=65535 Len=0"
"533","2.652363978","192.168.129.132","23.56.225.242","TCP","54","44326  >  443 [ACK] Seq=10835 Ack=1172960 Win=65535 Len=0"
"534","2.652502923","23.56.225.242","192.168.129.132","TCP","11670","443  >  44326 [PSH, ACK] Seq=1172960 Ack=10835 Win=64240 Len=11616 [TCP PDU reassembled in 536]"
"535","2.652529927","192.168.129.132","23.56.225.242","TCP","54","44326  >  443 [ACK] Seq=10835 Ack=1184576 Win=65535 Len=0"
"536","2.653135352","23.56.225.242","192.168.129.132","TLSv1.3","11670","DATA[53]"
"537","2.653164097","192.168.129.132","23.56.225.242","TCP","54","44326  >  443 [ACK] Seq=10835 Ack=1196192 Win=65535 Len=0"
"538","2.653725575","23.56.225.242","192.168.129.132","TLSv1.3","8766","DATA[53]"
"539","2.653754201","192.168.129.132","23.56.225.242","TCP","54","44326  >  443 [ACK] Seq=10835 Ack=1204904 Win=65535 Len=0"
"540","2.655104399","23.56.225.242","192.168.129.132","TCP","8766","443  >  44326 [PSH, ACK] Seq=1204904 Ack=10835 Win=64240 Len=8712 [TCP PDU reassembled in 541]"
"541","2.655105335","23.56.225.242","192.168.129.132","TLSv1.3","8766","DATA[53]"
"542","2.655759729","192.168.129.132","23.56.225.242","TCP","54","44326  >  443 [ACK] Seq=10835 Ack=1213616 Win=65535 Len=0"
"543","2.655880499","192.168.129.132","23.56.225.242","TCP","54","44326  >  443 [ACK] Seq=10835 Ack=1222328 Win=65535 Len=0"
"544","2.656010949","23.56.225.242","192.168.129.132","TCP","2958","443  >  44326 [PSH, ACK] Seq=1222328 Ack=10835 Win=64240 Len=2904 [TCP PDU reassembled in 549]"
"545","2.656011272","23.56.225.242","192.168.129.132","TCP","7314","443  >  44326 [PSH, ACK] Seq=1225232 Ack=10835 Win=64240 Len=7260 [TCP PDU reassembled in 549]"
"546","2.656011336","23.56.225.242","192.168.129.132","TCP","1506","443  >  44326 [PSH, ACK] Seq=1232492 Ack=10835 Win=64240 Len=1452 [TCP PDU reassembled in 549]"
"547","2.656036420","192.168.129.132","23.56.225.242","TCP","54","44326  >  443 [ACK] Seq=10835 Ack=1225232 Win=65535 Len=0"
"548","2.656132318","192.168.129.132","23.56.225.242","TCP","54","44326  >  443 [ACK] Seq=10835 Ack=1233944 Win=65535 Len=0"
"549","2.656145365","23.56.225.242","192.168.129.132","TLSv1.3","13122","DATA[53]"
"550","2.656256776","192.168.129.132","23.56.225.242","TCP","54","44326  >  443 [ACK] Seq=10835 Ack=1247012 Win=65535 Len=0"
"551","2.656376898","23.56.225.242","192.168.129.132","TCP","1506","443  >  44326 [PSH, ACK] Seq=1247012 Ack=10835 Win=64240 Len=1452 [TCP PDU reassembled in 554]"
"552","2.656392062","192.168.129.132","23.56.225.242","TCP","54","44326  >  443 [ACK] Seq=10835 Ack=1248464 Win=65535 Len=0"
"553","2.659167516","23.56.225.242","192.168.129.132","TCP","2958","443  >  44326 [PSH, ACK] Seq=1248464 Ack=10835 Win=64240 Len=2904 [TCP PDU reassembled in 554]"
"554","2.659168085","23.56.225.242","192.168.129.132","TLSv1.3","10218","DATA[53]"
"555","2.659298287","192.168.129.132","23.56.225.242","TCP","54","44326  >  443 [ACK] Seq=10835 Ack=1251368 Win=65535 Len=0"
"556","2.659441532","192.168.129.132","23.56.225.242","TCP","54","44326  >  443 [ACK] Seq=10835 Ack=1261532 Win=65535 Len=0"
"557","2.659660708","23.56.225.242","192.168.129.132","HTTP2","7314","DATA[53]"
"558","2.659661025","23.56.225.242","192.168.129.132","TCP","2958","443  >  44326 [PSH, ACK] Seq=1268792 Ack=10835 Win=64240 Len=2904 [TCP PDU reassembled in 559]"
"559","2.659661087","23.56.225.242","192.168.129.132","TLSv1.3","17478","DATA[53]"
"560","2.659701132","192.168.129.132","23.56.225.242","TCP","54","44326  >  443 [ACK] Seq=10835 Ack=1268792 Win=65535 Len=0"
"561","2.660253553","192.168.129.132","23.56.225.242","TCP","54","44326  >  443 [ACK] Seq=10835 Ack=1271696 Win=65535 Len=0"
"562","2.660366735","192.168.129.132","23.56.225.242","TCP","54","44326  >  443 [ACK] Seq=10835 Ack=1289120 Win=65535 Len=0"
"563","2.660526447","23.56.225.242","192.168.129.132","TCP","10218","443  >  44326 [PSH, ACK] Seq=1289120 Ack=10835 Win=64240 Len=10164 [TCP PDU reassembled in 564]"
"564","2.660526631","23.56.225.242","192.168.129.132","TLSv1.3","13122","DATA[53]"
"565","2.660558891","192.168.129.132","23.56.225.242","TCP","54","44326  >  443 [ACK] Seq=10835 Ack=1299284 Win=65535 Len=0"
"566","2.660647470","192.168.129.132","23.56.225.242","TCP","54","44326  >  443 [ACK] Seq=10835 Ack=1312352 Win=65535 Len=0"
"567","2.660777769","23.56.225.242","192.168.129.132","TLSv1.3","16026","DATA[53]"
"568","2.660799672","192.168.129.132","23.56.225.242","TCP","54","44326  >  443 [ACK] Seq=10835 Ack=1328324 Win=65535 Len=0"
"569","2.660926165","23.56.225.242","192.168.129.132","TCP","4410","443  >  44326 [PSH, ACK] Seq=1328324 Ack=10835 Win=64240 Len=4356 [TCP PDU reassembled in 571]"
"570","2.660945923","192.168.129.132","23.56.225.242","TCP","54","44326  >  443 [ACK] Seq=10835 Ack=1332680 Win=65535 Len=0"
"571","2.662739619","23.56.225.242","192.168.129.132","TLSv1.3","21834","DATA[53]"
"572","2.662798838","192.168.129.132","23.56.225.242","TCP","54","44326  >  443 [ACK] Seq=10835 Ack=1354460 Win=65535 Len=0"
"573","2.663075384","23.56.225.242","192.168.129.132","TCP","8766","443  >  44326 [PSH, ACK] Seq=1354460 Ack=10835 Win=64240 Len=8712 [TCP PDU reassembled in 574]"
"574","2.663075658","23.56.225.242","192.168.129.132","TLSv1.3","8766","DATA[53]"
"575","2.663112520","192.168.129.132","23.56.225.242","TCP","54","44326  >  443 [ACK] Seq=10835 Ack=1363172 Win=65535 Len=0"
"576","2.663259948","192.168.129.132","23.56.225.242","TCP","54","44326  >  443 [ACK] Seq=10835 Ack=1371884 Win=65535 Len=0"
"577","2.663292419","23.56.225.242","192.168.129.132","TCP","4410","443  >  44326 [PSH, ACK] Seq=1371884 Ack=10835 Win=64240 Len=4356 [TCP PDU reassembled in 580]"
"578","2.663345497","192.168.129.132","23.56.225.242","TCP","54","44326  >  443 [ACK] Seq=10835 Ack=1376240 Win=65535 Len=0"
"579","2.663814070","23.56.225.242","192.168.129.132","TCP","1506","443  >  44326 [PSH, ACK] Seq=1376240 Ack=10835 Win=64240 Len=1452 [TCP PDU reassembled in 580]"
"580","2.663814276","23.56.225.242","192.168.129.132","TLSv1.3","13122","DATA[53]"
"581","2.663851260","192.168.129.132","23.56.225.242","TCP","54","44326  >  443 [ACK] Seq=10835 Ack=1377692 Win=65535 Len=0"
"582","2.663953130","192.168.129.132","23.56.225.242","TCP","54","44326  >  443 [ACK] Seq=10835 Ack=1390760 Win=65535 Len=0"
"583","2.664043944","23.56.225.242","192.168.129.132","TCP","5862","443  >  44326 [PSH, ACK] Seq=1390760 Ack=10835 Win=64240 Len=5808 [TCP PDU reassembled in 585]"
"584","2.664067176","192.168.129.132","23.56.225.242","TCP","54","44326  >  443 [ACK] Seq=10835 Ack=1396568 Win=65535 Len=0"
"585","2.667687720","23.56.225.242","192.168.129.132","TLSv1.3","13122","DATA[53]"
"586","2.667845363","192.168.129.132","23.56.225.242","TCP","54","44326  >  443 [ACK] Seq=10835 Ack=1409636 Win=65535 Len=0"
"587","2.667975027","23.56.225.242","192.168.129.132","TLSv1.3","13122","DATA[53]"
"588","2.668013847","192.168.129.132","23.56.225.242","TCP","54","44326  >  443 [ACK] Seq=10835 Ack=1422704 Win=65535 Len=0"
"589","2.668147080","23.56.225.242","192.168.129.132","TLSv1.3","10035","DATA[53] (JPEG JFIF image)"
"590","2.668174396","192.168.129.132","23.56.225.242","TCP","54","44326  >  443 [ACK] Seq=10835 Ack=1432685 Win=65535 Len=0"
"591","2.690180281","23.56.225.242","192.168.129.132","TLSv1.3","342","Server Hello, Change Cipher Spec, Application Data, Application Data, Application Data"
"592","2.690259371","192.168.129.132","23.56.225.242","TCP","54","60598  >  443 [RST] Seq=2062 Win=0 Len=0"
"593","2.693291548","23.56.225.242","192.168.129.132","HTTP2","16715","[TLS segment of a reassembled PDU]"
"594","2.693334703","192.168.129.132","23.56.225.242","TCP","54","44326  >  443 [ACK] Seq=10835 Ack=1449346 Win=65535 Len=0"
"595","2.693859775","23.56.225.242","192.168.129.132","HTTP2","5862","DATA[55]"
"596","2.693860076","23.56.225.242","192.168.129.132","TLSv1.3","10683","[TLS segment of a reassembled PDU]"
"597","2.693900250","192.168.129.132","23.56.225.242","TCP","54","44326  >  443 [ACK] Seq=10835 Ack=1455154 Win=65535 Len=0"
"598","2.693950477","192.168.129.132","23.56.225.242","TCP","54","44326  >  443 [ACK] Seq=10835 Ack=1465783 Win=65535 Len=0"
"599","2.695155838","192.168.129.132","23.56.225.242","HTTP2","165","HEADERS[5]: GET /ClicksStatistics/get12History.jsp?deviceId=d75782f5-ec03-474c-8ad0-1f4e3192bda6"
"600","2.695471717","23.56.225.242","192.168.129.132","TCP","60","443  >  60592 [ACK] Seq=265 Ack=2922 Win=64240 Len=0"
"601","2.699974711","23.56.225.242","192.168.129.132","HTTP2","29813","DATA[55] (PNG)"
"602","2.700048888","192.168.129.132","23.56.225.242","TCP","54","44326  >  443 [ACK] Seq=10835 Ack=1495542 Win=65535 Len=0"
"603","2.700540266","23.56.225.242","192.168.129.132","TLSv1.3","341","New Session Ticket"
"604","2.728508882","23.56.225.242","192.168.129.132","HTTP2","146","SETTINGS[0]"
"605","2.733350177","192.168.129.132","23.56.225.242","TCP","54","60592  >  443 [ACK] Seq=2922 Ack=644 Win=63976 Len=0"
"606","2.738724254","192.168.129.132","23.56.225.242","HTTP2","411","HEADERS[57]: GET /2023/11/19/haparlament_01_191123_vod_re_autoOrient_i.jpg"
"607","2.739473499","23.56.225.242","192.168.129.132","TCP","60","443  >  44326 [ACK] Seq=1495542 Ack=11192 Win=64240 Len=0"
"608","2.739870235","192.168.129.132","23.56.225.242","HTTP2","392","HEADERS[59]: GET /2023/11/19/haparlament_02_191123_vod_autoOrient_i.jpg"
"609","2.740431381","23.56.225.242","192.168.129.132","TCP","60","443  >  44326 [ACK] Seq=1495542 Ack=11530 Win=64240 Len=0"
"610","2.740609429","192.168.129.132","23.56.225.242","HTTP2","163","HEADERS[61]: GET /2023/11/19/haparlament_03_191123_vod_autoOrient_i.jpg"
"611","2.740843343","23.56.225.242","192.168.129.132","TCP","60","443  >  44326 [ACK] Seq=1495542 Ack=11639 Win=64240 Len=0"
"612","2.742053587","192.168.129.132","23.56.225.242","HTTP2","85","SETTINGS[0]"
"613","2.742738012","23.56.225.242","192.168.129.132","TCP","60","443  >  60592 [ACK] Seq=644 Ack=2953 Win=64240 Len=0"
"614","2.746869661","192.168.129.132","23.56.225.242","HTTP2","635","HEADERS[63]: GET /mako-vod/_next/static/chunks/pages/mako-vod-56ec0042ec2aec5b.js"
"615","2.747311006","23.56.225.242","192.168.129.132","TCP","60","443  >  44326 [ACK] Seq=1495542 Ack=12220 Win=64240 Len=0"
"616","2.747485405","192.168.129.132","23.56.225.242","HTTP2","478","HEADERS[65]: GET /mako-vod/_next/static/chunks/pages/mako-vod-live-tv/%5B...slug%5D-6ca99bd2265af826.js"
"617","2.747795070","192.168.129.132","23.56.225.242","HTTP2","185","HEADERS[67]: GET /mako-vod/_next/static/chunks/pages/mako-vod-index-4074a8bd5a2b6b7c.js"
"618","2.748259216","23.56.225.242","192.168.129.132","TCP","60","443  >  44326 [ACK] Seq=1495542 Ack=12644 Win=64240 Len=0"
"619","2.748259518","23.56.225.242","192.168.129.132","TCP","60","443  >  44326 [ACK] Seq=1495542 Ack=12775 Win=64240 Len=0"
"620","2.748614179","192.168.129.132","23.56.225.242","HTTP2","186","HEADERS[69]: GET /mako-vod/_next/static/chunks/pages/mako-vod-purchase-8cf777c135ab14ae.js"
"621","2.748989223","23.56.225.242","192.168.129.132","TCP","60","443  >  44326 [ACK] Seq=1495542 Ack=12907 Win=64240 Len=0"
"622","2.749617779","192.168.129.132","23.56.225.242","HTTP2","203","HEADERS[71]: GET /mako-vod/_next/static/chunks/pages/%5Bmako_vod_channel%5D/%5B...episode%5D-9344d91488a436d7.js"
"623","2.750135271","23.56.225.242","192.168.129.132","TCP","60","443  >  44326 [ACK] Seq=1495542 Ack=13056 Win=64240 Len=0"
"624","2.777503805","192.168.129.132","23.56.225.242","HTTP2","172","HEADERS[73]: GET /mako-vod/_next/static/chunks/282-7e656415b873a52b.js"
"625","2.778124360","23.56.225.242","192.168.129.132","TCP","60","443  >  44326 [ACK] Seq=1495542 Ack=13174 Win=64240 Len=0"
"626","2.785706612","23.56.225.242","192.168.129.132","HTTP2","16716","[TLS segment of a reassembled PDU]"
"627","2.785760436","192.168.129.132","23.56.225.242","TCP","54","44326  >  443 [ACK] Seq=13174 Ack=1512204 Win=65535 Len=0"
"628","2.786349978","23.56.225.242","192.168.129.132","HTTP2","16026","DATA[57]"
"629","2.786378031","192.168.129.132","23.56.225.242","TCP","54","44326  >  443 [ACK] Seq=13174 Ack=1528176 Win=65535 Len=0"
"630","2.787268516","23.56.225.242","192.168.129.132","TLSv1.3","9231","DATA[57]"
"631","2.787268723","23.56.225.242","192.168.129.132","HTTP2","3584","DATA[57] (JPEG JFIF image)"
"632","2.787307414","192.168.129.132","23.56.225.242","TCP","54","44326  >  443 [ACK] Seq=13174 Ack=1537353 Win=65535 Len=0"
"633","2.787440054","192.168.129.132","23.56.225.242","TCP","54","44326  >  443 [ACK] Seq=13174 Ack=1540883 Win=65535 Len=0"
"634","2.790038268","192.168.129.132","23.56.225.242","HTTP2","185","HEADERS[75]: GET /mako-vod/_next/static/chunks/pages/mako-vod-login-6cf840fbb598fec5.js"
"635","2.790427937","23.56.225.242","192.168.129.132","TCP","60","443  >  44326 [ACK] Seq=1540883 Ack=13305 Win=64240 Len=0"
"636","2.795310495","23.56.225.242","192.168.129.132","HTTP2","6117","HEADERS[59]: 200 OK"
"637","2.795310912","23.56.225.242","192.168.129.132","TLSv1.3","10652","[TLS segment of a reassembled PDU]"
"638","2.795358913","192.168.129.132","23.56.225.242","TCP","54","44326  >  443 [ACK] Seq=13305 Ack=1546946 Win=65535 Len=0"
"639","2.795479733","192.168.129.132","23.56.225.242","TCP","54","44326  >  443 [ACK] Seq=13305 Ack=1557544 Win=65535 Len=0"
"640","2.796249932","23.56.225.242","192.168.129.132","HTTP2","16491","[TLS segment of a reassembled PDU]"
"641","2.796286653","192.168.129.132","23.56.225.242","TCP","54","44326  >  443 [ACK] Seq=13305 Ack=1573981 Win=65535 Len=0"
"642","2.796906049","23.56.225.242","192.168.129.132","HTTP2","11670","DATA[59]"
"643","2.796943800","192.168.129.132","23.56.225.242","TCP","54","44326  >  443 [ACK] Seq=13305 Ack=1585597 Win=65535 Len=0"
"644","2.797126138","23.56.225.242","192.168.129.132","HTTP2","4161","DATA[59] (JPEG JFIF image)"
"645","2.797186652","192.168.129.132","23.56.225.242","TCP","54","44326  >  443 [ACK] Seq=13305 Ack=1589704 Win=65535 Len=0"
"646","2.799530471","23.56.225.242","192.168.129.132","HTTP2","16026","HEADERS[61]: 200 OK"
"647","2.799575436","192.168.129.132","23.56.225.242","TCP","54","44326  >  443 [ACK] Seq=13305 Ack=1605676 Win=65535 Len=0"
"648","2.799892928","23.56.225.242","192.168.129.132","TLSv1.3","7314","DATA[61]"
"649","2.799893493","23.56.225.242","192.168.129.132","TLSv1.3","13122","DATA[61]"
"650","2.799960201","192.168.129.132","23.56.225.242","TCP","54","44326  >  443 [ACK] Seq=13305 Ack=1612936 Win=65535 Len=0"
"651","2.800172170","192.168.129.132","23.56.225.242","TCP","54","44326  >  443 [ACK] Seq=13305 Ack=1626004 Win=65535 Len=0"
"652","2.800518435","23.56.225.242","192.168.129.132","TCP","10218","443  >  44326 [PSH, ACK] Seq=1626004 Ack=13305 Win=64240 Len=10164 [TCP PDU reassembled in 653]"
"653","2.800518764","23.56.225.242","192.168.129.132","TLSv1.3","5862","DATA[61]"
"654","2.800559308","192.168.129.132","23.56.225.242","TCP","54","44326  >  443 [ACK] Seq=13305 Ack=1636168 Win=65535 Len=0"
"655","2.800697273","23.56.225.242","192.168.129.132","HTTP2","1506","DATA[61] (JPEG JFIF image), HEADERS[63]: 200 OK"
"656","2.800699725","192.168.129.132","23.56.225.242","TCP","54","44326  >  443 [ACK] Seq=13305 Ack=1641976 Win=65535 Len=0"
"657","2.800697604","23.56.225.242","192.168.129.132","HTTP2","9215","DATA[63], DATA[65]"
"658","2.800806597","192.168.129.132","23.56.225.242","TCP","54","44326  >  443 [ACK] Seq=13305 Ack=1652589 Win=65535 Len=0"
"659","2.816760117","23.56.225.242","192.168.129.132","HTTP2","1122","DATA[1] (text/html)"
"660","2.832816623","23.56.225.242","192.168.129.132","HTTP2","14274","HEADERS[73]: 200 OK"
"661","2.832855862","192.168.129.132","23.56.225.242","TCP","54","44326  >  443 [ACK] Seq=13305 Ack=1666809 Win=65535 Len=0"
"662","2.833882826","23.56.225.242","192.168.129.132","HTTP2","10496","DATA[73]"
"663","2.833936819","192.168.129.132","23.56.225.242","TCP","54","44326  >  443 [ACK] Seq=13305 Ack=1677251 Win=65535 Len=0"
"664","2.839471742","23.56.225.242","192.168.129.132","HTTP2","4381","DATA[71]"
"665","2.839518900","192.168.129.132","23.56.225.242","TCP","54","44326  >  443 [ACK] Seq=13305 Ack=1681578 Win=65535 Len=0"
"666","2.842842321","23.56.225.242","192.168.129.132","HTTP2","1715","DATA[75]"
"667","2.842894176","192.168.129.132","23.56.225.242","TCP","54","44326  >  443 [ACK] Seq=13305 Ack=1683239 Win=65535 Len=0"
"668","2.846884976","23.56.225.242","192.168.129.132","HTTP2/JSON","1155","DATA[3], JSON (application/json)"
"669","2.846940827","192.168.129.132","23.56.225.242","TCP","54","60592  >  443 [ACK] Seq=2953 Ack=2813 Win=63976 Len=0"
"670","2.863777423","23.56.225.242","192.168.129.132","HTTP2","1054","HEADERS[5]: 200 OK"
"671","2.863777914","23.56.225.242","192.168.129.132","HTTP2/JSON","98","DATA[5], JSON (application/json)"
"672","2.891228811","192.168.129.132","23.56.225.242","TCP","54","60592  >  443 [ACK] Seq=2953 Ack=3857 Win=63976 Len=0"
"673","3.290669320","192.168.129.132","23.56.225.242","HTTP2","142","HEADERS[7]: GET /appConfig/responsiveConfig.json"
"674","3.291326424","23.56.225.242","192.168.129.132","TCP","60","443  >  60592 [ACK] Seq=3857 Ack=3041 Win=64240 Len=0"
"675","3.338711360","23.56.225.242","192.168.129.132","HTTP2/JSON","1390","DATA[7], JSON (application/json)"
"676","3.380290711","192.168.129.132","23.56.225.242","TCP","54","60592  >  443 [ACK] Seq=3041 Ack=5193 Win=65535 Len=0"
"677","3.967877028","192.168.129.132","23.56.225.242","HTTP2","215","HEADERS[77]: GET /AjaxPage?jspName=promoProcessor.jsp&type=responsive&activity=35"
"678","3.968374233","23.56.225.242","192.168.129.132","TCP","60","443  >  44326 [ACK] Seq=1683239 Ack=13466 Win=64240 Len=0"
"679","4.020307456","23.56.225.242","192.168.129.132","HTTP2","414","DATA[77] (text/html)"
"680","4.062257562","192.168.129.132","23.56.225.242","TCP","54","44326  >  443 [ACK] Seq=13466 Ack=1683599 Win=65535 Len=0"
"681","4.209974171","192.168.129.132","23.56.225.242","HTTP2","123","HEADERS[9]: GET /js/domo/config.json"
"682","4.210698831","23.56.225.242","192.168.129.132","TCP","60","443  >  60592 [ACK] Seq=5193 Ack=3110 Win=64240 Len=0"
"683","4.258577063","23.56.225.242","192.168.129.132","HTTP2/JSON","668","DATA[9], JSON (application/json)"
"684","4.258657561","192.168.129.132","23.56.225.242","TCP","54","60592  >  443 [ACK] Seq=3110 Ack=5807 Win=65535 Len=0"
"685","5.580565636","192.168.129.132","23.56.225.242","HTTP2","323","HEADERS[79]: GET /AjaxPage?jspName=getDomoExternalEvents.jsp&platform=responsive&appId=12plus"
"686","5.580977649","23.56.225.242","192.168.129.132","TCP","60","443  >  44326 [ACK] Seq=1683599 Ack=13735 Win=64240 Len=0"
"687","5.627092664","23.56.225.242","192.168.129.132","HTTP2","4886","DATA[79] (text/html)"
"688","5.627142834","192.168.129.132","23.56.225.242","TCP","54","44326  >  443 [ACK] Seq=13735 Ack=1688431 Win=65535 Len=0"
"689","5.661009964","192.168.129.132","23.56.225.242","HTTP2","89","WINDOW_UPDATE[0]"
"690","5.661953382","23.56.225.242","192.168.129.132","TCP","60","443  >  44326 [ACK] Seq=1688431 Ack=13770 Win=64240 Len=0"
"691","10.230208205","23.56.225.242","192.168.129.132","HTTP2","93","GOAWAY[0]"
"692","10.230356568","192.168.129.132","23.56.225.242","TCP","54","44342  >  443 [ACK] Seq=2108 Ack=591 Win=63976 Len=0"
"693","10.230614991","23.56.225.242","192.168.129.132","TLSv1.3","78","Alert (Level: Warning, Description: Close Notify)"
