"No.","Time","Source","Destination","Protocol","Length","Info"
"1","0.000000000","192.168.129.132","192.168.129.2","DNS","70","Standard query 0x2708 A mako.co.il"
"2","0.000250300","192.168.129.132","192.168.129.2","DNS","70","Standard query 0x3450 AAAA mako.co.il"
"3","0.003353063","192.168.129.132","192.168.129.2","DNS","70","Standard query 0xe4fe HTTPS mako.co.il"
"4","0.006740657","192.168.129.2","192.168.129.132","DNS","127","Standard query response 0x3450 AAAA mako.co.il SOA ns1.bezeqint.net"
"5","0.006740828","192.168.129.2","192.168.129.132","DNS","86","Standard query response 0x2708 A mako.co.il A 66.22.84.55"
"6","0.009015184","192.168.129.2","192.168.129.132","DNS","127","Standard query response 0xe4fe HTTPS mako.co.il SOA ns1.bezeqint.net"
"7","0.012118401","192.168.129.132","192.168.129.2","DNS","70","Standard query 0xfb50 AAAA mako.co.il"
"8","0.018400019","192.168.129.2","192.168.129.132","DNS","127","Standard query response 0xfb50 AAAA mako.co.il SOA ns1.bezeqint.net"
"9","0.582342950","192.168.129.132","192.168.129.2","DNS","74","Standard query 0xb67b A www.mako.co.il"
"10","0.587965846","192.168.129.2","192.168.129.132","DNS","166","Standard query response 0xb67b A www.mako.co.il CNAME wilcard.mako.co.il.edgekey.net CNAME e974.b.akamaiedge.net A 23.56.225.242"
"11","0.597435919","192.168.129.132","23.56.225.242","TCP","74","47500  >  443 [SYN] Seq=0 Win=64240 Len=0 MSS=1460 SACK_PERM TSval=102856103 TSecr=0 WS=128"
"12","0.642750182","23.56.225.242","192.168.129.132","TCP","60","443  >  47500 [SYN, ACK] Seq=0 Ack=1 Win=64240 Len=0 MSS=1460"
"13","0.642849566","192.168.129.132","23.56.225.242","TCP","54","47500  >  443 [ACK] Seq=1 Ack=1 Win=64240 Len=0"
"14","0.643704024","192.168.129.132","23.56.225.242","TLSv1.3","1953","Client Hello (SNI=www.mako.co.il)"
"15","0.644525444","23.56.225.242","192.168.129.132","TCP","60","443  >  47500 [ACK] Seq=1 Ack=1461 Win=64240 Len=0"
"16","0.644525974","23.56.225.242","192.168.129.132","TCP","60","443  >  47500 [ACK] Seq=1 Ack=1900 Win=64240 Len=0"
"17","0.735874034","23.56.225.242","192.168.129.132","TLSv1.3","4054","Server Hello, Change Cipher Spec, Encrypted Extensions, Certificate, Certificate Verify, Finished"
"18","0.735934601","192.168.129.132","23.56.225.242","TCP","54","47500  >  443 [ACK] Seq=1900 Ack=4001 Win=65535 Len=0"
"19","0.742524053","192.168.129.132","23.56.225.242","TLSv1.3","134","Change Cipher Spec, Finished"
"20","0.743104915","23.56.225.242","192.168.129.132","TCP","60","443  >  47500 [ACK] Seq=4001 Ack=1980 Win=64240 Len=0"
"21","0.743259815","192.168.129.132","23.56.225.242","HTTP2","146","Magic, SETTINGS[0], WINDOW_UPDATE[0]"
"22","0.743358725","192.168.129.132","23.56.225.242","HTTP2","461","HEADERS[3]: GET /mako-vod-keshet/parliament, WINDOW_UPDATE[3]"
"23","0.743510128","23.56.225.242","192.168.129.132","TCP","60","443  >  47500 [ACK] Seq=4001 Ack=2072 Win=64240 Len=0"
"24","0.743510286","23.56.225.242","192.168.129.132","TCP","60","443  >  47500 [ACK] Seq=4001 Ack=2479 Win=64240 Len=0"
"25","0.797562761","23.56.225.242","192.168.129.132","TLSv1.3","628","New Session Ticket, New Session Ticket"
"26","0.832944448","23.56.225.242","192.168.129.132","HTTP2","146","SETTINGS[0]"
"27","0.833018801","192.168.129.132","23.56.225.242","TCP","54","47500  >  443 [ACK] Seq=2479 Ack=4667 Win=65535 Len=0"
"28","0.833229875","192.168.129.132","23.56.225.242","HTTP2","85","SETTINGS[0]"
"29","0.833483914","23.56.225.242","192.168.129.132","TCP","60","443  >  47500 [ACK] Seq=4667 Ack=2510 Win=64240 Len=0"
"30","1.047969684","23.56.225.242","192.168.129.132","HTTP2","11992","DATA[3]"
"31","1.048095301","192.168.129.132","23.56.225.242","TCP","54","47500  >  443 [ACK] Seq=2510 Ack=16605 Win=65535 Len=0"
"32","1.049353207","23.56.225.242","192.168.129.132","TCP","2958","443  >  47500 [PSH, ACK] Seq=16605 Ack=2510 Win=64240 Len=2904 [TCP PDU reassembled in 36]"
"33","1.049353775","23.56.225.242","192.168.129.132","TCP","2958","443  >  47500 [PSH, ACK] Seq=19509 Ack=2510 Win=64240 Len=2904 [TCP PDU reassembled in 36]"
"34","1.049497132","192.168.129.132","23.56.225.242","TCP","54","47500  >  443 [ACK] Seq=2510 Ack=19509 Win=65535 Len=0"
"35","1.049646370","192.168.129.132","23.56.225.242","TCP","54","47500  >  443 [ACK] Seq=2510 Ack=22413 Win=65535 Len=0"
"36","1.052041437","23.56.225.242","192.168.129.132","TLSv1.3","2171","DATA[3] (text/html)"
"37","1.052172098","192.168.129.132","23.56.225.242","TCP","54","47500  >  443 [ACK] Seq=2510 Ack=24530 Win=65535 Len=0"
"38","1.230085956","192.168.129.132","192.168.129.2","DNS","74","Standard query 0xab4b A rcs.mako.co.il"
"39","1.230416977","192.168.129.132","192.168.129.2","DNS","74","Standard query 0x3e0f AAAA rcs.mako.co.il"
"40","1.237047702","192.168.129.2","192.168.129.132","DNS","166","Standard query response 0xab4b A rcs.mako.co.il CNAME wilcard.mako.co.il.edgekey.net CNAME e974.b.akamaiedge.net A 23.56.225.242"
"41","1.238144581","192.168.129.132","23.56.225.242","HTTP2","555","HEADERS[5]: GET /mako-vod/_next/static/css/b8722c3c09620fe9.css, WINDOW_UPDATE[5]"
"42","1.238578978","192.168.129.2","192.168.129.132","DNS","211","Standard query response 0x3e0f AAAA rcs.mako.co.il CNAME wilcard.mako.co.il.edgekey.net CNAME e974.b.akamaiedge.net SOA n0b.akamaiedge.net"
"43","1.238981138","23.56.225.242","192.168.129.132","TCP","60","443  >  47500 [ACK] Seq=24530 Ack=3011 Win=64240 Len=0"
"44","1.246373438","192.168.129.132","23.56.225.242","HTTP2","236","HEADERS[7]: GET /mako-vod/_next/static/chunks/webpack-e8a3675f58ffd38e.js, WINDOW_UPDATE[7]"
"45","1.246841956","23.56.225.242","192.168.129.132","TCP","60","443  >  47500 [ACK] Seq=24530 Ack=3193 Win=64240 Len=0"
"46","1.247641850","192.168.129.132","23.56.225.242","HTTP2","173","HEADERS[9]: GET /js/domo/domo-1.0.0.js, WINDOW_UPDATE[9]"
"47","1.247822467","192.168.129.132","23.56.225.242","TCP","74","47512  >  443 [SYN] Seq=0 Win=64240 Len=0 MSS=1460 SACK_PERM TSval=102856754 TSecr=0 WS=128"
"48","1.248029667","23.56.225.242","192.168.129.132","TCP","60","443  >  47500 [ACK] Seq=24530 Ack=3312 Win=64240 Len=0"
"49","1.249309518","192.168.129.132","23.56.225.242","HTTP2","226","HEADERS[11]: GET /mako-vod/_next/static/chunks/framework-bb5c596eafb42b22.js, WINDOW_UPDATE[11]"
"50","1.249635117","23.56.225.242","192.168.129.132","TCP","60","443  >  47500 [ACK] Seq=24530 Ack=3484 Win=64240 Len=0"
"51","1.254544671","192.168.129.132","23.56.225.242","HTTP2","222","HEADERS[13]: GET /mako-vod/_next/static/chunks/main-c12a8689eb43badc.js, WINDOW_UPDATE[13]"
"52","1.254805305","23.56.225.242","192.168.129.132","TCP","60","443  >  47500 [ACK] Seq=24530 Ack=3652 Win=64240 Len=0"
"53","1.255563320","192.168.129.132","23.56.225.242","HTTP2","226","HEADERS[15]: GET /mako-vod/_next/static/chunks/pages/_app-e66778428d690c81.js, WINDOW_UPDATE[15]"
"54","1.255864778","23.56.225.242","192.168.129.132","TCP","60","443  >  47500 [ACK] Seq=24530 Ack=3824 Win=64240 Len=0"
"55","1.256583250","192.168.129.132","23.56.225.242","HTTP2","225","HEADERS[17]: GET /mako-vod/_next/static/chunks/29107295-1494f237b9e407ad.js, WINDOW_UPDATE[17]"
"56","1.257110432","23.56.225.242","192.168.129.132","TCP","60","443  >  47500 [ACK] Seq=24530 Ack=3995 Win=64240 Len=0"
"57","1.257658370","192.168.129.132","23.56.225.242","HTTP2","221","HEADERS[19]: GET /mako-vod/_next/static/chunks/395-6588377c9e31c3e0.js, WINDOW_UPDATE[19]"
"58","1.258291902","23.56.225.242","192.168.129.132","TCP","60","443  >  47500 [ACK] Seq=24530 Ack=4162 Win=64240 Len=0"
"59","1.261224131","192.168.129.132","23.56.225.242","HTTP2","221","HEADERS[21]: GET /mako-vod/_next/static/chunks/524-7f18b27bbaeb3ab7.js, WINDOW_UPDATE[21]"
"60","1.261684105","23.56.225.242","192.168.129.132","TCP","60","443  >  47500 [ACK] Seq=24530 Ack=4329 Win=64240 Len=0"
"61","1.267128001","192.168.129.132","23.56.225.242","HTTP2","221","HEADERS[23]: GET /mako-vod/_next/static/chunks/165-025c23538ec6d36f.js, WINDOW_UPDATE[23]"
"62","1.267604407","23.56.225.242","192.168.129.132","TCP","60","443  >  47500 [ACK] Seq=24530 Ack=4496 Win=64240 Len=0"
"63","1.273530056","192.168.129.132","23.56.225.242","HTTP2","250","HEADERS[25]: GET /mako-vod/_next/static/chunks/pages/%5Bmako_vod_channel%5D/%5Bprogram%5D-ed7758ab8faf74fd.js, WINDOW_UPDATE[25]"
"64","1.274105973","23.56.225.242","192.168.129.132","TCP","60","443  >  47500 [ACK] Seq=24530 Ack=4692 Win=64240 Len=0"
"65","1.275202979","192.168.129.132","192.168.129.2","DNS","74","Standard query 0xecb6 A img.mako.co.il"
"66","1.275745550","192.168.129.132","192.168.129.2","DNS","74","Standard query 0xf337 AAAA img.mako.co.il"
"67","1.276668575","192.168.129.132","23.56.225.242","HTTP2","216","HEADERS[27]: GET /mako-vod/_next/static/6.1.0/_buildManifest.js, WINDOW_UPDATE[27]"
"68","1.277145899","23.56.225.242","192.168.129.132","TCP","60","443  >  47500 [ACK] Seq=24530 Ack=4854 Win=64240 Len=0"
"69","1.277712052","192.168.129.132","23.56.225.242","HTTP2","214","HEADERS[29]: GET /mako-vod/_next/static/6.1.0/_ssgManifest.js, WINDOW_UPDATE[29]"
"70","1.278109499","23.56.225.242","192.168.129.132","TCP","60","443  >  47500 [ACK] Seq=24530 Ack=5014 Win=64240 Len=0"
"71","1.279054777","192.168.129.132","23.56.225.242","HTTP2","285","HEADERS[31]: GET /mako-vod/_next/static/media/plus.a635e74d.png, WINDOW_UPDATE[31]"
"72","1.279610665","23.56.225.242","192.168.129.132","TCP","60","443  >  47500 [ACK] Seq=24530 Ack=5245 Win=64240 Len=0"
"73","1.280246900","192.168.129.132","23.56.225.242","HTTP2","220","HEADERS[33]: GET /mako-vod/_next/static/media/vChecked.8673d80f.png, WINDOW_UPDATE[33]"
"74","1.280889851","23.56.225.242","192.168.129.132","TCP","60","443  >  47500 [ACK] Seq=24530 Ack=5411 Win=64240 Len=0"
"75","1.282259655","192.168.129.2","192.168.129.132","DNS","166","Standard query response 0xecb6 A img.mako.co.il CNAME wilcard.mako.co.il.edgekey.net CNAME e974.b.akamaiedge.net A 23.56.225.242"
"76","1.283983662","192.168.129.2","192.168.129.132","DNS","211","Standard query response 0xf337 AAAA img.mako.co.il CNAME wilcard.mako.co.il.edgekey.net CNAME e974.b.akamaiedge.net SOA n0b.akamaiedge.net"
"77","1.285417999","23.56.225.242","192.168.129.132","HTTP2","3342","HEADERS[5]: 200 OK"
"78","1.286078475","192.168.129.132","23.56.225.242","TCP","54","47500  >  443 [ACK] Seq=5411 Ack=27818 Win=65535 Len=0"
"79","1.286301192","23.56.225.242","192.168.129.132","TCP","2958","443  >  47500 [PSH, ACK] Seq=27818 Ack=5411 Win=64240 Len=2904 [TCP PDU reassembled in 91]"
"80","1.286363764","192.168.129.132","23.56.225.242","TCP","54","47500  >  443 [ACK] Seq=5411 Ack=30722 Win=65535 Len=0"
"81","1.288010535","23.56.225.242","192.168.129.132","TCP","2958","443  >  47500 [PSH, ACK] Seq=30722 Ack=5411 Win=64240 Len=2904 [TCP PDU reassembled in 91]"
"82","1.288034472","192.168.129.132","23.56.225.242","TCP","54","47500  >  443 [ACK] Seq=5411 Ack=33626 Win=65535 Len=0"
"83","1.290041134","23.56.225.242","192.168.129.132","TCP","2958","443  >  47500 [PSH, ACK] Seq=33626 Ack=5411 Win=64240 Len=2904 [TCP PDU reassembled in 91]"
"84","1.290070857","192.168.129.132","23.56.225.242","TCP","54","47500  >  443 [ACK] Seq=5411 Ack=36530 Win=65535 Len=0"
"85","1.291845860","23.56.225.242","192.168.129.132","TCP","2958","443  >  47500 [PSH, ACK] Seq=36530 Ack=5411 Win=64240 Len=2904 [TCP PDU reassembled in 91]"
"86","1.291985166","192.168.129.132","23.56.225.242","TCP","54","47500  >  443 [ACK] Seq=5411 Ack=39434 Win=65535 Len=0"
"87","1.293487935","23.56.225.242","192.168.129.132","TCP","60","443  >  47512 [SYN, ACK] Seq=0 Ack=1 Win=64240 Len=0 MSS=1460"
"88","1.293537262","192.168.129.132","23.56.225.242","TCP","54","47512  >  443 [ACK] Seq=1 Ack=1 Win=64240 Len=0"
"89","1.295218419","192.168.129.132","23.56.225.242","HTTP2","153","HEADERS[35]: GET /2024/10/10/logo-12-desktop.png, WINDOW_UPDATE[35]"
"90","1.295446160","23.56.225.242","192.168.129.132","TCP","60","443  >  47500 [ACK] Seq=39434 Ack=5510 Win=64240 Len=0"
"91","1.295721464","23.56.225.242","192.168.129.132","TLSv1.3","2958","DATA[5]"
"92","1.296000848","192.168.129.132","23.56.225.242","TCP","74","47522  >  443 [SYN] Seq=0 Win=64240 Len=0 MSS=1460 SACK_PERM TSval=102856802 TSecr=0 WS=128"
"93","1.296898186","192.168.129.132","23.56.225.242","TCP","74","47538  >  443 [SYN] Seq=0 Win=64240 Len=0 MSS=1460 SACK_PERM TSval=102856803 TSecr=0 WS=128"
"94","1.297159630","192.168.129.132","23.56.225.242","TCP","54","47500  >  443 [ACK] Seq=5510 Ack=42338 Win=65535 Len=0"
"95","1.297653497","23.56.225.242","192.168.129.132","HTTP2","1302","DATA[5] (text/css)"
"96","1.301518759","192.168.129.132","23.56.225.242","TLSv1.3","1953","Client Hello (SNI=rcs.mako.co.il)"
"97","1.302248345","23.56.225.242","192.168.129.132","TCP","60","443  >  47512 [ACK] Seq=1 Ack=1461 Win=64240 Len=0"
"98","1.302248850","23.56.225.242","192.168.129.132","TCP","60","443  >  47512 [ACK] Seq=1 Ack=1900 Win=64240 Len=0"
"99","1.314222191","23.56.225.242","192.168.129.132","HTTP2","3205","HEADERS[9]: 200 OK"
"100","1.314361612","192.168.129.132","23.56.225.242","TCP","54","47500  >  443 [ACK] Seq=5510 Ack=46737 Win=65535 Len=0"
"101","1.315736689","23.56.225.242","192.168.129.132","TCP","2958","443  >  47500 [PSH, ACK] Seq=46737 Ack=5510 Win=64240 Len=2904 [TCP PDU reassembled in 110]"
"102","1.315796055","192.168.129.132","23.56.225.242","TCP","54","47500  >  443 [ACK] Seq=5510 Ack=49641 Win=65535 Len=0"
"103","1.318020647","23.56.225.242","192.168.129.132","TCP","2958","443  >  47500 [PSH, ACK] Seq=49641 Ack=5510 Win=64240 Len=2904 [TCP PDU reassembled in 110]"
"104","1.318061107","192.168.129.132","23.56.225.242","TCP","54","47500  >  443 [ACK] Seq=5510 Ack=52545 Win=65535 Len=0"
"105","1.319312363","23.56.225.242","192.168.129.132","TCP","2958","443  >  47500 [PSH, ACK] Seq=52545 Ack=5510 Win=64240 Len=2904 [TCP PDU reassembled in 110]"
"106","1.319364031","192.168.129.132","23.56.225.242","TCP","54","47500  >  443 [ACK] Seq=5510 Ack=55449 Win=65535 Len=0"
"107","1.321275731","23.56.225.242","192.168.129.132","TCP","2958","443  >  47500 [PSH, ACK] Seq=55449 Ack=5510 Win=64240 Len=2904 [TCP PDU reassembled in 110]"
"108","1.321320429","192.168.129.132","23.56.225.242","TCP","54","47500  >  443 [ACK] Seq=5510 Ack=58353 Win=65535 Len=0"
"109","1.324874155","23.56.225.242","192.168.129.132","TCP","1506","443  >  47500 [PSH, ACK] Seq=58353 Ack=5510 Win=64240 Len=1452 [TCP PDU reassembled in 110]"
"110","1.325489002","23.56.225.242","192.168.129.132","TLSv1.3","1506","DATA[9]"
"111","1.325531157","192.168.129.132","23.56.225.242","TCP","54","47500  >  443 [ACK] Seq=5510 Ack=61257 Win=65535 Len=0"
"112","1.331026972","192.168.129.132","23.56.225.242","HTTP2","220","HEADERS[37]: GET /18f5227b-e27b-445a-a53f-f845fbe69b40/stormcaster.js, WINDOW_UPDATE[37]"
"113","1.331338111","23.56.225.242","192.168.129.132","TCP","60","443  >  47500 [ACK] Seq=61257 Ack=5676 Win=64240 Len=0"
"114","1.333227162","23.56.225.242","192.168.129.132","TCP","5862","443  >  47500 [PSH, ACK] Seq=61257 Ack=5676 Win=64240 Len=5808 [TCP PDU reassembled in 120]"
"115","1.333227585","23.56.225.242","192.168.129.132","TCP","5862","443  >  47500 [PSH, ACK] Seq=67065 Ack=5676 Win=64240 Len=5808 [TCP PDU reassembled in 120]"
"116","1.333274259","192.168.129.132","23.56.225.242","TCP","54","47500  >  443 [ACK] Seq=5676 Ack=67065 Win=65535 Len=0"
"117","1.333718080","192.168.129.132","23.56.225.242","TCP","54","47500  >  443 [ACK] Seq=5676 Ack=72873 Win=65535 Len=0"
"118","1.334389685","23.56.225.242","192.168.129.132","TCP","2958","443  >  47500 [PSH, ACK] Seq=72873 Ack=5676 Win=64240 Len=2904 [TCP PDU reassembled in 120]"
"119","1.334422773","192.168.129.132","23.56.225.242","TCP","54","47500  >  443 [ACK] Seq=5676 Ack=75777 Win=65535 Len=0"
"120","1.336209483","23.56.225.242","192.168.129.132","TLSv1.3","2958","DATA[9]"
"121","1.336237242","192.168.129.132","23.56.225.242","TCP","54","47500  >  443 [ACK] Seq=5676 Ack=78681 Win=65535 Len=0"
"122","1.337776226","23.56.225.242","192.168.129.132","TCP","2958","443  >  47500 [PSH, ACK] Seq=78681 Ack=5676 Win=64240 Len=2904 [TCP PDU reassembled in 134]"
"123","1.337851795","192.168.129.132","23.56.225.242","TCP","54","47500  >  443 [ACK] Seq=5676 Ack=81585 Win=65535 Len=0"
"124","1.339893526","23.56.225.242","192.168.129.132","TCP","2958","443  >  47500 [PSH, ACK] Seq=81585 Ack=5676 Win=64240 Len=2904 [TCP PDU reassembled in 134]"
"125","1.339919285","192.168.129.132","23.56.225.242","TCP","54","47500  >  443 [ACK] Seq=5676 Ack=84489 Win=65535 Len=0"
"126","1.340337079","192.168.129.132","23.56.225.242","HTTP2","226","HEADERS[39]: GET /mako-vod/_next/static/media/profile.a12fdafa.png, WINDOW_UPDATE[39]"
"127","1.340666115","23.56.225.242","192.168.129.132","TCP","60","443  >  47500 [ACK] Seq=84489 Ack=5848 Win=64240 Len=0"
"128","1.342089125","23.56.225.242","192.168.129.132","TCP","2958","443  >  47500 [PSH, ACK] Seq=84489 Ack=5848 Win=64240 Len=2904 [TCP PDU reassembled in 134]"
"129","1.342134316","192.168.129.132","23.56.225.242","TCP","54","47500  >  443 [ACK] Seq=5848 Ack=87393 Win=65535 Len=0"
"130","1.347065239","192.168.129.132","23.56.225.242","HTTP2","143","HEADERS[41]: GET /images/svg/12plus/prev_arrow.svg, WINDOW_UPDATE[41]"
"131","1.347699973","23.56.225.242","192.168.129.132","TCP","60","443  >  47500 [ACK] Seq=87393 Ack=5937 Win=64240 Len=0"
"132","1.348758169","192.168.129.132","23.56.225.242","HTTP2","143","HEADERS[43]: GET /images/svg/12plus/next_arrow.svg, WINDOW_UPDATE[43]"
"133","1.348961293","23.56.225.242","192.168.129.132","TCP","60","443  >  47538 [SYN, ACK] Seq=0 Ack=1 Win=64240 Len=0 MSS=1460"
"134","1.348961576","23.56.225.242","192.168.129.132","TLSv1.3","8766","DATA[9]"
"135","1.348961606","23.56.225.242","192.168.129.132","TCP","60","443  >  47500 [ACK] Seq=96105 Ack=6026 Win=64240 Len=0"
"136","1.348998125","192.168.129.132","23.56.225.242","TCP","54","47538  >  443 [ACK] Seq=1 Ack=1 Win=64240 Len=0"
"137","1.349526548","192.168.129.132","23.56.225.242","TCP","54","47500  >  443 [ACK] Seq=6026 Ack=96105 Win=65535 Len=0"
"138","1.350354958","23.56.225.242","192.168.129.132","HTTP2","2958","DATA[9] (application/x-javascript), HEADERS[11]: 200 OK"
"139","1.350355485","23.56.225.242","192.168.129.132","TCP","60","443  >  47522 [SYN, ACK] Seq=0 Ack=1 Win=64240 Len=0 MSS=1460"
"140","1.350405665","192.168.129.132","23.56.225.242","TCP","54","47500  >  443 [ACK] Seq=6026 Ack=99009 Win=65535 Len=0"
"141","1.350557309","192.168.129.132","23.56.225.242","TCP","54","47522  >  443 [ACK] Seq=1 Ack=1 Win=64240 Len=0"
"142","1.352036680","23.56.225.242","192.168.129.132","TCP","2958","443  >  47500 [PSH, ACK] Seq=99009 Ack=6026 Win=64240 Len=2904 [TCP PDU reassembled in 159]"
"143","1.352072696","192.168.129.132","23.56.225.242","TCP","54","47500  >  443 [ACK] Seq=6026 Ack=101913 Win=65535 Len=0"
"144","1.354511279","23.56.225.242","192.168.129.132","TCP","2958","443  >  47500 [PSH, ACK] Seq=101913 Ack=6026 Win=64240 Len=2904 [TCP PDU reassembled in 159]"
"145","1.354548535","192.168.129.132","23.56.225.242","TCP","54","47500  >  443 [ACK] Seq=6026 Ack=104817 Win=65535 Len=0"
"146","1.355232964","192.168.129.132","23.56.225.242","TLSv1.3","1953","Client Hello (SNI=img.mako.co.il)"
"147","1.355616980","23.56.225.242","192.168.129.132","TCP","60","443  >  47538 [ACK] Seq=1 Ack=1461 Win=64240 Len=0"
"148","1.355617095","23.56.225.242","192.168.129.132","TCP","60","443  >  47538 [ACK] Seq=1 Ack=1900 Win=64240 Len=0"
"149","1.358027694","192.168.129.132","23.56.225.242","TLSv1.3","1953","Client Hello (SNI=img.mako.co.il)"
"150","1.358627614","23.56.225.242","192.168.129.132","TCP","60","443  >  47522 [ACK] Seq=1 Ack=1461 Win=64240 Len=0"
"151","1.358627818","23.56.225.242","192.168.129.132","TCP","60","443  >  47522 [ACK] Seq=1 Ack=1900 Win=64240 Len=0"
"152","1.358627931","23.56.225.242","192.168.129.132","TCP","1514","443  >  47500 [ACK] Seq=104817 Ack=6026 Win=64240 Len=1460 [TCP PDU reassembled in 159]"
"153","1.358989717","23.56.225.242","192.168.129.132","TCP","1498","443  >  47500 [PSH, ACK] Seq=106277 Ack=6026 Win=64240 Len=1444 [TCP PDU reassembled in 159]"
"154","1.359013223","192.168.129.132","23.56.225.242","TCP","54","47500  >  443 [ACK] Seq=6026 Ack=107721 Win=65535 Len=0"
"155","1.359851887","23.56.225.242","192.168.129.132","TCP","2958","443  >  47500 [PSH, ACK] Seq=107721 Ack=6026 Win=64240 Len=2904 [TCP PDU reassembled in 159]"
"156","1.359881397","192.168.129.132","23.56.225.242","TCP","54","47500  >  443 [ACK] Seq=6026 Ack=110625 Win=65535 Len=0"
"157","1.362289832","23.56.225.242","192.168.129.132","TCP","2958","443  >  47500 [PSH, ACK] Seq=110625 Ack=6026 Win=64240 Len=2904 [TCP PDU reassembled in 159]"
"158","1.362318200","192.168.129.132","23.56.225.242","TCP","54","47500  >  443 [ACK] Seq=6026 Ack=113529 Win=65535 Len=0"
"159","1.363997265","23.56.225.242","192.168.129.132","TLSv1.3","2958","DATA[11]"
"160","1.364027054","192.168.129.132","23.56.225.242","TCP","54","47500  >  443 [ACK] Seq=6026 Ack=116433 Win=65535 Len=0"
"161","1.366288082","23.56.225.242","192.168.129.132","TCP","2958","443  >  47500 [PSH, ACK] Seq=116433 Ack=6026 Win=64240 Len=2904 [TCP PDU reassembled in 171]"
"162","1.366336996","192.168.129.132","23.56.225.242","TCP","54","47500  >  443 [ACK] Seq=6026 Ack=119337 Win=65535 Len=0"
"163","1.367857444","23.56.225.242","192.168.129.132","TCP","2958","443  >  47500 [PSH, ACK] Seq=119337 Ack=6026 Win=64240 Len=2904 [TCP PDU reassembled in 171]"
"164","1.367905951","192.168.129.132","23.56.225.242","TCP","54","47500  >  443 [ACK] Seq=6026 Ack=122241 Win=65535 Len=0"
"165","1.370038971","23.56.225.242","192.168.129.132","TCP","2958","443  >  47500 [PSH, ACK] Seq=122241 Ack=6026 Win=64240 Len=2904 [TCP PDU reassembled in 171]"
"166","1.370073383","192.168.129.132","23.56.225.242","TCP","54","47500  >  443 [ACK] Seq=6026 Ack=125145 Win=65535 Len=0"
"167","1.377141142","23.56.225.242","192.168.129.132","TCP","2958","443  >  47500 [PSH, ACK] Seq=125145 Ack=6026 Win=64240 Len=2904 [TCP PDU reassembled in 171]"
"168","1.377196217","192.168.129.132","23.56.225.242","TCP","54","47500  >  443 [ACK] Seq=6026 Ack=128049 Win=65535 Len=0"
"169","1.378863385","23.56.225.242","192.168.129.132","TCP","2958","443  >  47500 [PSH, ACK] Seq=128049 Ack=6026 Win=64240 Len=2904 [TCP PDU reassembled in 171]"
"170","1.378901933","192.168.129.132","23.56.225.242","TCP","54","47500  >  443 [ACK] Seq=6026 Ack=130953 Win=65535 Len=0"
"171","1.379927389","23.56.225.242","192.168.129.132","TLSv1.3","2958","DATA[11]"
"172","1.380028469","192.168.129.132","23.56.225.242","TCP","54","47500  >  443 [ACK] Seq=6026 Ack=133857 Win=65535 Len=0"
"173","1.382111819","23.56.225.242","192.168.129.132","TCP","2958","443  >  47500 [PSH, ACK] Seq=133857 Ack=6026 Win=64240 Len=2904 [TCP PDU reassembled in 181]"
"174","1.382196568","192.168.129.132","23.56.225.242","TCP","54","47500  >  443 [ACK] Seq=6026 Ack=136761 Win=65535 Len=0"
"175","1.384201311","23.56.225.242","192.168.129.132","TCP","2958","443  >  47500 [PSH, ACK] Seq=136761 Ack=6026 Win=64240 Len=2904 [TCP PDU reassembled in 181]"
"176","1.384335239","192.168.129.132","23.56.225.242","TCP","54","47500  >  443 [ACK] Seq=6026 Ack=139665 Win=65535 Len=0"
"177","1.384774140","23.56.225.242","192.168.129.132","TCP","2958","443  >  47500 [PSH, ACK] Seq=139665 Ack=6026 Win=64240 Len=2904 [TCP PDU reassembled in 181]"
"178","1.384883357","192.168.129.132","23.56.225.242","TCP","54","47500  >  443 [ACK] Seq=6026 Ack=142569 Win=65535 Len=0"
"179","1.385905209","23.56.225.242","192.168.129.132","TCP","2958","443  >  47500 [PSH, ACK] Seq=142569 Ack=6026 Win=64240 Len=2904 [TCP PDU reassembled in 181]"
"180","1.386020694","192.168.129.132","23.56.225.242","TCP","54","47500  >  443 [ACK] Seq=6026 Ack=145473 Win=65535 Len=0"
"181","1.386676142","23.56.225.242","192.168.129.132","TLSv1.3","2958","HEADERS[15]: 200 OK"
"182","1.386783984","192.168.129.132","23.56.225.242","TCP","54","47500  >  443 [ACK] Seq=6026 Ack=148377 Win=65535 Len=0"
"183","1.387771379","23.56.225.242","192.168.129.132","TCP","2958","443  >  47500 [PSH, ACK] Seq=148377 Ack=6026 Win=64240 Len=2904 [TCP PDU reassembled in 191]"
"184","1.387821207","192.168.129.132","23.56.225.242","TCP","54","47500  >  443 [ACK] Seq=6026 Ack=151281 Win=65535 Len=0"
"185","1.389354399","23.56.225.242","192.168.129.132","TCP","2958","443  >  47500 [PSH, ACK] Seq=151281 Ack=6026 Win=64240 Len=2904 [TCP PDU reassembled in 191]"
"186","1.389413026","192.168.129.132","23.56.225.242","TCP","54","47500  >  443 [ACK] Seq=6026 Ack=154185 Win=65535 Len=0"
"187","1.390725613","23.56.225.242","192.168.129.132","TCP","2958","443  >  47500 [PSH, ACK] Seq=154185 Ack=6026 Win=64240 Len=2904 [TCP PDU reassembled in 191]"
"188","1.390870246","192.168.129.132","23.56.225.242","TCP","54","47500  >  443 [ACK] Seq=6026 Ack=157089 Win=65535 Len=0"
"189","1.391234989","23.56.225.242","192.168.129.132","TCP","2958","443  >  47500 [PSH, ACK] Seq=157089 Ack=6026 Win=64240 Len=2904 [TCP PDU reassembled in 191]"
"190","1.391305756","192.168.129.132","23.56.225.242","TCP","54","47500  >  443 [ACK] Seq=6026 Ack=159993 Win=65535 Len=0"
"191","1.392784259","23.56.225.242","192.168.129.132","TLSv1.3","5862","DATA[15]"
"192","1.392874666","192.168.129.132","23.56.225.242","TCP","54","47500  >  443 [ACK] Seq=6026 Ack=165801 Win=65535 Len=0"
"193","1.394627110","23.56.225.242","192.168.129.132","TCP","2958","443  >  47500 [PSH, ACK] Seq=165801 Ack=6026 Win=64240 Len=2904 [TCP PDU reassembled in 201]"
"194","1.394644316","192.168.129.132","23.56.225.242","TCP","54","47500  >  443 [ACK] Seq=6026 Ack=168705 Win=65535 Len=0"
"195","1.395642479","23.56.225.242","192.168.129.132","TCP","2958","443  >  47500 [PSH, ACK] Seq=168705 Ack=6026 Win=64240 Len=2904 [TCP PDU reassembled in 201]"
"196","1.395832799","192.168.129.132","23.56.225.242","TCP","54","47500  >  443 [ACK] Seq=6026 Ack=171609 Win=65535 Len=0"
"197","1.396733282","23.56.225.242","192.168.129.132","TCP","2958","443  >  47500 [PSH, ACK] Seq=171609 Ack=6026 Win=64240 Len=2904 [TCP PDU reassembled in 201]"
"198","1.396769257","192.168.129.132","23.56.225.242","TCP","54","47500  >  443 [ACK] Seq=6026 Ack=174513 Win=65535 Len=0"
"199","1.398212275","23.56.225.242","192.168.129.132","TCP","5862","443  >  47500 [PSH, ACK] Seq=174513 Ack=6026 Win=64240 Len=5808 [TCP PDU reassembled in 201]"
"200","1.398291332","192.168.129.132","23.56.225.242","TCP","54","47500  >  443 [ACK] Seq=6026 Ack=180321 Win=65535 Len=0"
"201","1.399480857","23.56.225.242","192.168.129.132","TLSv1.3","2958","DATA[15]"
"202","1.400270682","192.168.129.132","23.56.225.242","TCP","54","47500  >  443 [ACK] Seq=6026 Ack=183225 Win=65535 Len=0"
"203","1.400890490","23.56.225.242","192.168.129.132","TLSv1.3","4054","Server Hello, Change Cipher Spec, Encrypted Extensions, Certificate, Certificate Verify, Finished"
"204","1.400890619","23.56.225.242","192.168.129.132","TCP","2958","443  >  47500 [PSH, ACK] Seq=183225 Ack=6026 Win=64240 Len=2904 [TCP PDU reassembled in 211]"
"205","1.401065686","192.168.129.132","23.56.225.242","TCP","54","47512  >  443 [ACK] Seq=1900 Ack=4001 Win=65535 Len=0"
"206","1.401309985","192.168.129.132","23.56.225.242","TCP","54","47500  >  443 [ACK] Seq=6026 Ack=186129 Win=65535 Len=0"
"207","1.401980889","23.56.225.242","192.168.129.132","TCP","2958","443  >  47500 [PSH, ACK] Seq=186129 Ack=6026 Win=64240 Len=2904 [TCP PDU reassembled in 211]"
"208","1.402007552","192.168.129.132","23.56.225.242","TCP","54","47500  >  443 [ACK] Seq=6026 Ack=189033 Win=65535 Len=0"
"209","1.403212647","23.56.225.242","192.168.129.132","TCP","5862","443  >  47500 [PSH, ACK] Seq=189033 Ack=6026 Win=64240 Len=5808 [TCP PDU reassembled in 211]"
"210","1.403249089","192.168.129.132","23.56.225.242","TCP","54","47500  >  443 [ACK] Seq=6026 Ack=194841 Win=65535 Len=0"
"211","1.404103914","23.56.225.242","192.168.129.132","TLSv1.3","2958","DATA[15]"
"212","1.404177755","192.168.129.132","23.56.225.242","TCP","54","47500  >  443 [ACK] Seq=6026 Ack=197745 Win=65535 Len=0"
"213","1.405419001","192.168.129.132","23.56.225.242","TLSv1.3","134","Change Cipher Spec, Finished"
"214","1.405456692","23.56.225.242","192.168.129.132","TCP","2958","443  >  47500 [PSH, ACK] Seq=197745 Ack=6026 Win=64240 Len=2904 [TCP PDU reassembled in 227]"
"215","1.405456847","23.56.225.242","192.168.129.132","TCP","2958","443  >  47500 [PSH, ACK] Seq=200649 Ack=6026 Win=64240 Len=2904 [TCP PDU reassembled in 227]"
"216","1.405489585","192.168.129.132","23.56.225.242","TCP","54","47500  >  443 [ACK] Seq=6026 Ack=200649 Win=65535 Len=0"
"217","1.405538502","192.168.129.132","23.56.225.242","TCP","54","47500  >  443 [ACK] Seq=6026 Ack=203553 Win=65535 Len=0"
"218","1.405636865","23.56.225.242","192.168.129.132","TCP","60","443  >  47512 [ACK] Seq=4001 Ack=1980 Win=64240 Len=0"
"219","1.407118812","23.56.225.242","192.168.129.132","TCP","2958","443  >  47500 [PSH, ACK] Seq=203553 Ack=6026 Win=64240 Len=2904 [TCP PDU reassembled in 227]"
"220","1.407166208","192.168.129.132","23.56.225.242","TCP","54","47500  >  443 [ACK] Seq=6026 Ack=206457 Win=65535 Len=0"
"221","1.407374710","192.168.129.132","23.56.225.242","HTTP2","163","Magic, SETTINGS[0], WINDOW_UPDATE[0], GOAWAY[0]"
"222","1.407743074","23.56.225.242","192.168.129.132","TCP","60","443  >  47512 [ACK] Seq=4001 Ack=2089 Win=64240 Len=0"
"223","1.408139582","23.56.225.242","192.168.129.132","TCP","2958","443  >  47500 [PSH, ACK] Seq=206457 Ack=6026 Win=64240 Len=2904 [TCP PDU reassembled in 227]"
"224","1.408169103","192.168.129.132","23.56.225.242","TCP","54","47500  >  443 [ACK] Seq=6026 Ack=209361 Win=65535 Len=0"
"225","1.409061404","23.56.225.242","192.168.129.132","TCP","2958","443  >  47500 [PSH, ACK] Seq=209361 Ack=6026 Win=64240 Len=2904 [TCP PDU reassembled in 227]"
"226","1.409138317","192.168.129.132","23.56.225.242","TCP","54","47500  >  443 [ACK] Seq=6026 Ack=212265 Win=65535 Len=0"
"227","1.409476270","23.56.225.242","192.168.129.132","TLSv1.3","2958","DATA[15]"
"228","1.409672967","192.168.129.132","23.56.225.242","TCP","54","47500  >  443 [ACK] Seq=6026 Ack=215169 Win=65535 Len=0"
"229","1.410229738","23.56.225.242","192.168.129.132","TCP","2958","443  >  47500 [PSH, ACK] Seq=215169 Ack=6026 Win=64240 Len=2904 [TCP PDU reassembled in 235]"
"230","1.410285978","192.168.129.132","23.56.225.242","TCP","54","47500  >  443 [ACK] Seq=6026 Ack=218073 Win=65535 Len=0"
"231","1.411353889","23.56.225.242","192.168.129.132","TCP","5862","443  >  47500 [PSH, ACK] Seq=218073 Ack=6026 Win=64240 Len=5808 [TCP PDU reassembled in 235]"
"232","1.411406335","192.168.129.132","23.56.225.242","TCP","54","47500  >  443 [ACK] Seq=6026 Ack=223881 Win=65535 Len=0"
"233","1.412213608","23.56.225.242","192.168.129.132","TCP","2958","443  >  47500 [PSH, ACK] Seq=223881 Ack=6026 Win=64240 Len=2904 [TCP PDU reassembled in 235]"
"234","1.412333122","192.168.129.132","23.56.225.242","TCP","54","47500  >  443 [ACK] Seq=6026 Ack=226785 Win=65535 Len=0"
"235","1.413634249","23.56.225.242","192.168.129.132","TLSv1.3","8766","DATA[15]"
"236","1.413677635","192.168.129.132","23.56.225.242","TCP","54","47500  >  443 [ACK] Seq=6026 Ack=235497 Win=65535 Len=0"
"237","1.417112341","23.56.225.242","192.168.129.132","TCP","8766","443  >  47500 [PSH, ACK] Seq=235497 Ack=6026 Win=64240 Len=8712 [TCP PDU reassembled in 239]"
"238","1.417152967","192.168.129.132","23.56.225.242","TCP","54","47500  >  443 [ACK] Seq=6026 Ack=244209 Win=65535 Len=0"
"239","1.418453966","23.56.225.242","192.168.129.132","TLSv1.3","8766","DATA[15]"
"240","1.418509494","192.168.129.132","23.56.225.242","TCP","54","47500  >  443 [ACK] Seq=6026 Ack=252921 Win=65535 Len=0"
"241","1.420891804","23.56.225.242","192.168.129.132","TCP","5862","443  >  47500 [PSH, ACK] Seq=252921 Ack=6026 Win=64240 Len=5808 [TCP PDU reassembled in 245]"
"242","1.421223483","192.168.129.132","23.56.225.242","TCP","54","47500  >  443 [ACK] Seq=6026 Ack=258729 Win=65535 Len=0"
"243","1.422674837","23.56.225.242","192.168.129.132","TCP","2958","443  >  47500 [PSH, ACK] Seq=258729 Ack=6026 Win=64240 Len=2904 [TCP PDU reassembled in 245]"
"244","1.422703691","192.168.129.132","23.56.225.242","TCP","54","47500  >  443 [ACK] Seq=6026 Ack=261633 Win=65535 Len=0"
"245","1.424426900","23.56.225.242","192.168.129.132","TLSv1.3","2958","HEADERS[7]: 200 OK"
"246","1.424497990","192.168.129.132","23.56.225.242","TCP","54","47500  >  443 [ACK] Seq=6026 Ack=264537 Win=65535 Len=0"
"247","1.424748422","23.56.225.242","192.168.129.132","HTTP2","2958","DATA[7], HEADERS[13]: 200 OK"
"248","1.424774994","192.168.129.132","23.56.225.242","TCP","54","47500  >  443 [ACK] Seq=6026 Ack=267441 Win=65535 Len=0"
"249","1.426566880","23.56.225.242","192.168.129.132","TCP","2958","443  >  47500 [PSH, ACK] Seq=267441 Ack=6026 Win=64240 Len=2904 [TCP PDU reassembled in 254]"
"250","1.426626879","192.168.129.132","23.56.225.242","TCP","54","47500  >  443 [ACK] Seq=6026 Ack=270345 Win=65535 Len=0"
"251","1.427417965","23.56.225.242","192.168.129.132","TCP","2958","443  >  47500 [PSH, ACK] Seq=270345 Ack=6026 Win=64240 Len=2904 [TCP PDU reassembled in 254]"
"252","1.427453037","192.168.129.132","23.56.225.242","TCP","54","47500  >  443 [ACK] Seq=6026 Ack=273249 Win=65535 Len=0"
"253","1.430318860","23.56.225.242","192.168.129.132","TCP","6522","443  >  47500 [PSH, ACK] Seq=273249 Ack=6026 Win=64240 Len=6468 [TCP PDU reassembled in 254]"
"254","1.430319197","23.56.225.242","192.168.129.132","TLSv1.3","5862","DATA[13]"
"255","1.430395111","192.168.129.132","23.56.225.242","TCP","54","47500  >  443 [ACK] Seq=6026 Ack=279717 Win=65535 Len=0"
"256","1.430473987","192.168.129.132","23.56.225.242","TCP","54","47500  >  443 [ACK] Seq=6026 Ack=285525 Win=65535 Len=0"
"257","1.430599283","23.56.225.242","192.168.129.132","TCP","2958","443  >  47500 [PSH, ACK] Seq=285525 Ack=6026 Win=64240 Len=2904 [TCP PDU reassembled in 263]"
"258","1.430654477","192.168.129.132","23.56.225.242","TCP","54","47500  >  443 [ACK] Seq=6026 Ack=288429 Win=65535 Len=0"
"259","1.431399171","23.56.225.242","192.168.129.132","TCP","2958","443  >  47500 [PSH, ACK] Seq=288429 Ack=6026 Win=64240 Len=2904 [TCP PDU reassembled in 263]"
"260","1.431461634","192.168.129.132","23.56.225.242","TCP","54","47500  >  443 [ACK] Seq=6026 Ack=291333 Win=65535 Len=0"
"261","1.433726232","23.56.225.242","192.168.129.132","TCP","5862","443  >  47500 [PSH, ACK] Seq=291333 Ack=6026 Win=64240 Len=5808 [TCP PDU reassembled in 263]"
"262","1.433771466","192.168.129.132","23.56.225.242","TCP","54","47500  >  443 [ACK] Seq=6026 Ack=297141 Win=65535 Len=0"
"263","1.433953669","23.56.225.242","192.168.129.132","TLSv1.3","5862","DATA[13]"
"264","1.433984746","192.168.129.132","23.56.225.242","TCP","54","47500  >  443 [ACK] Seq=6026 Ack=302949 Win=65535 Len=0"
"265","1.434931966","23.56.225.242","192.168.129.132","TCP","2958","443  >  47500 [PSH, ACK] Seq=302949 Ack=6026 Win=64240 Len=2904 [TCP PDU reassembled in 275]"
"266","1.434989441","192.168.129.132","23.56.225.242","TCP","54","47500  >  443 [ACK] Seq=6026 Ack=305853 Win=65535 Len=0"
"267","1.435773503","23.56.225.242","192.168.129.132","TCP","2958","443  >  47500 [PSH, ACK] Seq=305853 Ack=6026 Win=64240 Len=2904 [TCP PDU reassembled in 275]"
"268","1.435830442","192.168.129.132","23.56.225.242","TCP","54","47500  >  443 [ACK] Seq=6026 Ack=308757 Win=65535 Len=0"
"269","1.436043443","23.56.225.242","192.168.129.132","TCP","2958","443  >  47500 [PSH, ACK] Seq=308757 Ack=6026 Win=64240 Len=2904 [TCP PDU reassembled in 275]"
"270","1.436146775","192.168.129.132","23.56.225.242","TCP","54","47500  >  443 [ACK] Seq=6026 Ack=311661 Win=65535 Len=0"
"271","1.437625754","192.168.129.132","23.56.225.242","HTTP2","325","HEADERS[45]: GET /fonts/Keshet-12-SemiBold.woff2, WINDOW_UPDATE[45]"
"272","1.438271890","23.56.225.242","192.168.129.132","TCP","5862","443  >  47500 [PSH, ACK] Seq=311661 Ack=6026 Win=64240 Len=5808 [TCP PDU reassembled in 275]"
"273","1.438272327","23.56.225.242","192.168.129.132","TCP","60","443  >  47500 [ACK] Seq=317469 Ack=6297 Win=64240 Len=0"
"274","1.438402982","192.168.129.132","23.56.225.242","TCP","54","47500  >  443 [ACK] Seq=6297 Ack=317469 Win=65535 Len=0"
"275","1.438779429","23.56.225.242","192.168.129.132","TLSv1.3","2958","DATA[15]"
"276","1.438865260","192.168.129.132","23.56.225.242","TCP","54","47500  >  443 [ACK] Seq=6297 Ack=320373 Win=65535 Len=0"
"277","1.439474572","23.56.225.242","192.168.129.132","TCP","2958","443  >  47500 [PSH, ACK] Seq=320373 Ack=6297 Win=64240 Len=2904 [TCP PDU reassembled in 283]"
"278","1.439553769","192.168.129.132","23.56.225.242","TCP","54","47500  >  443 [ACK] Seq=6297 Ack=323277 Win=65535 Len=0"
"279","1.439837190","23.56.225.242","192.168.129.132","TCP","2958","443  >  47500 [PSH, ACK] Seq=323277 Ack=6297 Win=64240 Len=2904 [TCP PDU reassembled in 283]"
"280","1.439865849","192.168.129.132","23.56.225.242","TCP","54","47500  >  443 [ACK] Seq=6297 Ack=326181 Win=65535 Len=0"
"281","1.441666670","192.168.129.132","23.56.225.242","HTTP2","205","HEADERS[47]: GET /fonts/Keshet-12-Regular.woff2, WINDOW_UPDATE[47]"
"282","1.442140181","23.56.225.242","192.168.129.132","TCP","60","443  >  47500 [ACK] Seq=326181 Ack=6448 Win=64240 Len=0"
"283","1.443909549","23.56.225.242","192.168.129.132","TLSv1.3","13122","DATA[15]"
"284","1.444057721","192.168.129.132","23.56.225.242","TCP","54","47500  >  443 [ACK] Seq=6448 Ack=339249 Win=65535 Len=0"
"285","1.445377469","23.56.225.242","192.168.129.132","TCP","5862","443  >  47500 [PSH, ACK] Seq=339249 Ack=6448 Win=64240 Len=5808 [TCP PDU reassembled in 287]"
"286","1.445528252","192.168.129.132","23.56.225.242","TCP","54","47500  >  443 [ACK] Seq=6448 Ack=345057 Win=65535 Len=0"
"287","1.446990305","23.56.225.242","192.168.129.132","TLSv1.3","8766","DATA[15]"
"288","1.447174735","192.168.129.132","23.56.225.242","TCP","54","47500  >  443 [ACK] Seq=6448 Ack=353769 Win=65535 Len=0"
"289","1.449451095","23.56.225.242","192.168.129.132","TCP","13122","443  >  47500 [PSH, ACK] Seq=353769 Ack=6448 Win=64240 Len=13068 [TCP PDU reassembled in 291]"
"290","1.449516499","192.168.129.132","23.56.225.242","TCP","54","47500  >  443 [ACK] Seq=6448 Ack=366837 Win=65535 Len=0"
"291","1.449663308","23.56.225.242","192.168.129.132","TLSv1.3","4410","DATA[15]"
"292","1.449682696","192.168.129.132","23.56.225.242","TCP","54","47500  >  443 [ACK] Seq=6448 Ack=371193 Win=65535 Len=0"
"293","1.452635847","23.56.225.242","192.168.129.132","TCP","4410","443  >  47500 [PSH, ACK] Seq=371193 Ack=6448 Win=64240 Len=4356 [TCP PDU reassembled in 298]"
"294","1.452636358","23.56.225.242","192.168.129.132","TLSv1.3","628","New Session Ticket, New Session Ticket"
"295","1.452709554","192.168.129.132","23.56.225.242","TCP","54","47500  >  443 [ACK] Seq=6448 Ack=375549 Win=65535 Len=0"
"296","1.453319299","23.56.225.242","192.168.129.132","TCP","8766","443  >  47500 [PSH, ACK] Seq=375549 Ack=6448 Win=64240 Len=8712 [TCP PDU reassembled in 298]"
"297","1.453352287","192.168.129.132","23.56.225.242","TCP","54","47500  >  443 [ACK] Seq=6448 Ack=384261 Win=65535 Len=0"
"298","1.453929732","23.56.225.242","192.168.129.132","TLSv1.3","8766","DATA[15]"
"299","1.453973005","192.168.129.132","23.56.225.242","TCP","54","47500  >  443 [ACK] Seq=6448 Ack=392973 Win=65535 Len=0"
"300","1.454495297","192.168.129.132","23.56.225.242","TLSv1.3","78","Alert (Level: Warning, Description: Close Notify)"
"301","1.454619548","192.168.129.132","23.56.225.242","TCP","54","47512  >  443 [FIN, ACK] Seq=2113 Ack=4575 Win=65535 Len=0"
"302","1.454875622","23.56.225.242","192.168.129.132","TCP","4410","443  >  47500 [PSH, ACK] Seq=392973 Ack=6448 Win=64240 Len=4356 [TCP PDU reassembled in 307]"
"303","1.454876152","23.56.225.242","192.168.129.132","TCP","60","443  >  47512 [ACK] Seq=4575 Ack=2113 Win=64240 Len=0"
"304","1.454932277","192.168.129.132","23.56.225.242","TCP","54","47500  >  443 [ACK] Seq=6448 Ack=397329 Win=65535 Len=0"
"305","1.455455887","23.56.225.242","192.168.129.132","TCP","60","443  >  47512 [ACK] Seq=4575 Ack=2114 Win=64239 Len=0"
"306","1.455456121","23.56.225.242","192.168.129.132","TLSv1.3","4054","Server Hello, Change Cipher Spec, Encrypted Extensions, Certificate, Certificate Verify, Finished"
"307","1.455456185","23.56.225.242","192.168.129.132","TLSv1.3","4410","DATA[15]"
"308","1.455495543","192.168.129.132","23.56.225.242","TCP","54","47538  >  443 [ACK] Seq=1900 Ack=4001 Win=65535 Len=0"
"309","1.455535843","192.168.129.132","23.56.225.242","TCP","54","47500  >  443 [ACK] Seq=6448 Ack=401685 Win=65535 Len=0"
"310","1.456596201","23.56.225.242","192.168.129.132","TCP","7314","443  >  47500 [PSH, ACK] Seq=401685 Ack=6448 Win=64240 Len=7260 [TCP PDU reassembled in 314]"
"311","1.456647673","192.168.129.132","23.56.225.242","TCP","54","47500  >  443 [ACK] Seq=6448 Ack=408945 Win=65535 Len=0"
"312","1.457503837","23.56.225.242","192.168.129.132","TCP","4410","443  >  47500 [PSH, ACK] Seq=408945 Ack=6448 Win=64240 Len=4356 [TCP PDU reassembled in 314]"
"313","1.457534303","192.168.129.132","23.56.225.242","TCP","54","47500  >  443 [ACK] Seq=6448 Ack=413301 Win=65535 Len=0"
"314","1.457803031","23.56.225.242","192.168.129.132","TLSv1.3","5862","DATA[15]"
"315","1.457828334","192.168.129.132","23.56.225.242","TCP","54","47500  >  443 [ACK] Seq=6448 Ack=419109 Win=65535 Len=0"
"316","1.458692171","23.56.225.242","192.168.129.132","TCP","2958","443  >  47500 [PSH, ACK] Seq=419109 Ack=6448 Win=64240 Len=2904 [TCP PDU reassembled in 322]"
"317","1.458692745","23.56.225.242","192.168.129.132","TCP","2958","443  >  47500 [PSH, ACK] Seq=422013 Ack=6448 Win=64240 Len=2904 [TCP PDU reassembled in 322]"
"318","1.458744396","192.168.129.132","23.56.225.242","TCP","54","47500  >  443 [ACK] Seq=6448 Ack=422013 Win=65535 Len=0"
"319","1.458889683","192.168.129.132","23.56.225.242","TCP","54","47500  >  443 [ACK] Seq=6448 Ack=424917 Win=65535 Len=0"
"320","1.459269878","23.56.225.242","192.168.129.132","TCP","5862","443  >  47500 [PSH, ACK] Seq=424917 Ack=6448 Win=64240 Len=5808 [TCP PDU reassembled in 322]"
"321","1.459296964","192.168.129.132","23.56.225.242","TCP","54","47500  >  443 [ACK] Seq=6448 Ack=430725 Win=65535 Len=0"
"322","1.460463194","23.56.225.242","192.168.129.132","TLSv1.3","5862","DATA[15]"
"323","1.460508340","192.168.129.132","23.56.225.242","TCP","54","47500  >  443 [ACK] Seq=6448 Ack=436533 Win=65535 Len=0"
"324","1.461744674","192.168.129.132","23.56.225.242","TLSv1.3","134","Change Cipher Spec, Finished"
"325","1.462323675","23.56.225.242","192.168.129.132","TCP","60","443  >  47538 [ACK] Seq=4001 Ack=1980 Win=64240 Len=0"
"326","1.462324056","23.56.225.242","192.168.129.132","TCP","5862","443  >  47500 [PSH, ACK] Seq=436533 Ack=6448 Win=64240 Len=5808 [TCP PDU reassembled in 329]"
"327","1.462359790","192.168.129.132","23.56.225.242","TCP","54","47500  >  443 [ACK] Seq=6448 Ack=442341 Win=65535 Len=0"
"328","1.462810736","23.56.225.242","192.168.129.132","TLSv1.3","4054","Server Hello, Change Cipher Spec, Encrypted Extensions, Certificate, Certificate Verify, Finished"
"329","1.462810782","23.56.225.242","192.168.129.132","HTTP2","5862","DATA[15]"
"330","1.462826060","192.168.129.132","23.56.225.242","TCP","54","47522  >  443 [ACK] Seq=1900 Ack=4001 Win=65535 Len=0"
"331","1.462851512","192.168.129.132","23.56.225.242","TCP","54","47500  >  443 [ACK] Seq=6448 Ack=448149 Win=65535 Len=0"
"332","1.463391862","192.168.129.132","23.56.225.242","HTTP2","203","HEADERS[49]: GET /fonts/Keshet-12-Bold.woff2, WINDOW_UPDATE[49]"
"333","1.463617947","23.56.225.242","192.168.129.132","HTTP2","10218","HEADERS[17]: 200 OK"
"334","1.463618090","23.56.225.242","192.168.129.132","TCP","60","443  >  47500 [ACK] Seq=458313 Ack=6597 Win=64240 Len=0"
"335","1.463645047","192.168.129.132","23.56.225.242","TCP","54","47500  >  443 [ACK] Seq=6597 Ack=458313 Win=65535 Len=0"
"336","1.465095452","192.168.129.132","23.56.225.242","HTTP2","163","Magic, SETTINGS[0], WINDOW_UPDATE[0], GOAWAY[0]"
"337","1.465685678","23.56.225.242","192.168.129.132","TCP","60","443  >  47538 [ACK] Seq=4001 Ack=2089 Win=64240 Len=0"
"338","1.465686003","23.56.225.242","192.168.129.132","TLSv1.3","13122","DATA[17]"
"339","1.465731561","192.168.129.132","23.56.225.242","TCP","54","47500  >  443 [ACK] Seq=6597 Ack=471381 Win=65535 Len=0"
"340","1.465866270","23.56.225.242","192.168.129.132","TCP","4410","443  >  47500 [PSH, ACK] Seq=471381 Ack=6597 Win=64240 Len=4356 [TCP PDU reassembled in 342]"
"341","1.465893647","192.168.129.132","23.56.225.242","TCP","54","47500  >  443 [ACK] Seq=6597 Ack=475737 Win=65535 Len=0"
"342","1.466179432","23.56.225.242","192.168.129.132","HTTP2","7314","DATA[17], HEADERS[21]: 200 OK"
"343","1.466205041","192.168.129.132","23.56.225.242","TCP","54","47500  >  443 [ACK] Seq=6597 Ack=482997 Win=65535 Len=0"
"344","1.468431078","192.168.129.132","23.56.225.242","TLSv1.3","134","Change Cipher Spec, Finished"
"345","1.469027651","192.168.129.132","23.56.225.242","HTTP2","163","Magic, SETTINGS[0], WINDOW_UPDATE[0], GOAWAY[0]"
"346","1.469120907","23.56.225.242","192.168.129.132","TCP","60","443  >  47522 [ACK] Seq=4001 Ack=1980 Win=64240 Len=0"
"347","1.469410922","23.56.225.242","192.168.129.132","TCP","60","443  >  47522 [ACK] Seq=4001 Ack=2089 Win=64240 Len=0"
"348","1.470684388","23.56.225.242","192.168.129.132","HTTP2","21834","DATA[21], HEADERS[27]: 200 OK"
"349","1.470750165","192.168.129.132","23.56.225.242","TCP","54","47500  >  443 [ACK] Seq=6597 Ack=504777 Win=65535 Len=0"
"350","1.472326710","23.56.225.242","192.168.129.132","TLSv1.3","14574","DATA[15]"
"351","1.472458480","192.168.129.132","23.56.225.242","TCP","54","47500  >  443 [ACK] Seq=6597 Ack=519297 Win=65535 Len=0"
"352","1.472698695","23.56.225.242","192.168.129.132","TLSv1.3","7314","DATA[15]"
"353","1.472728547","192.168.129.132","23.56.225.242","TCP","54","47500  >  443 [ACK] Seq=6597 Ack=526557 Win=65535 Len=0"
"354","1.477099856","23.56.225.242","192.168.129.132","TCP","11670","443  >  47500 [PSH, ACK] Seq=526557 Ack=6597 Win=64240 Len=11616 [TCP PDU reassembled in 356]"
"355","1.477246975","192.168.129.132","23.56.225.242","TCP","54","47500  >  443 [ACK] Seq=6597 Ack=538173 Win=65535 Len=0"
"356","1.477506728","23.56.225.242","192.168.129.132","TLSv1.3","16026","DATA[15]"
"357","1.477626241","192.168.129.132","23.56.225.242","TCP","54","47500  >  443 [ACK] Seq=6597 Ack=554145 Win=65535 Len=0"
"358","1.477900908","23.56.225.242","192.168.129.132","TLSv1.3","7314","DATA[15]"
"359","1.477935345","192.168.129.132","23.56.225.242","TCP","54","47500  >  443 [ACK] Seq=6597 Ack=561405 Win=65535 Len=0"
"360","1.478247872","23.56.225.242","192.168.129.132","TCP","11670","443  >  47500 [PSH, ACK] Seq=561405 Ack=6597 Win=64240 Len=11616 [TCP PDU reassembled in 362]"
"361","1.478420537","192.168.129.132","23.56.225.242","TCP","54","47500  >  443 [ACK] Seq=6597 Ack=573021 Win=65535 Len=0"
"362","1.479191277","23.56.225.242","192.168.129.132","TLSv1.3","2958","DATA[15]"
"363","1.479191688","23.56.225.242","192.168.129.132","TCP","8766","443  >  47500 [PSH, ACK] Seq=575925 Ack=6597 Win=64240 Len=8712 [TCP PDU reassembled in 367]"
"364","1.479238234","192.168.129.132","23.56.225.242","TCP","54","47500  >  443 [ACK] Seq=6597 Ack=575925 Win=65535 Len=0"
"365","1.479403989","192.168.129.132","23.56.225.242","TCP","54","47500  >  443 [ACK] Seq=6597 Ack=584637 Win=65535 Len=0"
"366","1.480188184","23.56.225.242","192.168.129.132","TCP","4410","443  >  47500 [PSH, ACK] Seq=584637 Ack=6597 Win=64240 Len=4356 [TCP PDU reassembled in 367]"
"367","1.480188405","23.56.225.242","192.168.129.132","TLSv1.3","4410","DATA[15]"
"368","1.480247699","192.168.129.132","23.56.225.242","TCP","54","47500  >  443 [ACK] Seq=6597 Ack=588993 Win=65535 Len=0"
"369","1.480281541","192.168.129.132","23.56.225.242","TCP","54","47500  >  443 [ACK] Seq=6597 Ack=593349 Win=65535 Len=0"
"370","1.482817023","23.56.225.242","192.168.129.132","TCP","11670","443  >  47500 [PSH, ACK] Seq=593349 Ack=6597 Win=64240 Len=11616 [TCP PDU reassembled in 374]"
"371","1.482862964","192.168.129.132","23.56.225.242","TCP","54","47500  >  443 [ACK] Seq=6597 Ack=604965 Win=65535 Len=0"
"372","1.483310696","23.56.225.242","192.168.129.132","TCP","2958","443  >  47500 [PSH, ACK] Seq=604965 Ack=6597 Win=64240 Len=2904 [TCP PDU reassembled in 374]"
"373","1.483439086","192.168.129.132","23.56.225.242","TCP","54","47500  >  443 [ACK] Seq=6597 Ack=607869 Win=65535 Len=0"
"374","1.484318703","23.56.225.242","192.168.129.132","TLSv1.3","11670","DATA[15]"
"375","1.484427555","192.168.129.132","23.56.225.242","TCP","54","47500  >  443 [ACK] Seq=6597 Ack=619485 Win=65535 Len=0"
"376","1.484578584","23.56.225.242","192.168.129.132","TCP","2958","443  >  47500 [PSH, ACK] Seq=619485 Ack=6597 Win=64240 Len=2904 [TCP PDU reassembled in 378]"
"377","1.484599717","192.168.129.132","23.56.225.242","TCP","54","47500  >  443 [ACK] Seq=6597 Ack=622389 Win=65535 Len=0"
"378","1.485333816","23.56.225.242","192.168.129.132","TLSv1.3","17478","DATA[15]"
"379","1.485370978","192.168.129.132","23.56.225.242","TCP","54","47500  >  443 [ACK] Seq=6597 Ack=639813 Win=65535 Len=0"
"380","1.486669124","23.56.225.242","192.168.129.132","TLSv1.3","8766","DATA[15]"
"381","1.486733368","192.168.129.132","23.56.225.242","TCP","54","47500  >  443 [ACK] Seq=6597 Ack=648525 Win=65535 Len=0"
"382","1.488316755","23.56.225.242","192.168.129.132","TCP","8766","443  >  47500 [PSH, ACK] Seq=648525 Ack=6597 Win=64240 Len=8712 [TCP PDU reassembled in 384]"
"383","1.488512907","192.168.129.132","23.56.225.242","TCP","54","47500  >  443 [ACK] Seq=6597 Ack=657237 Win=65535 Len=0"
"384","1.489445489","23.56.225.242","192.168.129.132","TLSv1.3","11670","DATA[15]"
"385","1.489575789","192.168.129.132","23.56.225.242","TCP","54","47500  >  443 [ACK] Seq=6597 Ack=668853 Win=65535 Len=0"
"386","1.490818942","23.56.225.242","192.168.129.132","TCP","4410","443  >  47500 [PSH, ACK] Seq=668853 Ack=6597 Win=64240 Len=4356 [TCP PDU reassembled in 388]"
"387","1.490853221","192.168.129.132","23.56.225.242","TCP","54","47500  >  443 [ACK] Seq=6597 Ack=673209 Win=65535 Len=0"
"388","1.492090637","23.56.225.242","192.168.129.132","TLSv1.3","8766","DATA[15]"
"389","1.492091096","23.56.225.242","192.168.129.132","TCP","4410","443  >  47500 [PSH, ACK] Seq=681921 Ack=6597 Win=64240 Len=4356 [TCP PDU reassembled in 392]"
"390","1.492149334","192.168.129.132","23.56.225.242","TCP","54","47500  >  443 [ACK] Seq=6597 Ack=681921 Win=65535 Len=0"
"391","1.492281890","192.168.129.132","23.56.225.242","TCP","54","47500  >  443 [ACK] Seq=6597 Ack=686277 Win=65535 Len=0"
"392","1.492486689","23.56.225.242","192.168.129.132","TLSv1.3","8766","DATA[15]"
"393","1.492588587","192.168.129.132","23.56.225.242","TCP","54","47500  >  443 [ACK] Seq=6597 Ack=694989 Win=65535 Len=0"
"394","1.497454598","23.56.225.242","192.168.129.132","TCP","8766","443  >  47500 [PSH, ACK] Seq=694989 Ack=6597 Win=64240 Len=8712 [TCP PDU reassembled in 395]"
"395","1.497454994","23.56.225.242","192.168.129.132","TLSv1.3","8766","DATA[15]"
"396","1.497596187","192.168.129.132","23.56.225.242","TCP","54","47500  >  443 [ACK] Seq=6597 Ack=703701 Win=65535 Len=0"
"397","1.497760038","192.168.129.132","23.56.225.242","TCP","54","47500  >  443 [ACK] Seq=6597 Ack=712413 Win=65535 Len=0"
"398","1.497895297","23.56.225.242","192.168.129.132","TCP","4410","443  >  47500 [PSH, ACK] Seq=712413 Ack=6597 Win=64240 Len=4356 [TCP PDU reassembled in 399]"
"399","1.497895334","23.56.225.242","192.168.129.132","TLSv1.3","8766","DATA[15]"
"400","1.497989866","192.168.129.132","23.56.225.242","TCP","54","47500  >  443 [ACK] Seq=6597 Ack=716769 Win=65535 Len=0"
"401","1.498039430","192.168.129.132","23.56.225.242","TCP","54","47500  >  443 [ACK] Seq=6597 Ack=725481 Win=65535 Len=0"
"402","1.498274115","23.56.225.242","192.168.129.132","TCP","7314","443  >  47500 [PSH, ACK] Seq=725481 Ack=6597 Win=64240 Len=7260 [TCP PDU reassembled in 404]"
"403","1.498311425","192.168.129.132","23.56.225.242","TCP","54","47500  >  443 [ACK] Seq=6597 Ack=732741 Win=65535 Len=0"
"404","1.498731013","23.56.225.242","192.168.129.132","TLSv1.3","10218","DATA[15]"
"405","1.498731182","23.56.225.242","192.168.129.132","HTTP2","146","SETTINGS[0]"
"406","1.498753516","192.168.129.132","23.56.225.242","TCP","54","47500  >  443 [ACK] Seq=6597 Ack=742905 Win=65535 Len=0"
"407","1.498843897","192.168.129.132","23.56.225.242","TCP","54","47512  >  443 [RST] Seq=2114 Win=0 Len=0"
"408","1.501933579","23.56.225.242","192.168.129.132","HTTP2","23286","DATA[15], HEADERS[37]: 200 OK"
"409","1.501998125","192.168.129.132","23.56.225.242","TCP","54","47500  >  443 [ACK] Seq=6597 Ack=766137 Win=65535 Len=0"
"410","1.502367356","23.56.225.242","192.168.129.132","TLSv1.3","10218","DATA[37]"
"411","1.502367653","23.56.225.242","192.168.129.132","TCP","7314","443  >  47500 [PSH, ACK] Seq=776301 Ack=6597 Win=64240 Len=7260 [TCP PDU reassembled in 414]"
"412","1.502414096","192.168.129.132","23.56.225.242","TCP","54","47500  >  443 [ACK] Seq=6597 Ack=776301 Win=65535 Len=0"
"413","1.502554545","192.168.129.132","23.56.225.242","TCP","54","47500  >  443 [ACK] Seq=6597 Ack=783561 Win=65535 Len=0"
"414","1.504142869","23.56.225.242","192.168.129.132","TLSv1.3","5862","DATA[37]"
"415","1.504143133","23.56.225.242","192.168.129.132","TLSv1.3","18930","DATA[15]"
"416","1.504196444","192.168.129.132","23.56.225.242","TCP","54","47500  >  443 [ACK] Seq=6597 Ack=789369 Win=65535 Len=0"
"417","1.504352970","192.168.129.132","23.56.225.242","TCP","54","47500  >  443 [ACK] Seq=6597 Ack=808245 Win=65535 Len=0"
"418","1.504553073","23.56.225.242","192.168.129.132","TCP","2958","443  >  47500 [PSH, ACK] Seq=808245 Ack=6597 Win=64240 Len=2904 [TCP PDU reassembled in 420]"
"419","1.505881355","23.56.225.242","192.168.129.132","TCP","7314","443  >  47500 [PSH, ACK] Seq=811149 Ack=6597 Win=64240 Len=7260 [TCP PDU reassembled in 420]"
"420","1.507276209","23.56.225.242","192.168.129.132","TLSv1.3","20382","DATA[15]"
"421","1.507347630","192.168.129.132","23.56.225.242","TCP","54","47500  >  443 [ACK] Seq=6597 Ack=818409 Win=65535 Len=0"
"422","1.507603746","192.168.129.132","23.56.225.242","TCP","54","47500  >  443 [ACK] Seq=6597 Ack=838737 Win=65535 Len=0"
"423","1.508269156","23.56.225.242","192.168.129.132","TCP","10218","443  >  47500 [PSH, ACK] Seq=838737 Ack=6597 Win=64240 Len=10164 [TCP PDU reassembled in 430]"
"424","1.508269528","23.56.225.242","192.168.129.132","TLSv1.3","628","New Session Ticket, New Session Ticket"
"425","1.508349465","192.168.129.132","23.56.225.242","TCP","54","47500  >  443 [ACK] Seq=6597 Ack=848901 Win=65535 Len=0"
"426","1.510731211","192.168.129.132","23.56.225.242","TLSv1.3","78","Alert (Level: Warning, Description: Close Notify)"
"427","1.511028687","192.168.129.132","23.56.225.242","TCP","54","47538  >  443 [FIN, ACK] Seq=2113 Ack=4575 Win=65535 Len=0"
"428","1.511187759","23.56.225.242","192.168.129.132","TCP","60","443  >  47538 [ACK] Seq=4575 Ack=2113 Win=64240 Len=0"
"429","1.511577014","23.56.225.242","192.168.129.132","TCP","60","443  >  47538 [ACK] Seq=4575 Ack=2114 Win=64239 Len=0"
"430","1.513931732","23.56.225.242","192.168.129.132","TLSv1.3","11670","DATA[37]"
"431","1.513964278","192.168.129.132","23.56.225.242","TCP","54","47500  >  443 [ACK] Seq=6597 Ack=860517 Win=65535 Len=0"
"432","1.514079519","23.56.225.242","192.168.129.132","TLSv1.3","17478","DATA[37]"
"433","1.514100835","192.168.129.132","23.56.225.242","TCP","54","47500  >  443 [ACK] Seq=6597 Ack=877941 Win=65535 Len=0"
"434","1.514165086","23.56.225.242","192.168.129.132","TCP","8766","443  >  47500 [PSH, ACK] Seq=877941 Ack=6597 Win=64240 Len=8712 [TCP PDU reassembled in 435]"
"435","1.514165238","23.56.225.242","192.168.129.132","TLSv1.3","8766","DATA[37]"
"436","1.514357774","192.168.129.132","23.56.225.242","TCP","54","47500  >  443 [ACK] Seq=6597 Ack=895365 Win=65535 Len=0"
"437","1.514404467","23.56.225.242","192.168.129.132","HTTP2","14574","DATA[37], HEADERS[35]: 200 OK"
"438","1.514436578","192.168.129.132","23.56.225.242","TCP","54","47500  >  443 [ACK] Seq=6597 Ack=909885 Win=65535 Len=0"
"439","1.514445864","23.56.225.242","192.168.129.132","HTTP2","5862","DATA[35] (PNG), HEADERS[45]: 200 OK"
"440","1.514494847","192.168.129.132","23.56.225.242","TCP","54","47500  >  443 [ACK] Seq=6597 Ack=915693 Win=65535 Len=0"
"441","1.514710141","23.56.225.242","192.168.129.132","TCP","4410","443  >  47500 [PSH, ACK] Seq=915693 Ack=6597 Win=64240 Len=4356 [TCP PDU reassembled in 445]"
"442","1.514710396","23.56.225.242","192.168.129.132","TCP","4410","443  >  47500 [PSH, ACK] Seq=920049 Ack=6597 Win=64240 Len=4356 [TCP PDU reassembled in 445]"
"443","1.514731824","192.168.129.132","23.56.225.242","TCP","54","47500  >  443 [ACK] Seq=6597 Ack=920049 Win=65535 Len=0"
"444","1.514816557","192.168.129.132","23.56.225.242","TCP","54","47500  >  443 [ACK] Seq=6597 Ack=924405 Win=65535 Len=0"
"445","1.515008757","23.56.225.242","192.168.129.132","TLSv1.3","14574","DATA[45]"
"446","1.515027108","192.168.129.132","23.56.225.242","TCP","54","47500  >  443 [ACK] Seq=6597 Ack=938925 Win=65535 Len=0"
"447","1.515578553","23.56.225.242","192.168.129.132","HTTP2","13122","DATA[45], HEADERS[47]: 200 OK"
"448","1.515604680","192.168.129.132","23.56.225.242","TCP","54","47500  >  443 [ACK] Seq=6597 Ack=951993 Win=65535 Len=0"
"449","1.517612712","23.56.225.242","192.168.129.132","TLSv1.3","21834","DATA[47]"
"450","1.517646248","192.168.129.132","23.56.225.242","TCP","54","47500  >  443 [ACK] Seq=6597 Ack=973773 Win=65535 Len=0"
"451","1.517927706","23.56.225.242","192.168.129.132","HTTP2","3452","DATA[47]"
"452","1.517970425","192.168.129.132","23.56.225.242","TCP","54","47500  >  443 [ACK] Seq=6597 Ack=977171 Win=65535 Len=0"
"453","1.521151876","23.56.225.242","192.168.129.132","HTTP2","16233","DATA[49]"
"454","1.521207983","192.168.129.132","23.56.225.242","TCP","54","47500  >  443 [ACK] Seq=6597 Ack=993350 Win=65535 Len=0"
"455","1.521426268","23.56.225.242","192.168.129.132","TLSv1.3","1940","[TLS segment of a reassembled PDU]"
"456","1.521426835","23.56.225.242","192.168.129.132","TLSv1.3","628","New Session Ticket, New Session Ticket"
"457","1.521459971","192.168.129.132","23.56.225.242","TCP","54","47500  >  443 [ACK] Seq=6597 Ack=995236 Win=65535 Len=0"
"458","1.522681197","23.56.225.242","192.168.129.132","HTTP2","13813","DATA[49]"
"459","1.522724616","192.168.129.132","23.56.225.242","TCP","54","47500  >  443 [ACK] Seq=6597 Ack=1008995 Win=65535 Len=0"
"460","1.524435546","192.168.129.132","23.56.225.242","TLSv1.3","78","Alert (Level: Warning, Description: Close Notify)"
"461","1.524668974","192.168.129.132","23.56.225.242","TCP","54","47522  >  443 [FIN, ACK] Seq=2113 Ack=4575 Win=65535 Len=0"
"462","1.524964778","23.56.225.242","192.168.129.132","TCP","60","443  >  47522 [ACK] Seq=4575 Ack=2113 Win=64240 Len=0"
"463","1.525390029","23.56.225.242","192.168.129.132","TCP","60","443  >  47522 [ACK] Seq=4575 Ack=2114 Win=64239 Len=0"
"464","1.554554519","23.56.225.242","192.168.129.132","HTTP2","146","SETTINGS[0]"
"465","1.554596194","192.168.129.132","23.56.225.242","TCP","54","47538  >  443 [RST] Seq=2114 Win=0 Len=0"
"466","1.574422566","23.56.225.242","192.168.129.132","HTTP2","146","SETTINGS[0]"
"467","1.574530624","192.168.129.132","23.56.225.242","TCP","54","47522  >  443 [RST] Seq=2114 Win=0 Len=0"
"468","1.796224498","192.168.129.132","23.56.225.242","HTTP2","282","HEADERS[51]: POST /c99a4269-161c-4242-a3f0-28d44fa6ce24?, WINDOW_UPDATE[51]"
"469","1.796384990","192.168.129.132","23.56.225.242","HTTP2","1175","DATA[51]"
"470","1.796695217","192.168.129.132","23.56.225.242","HTTP2","663","DATA[51] (application/x-www-form-urlencoded)"
"471","1.796769561","23.56.225.242","192.168.129.132","TCP","60","443  >  47500 [ACK] Seq=1008995 Ack=6825 Win=64240 Len=0"
"472","1.796769832","23.56.225.242","192.168.129.132","TCP","60","443  >  47500 [ACK] Seq=1008995 Ack=7946 Win=64240 Len=0"
"473","1.797215748","23.56.225.242","192.168.129.132","TCP","60","443  >  47500 [ACK] Seq=1008995 Ack=8555 Win=64240 Len=0"
"474","1.808220557","192.168.129.132","23.56.225.242","HTTP2","228","HEADERS[53]: POST /c99a4269-161c-4242-a3f0-28d44fa6ce24?, WINDOW_UPDATE[53]"
"475","1.808461185","192.168.129.132","23.56.225.242","HTTP2","1175","DATA[53]"
"476","1.808578253","23.56.225.242","192.168.129.132","TCP","60","443  >  47500 [ACK] Seq=1008995 Ack=8729 Win=64240 Len=0"
"477","1.808578549","23.56.225.242","192.168.129.132","TCP","60","443  >  47500 [ACK] Seq=1008995 Ack=9850 Win=64240 Len=0"
"478","1.808822671","192.168.129.132","23.56.225.242","HTTP2","1429","DATA[53] (application/x-www-form-urlencoded)"
"479","1.809211642","23.56.225.242","192.168.129.132","TCP","60","443  >  47500 [ACK] Seq=1008995 Ack=11225 Win=64240 Len=0"
"480","1.908366195","23.56.225.242","192.168.129.132","HTTP2","613","DATA[53] (text/plain)"
"481","1.948859104","192.168.129.132","23.56.225.242","TCP","54","47500  >  443 [ACK] Seq=11225 Ack=1009554 Win=65535 Len=0"
"482","2.146194145","23.56.225.242","192.168.129.132","HTTP2","851","DATA[51] (text/plain)"
"483","2.146242073","192.168.129.132","23.56.225.242","TCP","54","47500  >  443 [ACK] Seq=11225 Ack=1010351 Win=65535 Len=0"
"484","2.642760873","192.168.129.132","192.168.129.2","DNS","75","Standard query 0x7406 A mass.mako.co.il"
"485","2.648773563","192.168.129.2","192.168.129.132","DNS","167","Standard query response 0x7406 A mass.mako.co.il CNAME wilcard.mako.co.il.edgekey.net CNAME e974.b.akamaiedge.net A 23.56.225.242"
"486","2.667762866","192.168.129.132","23.56.225.242","TCP","74","47554  >  443 [SYN] Seq=0 Win=64240 Len=0 MSS=1460 SACK_PERM TSval=102858173 TSecr=0 WS=128"
"487","2.713599125","23.56.225.242","192.168.129.132","TCP","60","443  >  47554 [SYN, ACK] Seq=0 Ack=1 Win=64240 Len=0 MSS=1460"
"488","2.713656481","192.168.129.132","23.56.225.242","TCP","54","47554  >  443 [ACK] Seq=1 Ack=1 Win=64240 Len=0"
"489","2.715346842","192.168.129.132","23.56.225.242","TLSv1.3","1954","Client Hello (SNI=mass.mako.co.il)"
"490","2.715955869","23.56.225.242","192.168.129.132","TCP","60","443  >  47554 [ACK] Seq=1 Ack=1461 Win=64240 Len=0"
"491","2.715956232","23.56.225.242","192.168.129.132","TCP","60","443  >  47554 [ACK] Seq=1 Ack=1901 Win=64240 Len=0"
"492","2.734884409","192.168.129.132","23.56.225.242","TCP","74","47566  >  443 [SYN] Seq=0 Win=64240 Len=0 MSS=1460 SACK_PERM TSval=102858241 TSecr=0 WS=128"
"493","2.785452533","23.56.225.242","192.168.129.132","TCP","60","443  >  47566 [SYN, ACK] Seq=0 Ack=1 Win=64240 Len=0 MSS=1460"
"494","2.785539111","192.168.129.132","23.56.225.242","TCP","54","47566  >  443 [ACK] Seq=1 Ack=1 Win=64240 Len=0"
"495","2.787547172","192.168.129.132","23.56.225.242","TLSv1.3","1954","Client Hello (SNI=mass.mako.co.il)"
"496","2.788382620","23.56.225.242","192.168.129.132","TCP","60","443  >  47566 [ACK] Seq=1 Ack=1461 Win=64240 Len=0"
"497","2.788383182","23.56.225.242","192.168.129.132","TCP","60","443  >  47566 [ACK] Seq=1 Ack=1901 Win=64240 Len=0"
"498","2.808191936","192.168.129.132","23.56.225.242","HTTP2","152","HEADERS[55]: GET /2021/05/23/haparmlament_logo.png, WINDOW_UPDATE[55]"
"499","2.808573057","23.56.225.242","192.168.129.132","TCP","60","443  >  47500 [ACK] Seq=1010351 Ack=11323 Win=64240 Len=0"
"500","2.809686576","192.168.129.132","23.56.225.242","HTTP2","154","HEADERS[57]: GET /2021/08/16/Parliament_3a_X5_re.jpg, WINDOW_UPDATE[57]"
"501","2.809935970","23.56.225.242","192.168.129.132","TCP","60","443  >  47500 [ACK] Seq=1010351 Ack=11423 Win=64240 Len=0"
"502","2.811667228","23.56.225.242","192.168.129.132","TLSv1.3","1506","Server Hello, Change Cipher Spec, Encrypted Extensions"
"503","2.811841757","192.168.129.132","23.56.225.242","TCP","54","47554  >  443 [ACK] Seq=1901 Ack=1453 Win=65535 Len=0"
"504","2.812966903","23.56.225.242","192.168.129.132","TLSv1.3","2602","Certificate, Certificate Verify, Finished"
"505","2.813019838","192.168.129.132","23.56.225.242","TCP","54","47554  >  443 [ACK] Seq=1901 Ack=4001 Win=65535 Len=0"
"506","2.821686053","192.168.129.132","23.56.225.242","TLSv1.3","134","Change Cipher Spec, Finished"
"507","2.822355378","23.56.225.242","192.168.129.132","TCP","60","443  >  47554 [ACK] Seq=4001 Ack=1981 Win=64240 Len=0"
"508","2.824226305","192.168.129.132","23.56.225.242","HTTP2","146","Magic, SETTINGS[0], WINDOW_UPDATE[0]"
"509","2.824527370","192.168.129.132","23.56.225.242","HTTP2","369","HEADERS[3]: GET /ClicksStatistics/isAbroad.jsp, WINDOW_UPDATE[3]"
"510","2.824920297","23.56.225.242","192.168.129.132","TCP","60","443  >  47554 [ACK] Seq=4001 Ack=2073 Win=64240 Len=0"
"511","2.824920901","23.56.225.242","192.168.129.132","TCP","60","443  >  47554 [ACK] Seq=4001 Ack=2388 Win=64240 Len=0"
"512","2.831281553","192.168.129.132","23.56.225.242","HTTP2","176","HEADERS[5]: GET /ClicksStatistics/get12History.jsp?deviceId=d41837d9-79f5-4ec8-b9d8-4c23774c0d2c, WINDOW_UPDATE[5]"
"513","2.831685987","23.56.225.242","192.168.129.132","TCP","60","443  >  47554 [ACK] Seq=4001 Ack=2510 Win=64240 Len=0"
"514","2.854421878","23.56.225.242","192.168.129.132","HTTP2","11925","HEADERS[55]: 200 OK"
"515","2.854463350","192.168.129.132","23.56.225.242","TCP","54","47500  >  443 [ACK] Seq=11423 Ack=1022222 Win=65535 Len=0"
"516","2.854523249","23.56.225.242","192.168.129.132","TLSv1.3","4844","[TLS segment of a reassembled PDU]"
"517","2.854529993","192.168.129.132","23.56.225.242","TCP","54","47500  >  443 [ACK] Seq=11423 Ack=1027012 Win=65535 Len=0"
"518","2.856056666","23.56.225.242","192.168.129.132","HTTP2","16491","[TLS segment of a reassembled PDU]"
"519","2.856110655","192.168.129.132","23.56.225.242","TCP","54","47500  >  443 [ACK] Seq=11423 Ack=1043449 Win=65535 Len=0"
"520","2.857367822","23.56.225.242","192.168.129.132","HTTP2","13122","DATA[55]"
"521","2.857444048","192.168.129.132","23.56.225.242","TCP","54","47500  >  443 [ACK] Seq=11423 Ack=1056517 Win=65535 Len=0"
"522","2.857563571","23.56.225.242","192.168.129.132","TLSv1.3","14574","DATA[55]"
"523","2.857617845","192.168.129.132","23.56.225.242","TCP","54","47500  >  443 [ACK] Seq=11423 Ack=1071037 Win=65535 Len=0"
"524","2.857730291","23.56.225.242","192.168.129.132","HTTP2","2225","DATA[55] (PNG)"
"525","2.857747516","192.168.129.132","23.56.225.242","TCP","54","47500  >  443 [ACK] Seq=11423 Ack=1073208 Win=65535 Len=0"
"526","2.867265772","23.56.225.242","192.168.129.132","TLSv1.3","628","New Session Ticket, New Session Ticket"
"527","2.879934445","23.56.225.242","192.168.129.132","TLSv1.3","1506","Server Hello, Change Cipher Spec, Encrypted Extensions"
"528","2.880029232","192.168.129.132","23.56.225.242","TCP","54","47566  >  443 [ACK] Seq=1901 Ack=1453 Win=65535 Len=0"
"529","2.881548107","23.56.225.242","192.168.129.132","TLSv1.3","2602","Certificate, Certificate Verify, Finished"
"530","2.881658937","192.168.129.132","23.56.225.242","TCP","54","47566  >  443 [ACK] Seq=1901 Ack=4001 Win=65535 Len=0"
"531","2.884872563","192.168.129.132","23.56.225.242","TLSv1.3","134","Change Cipher Spec, Finished"
"532","2.886055324","23.56.225.242","192.168.129.132","TCP","60","443  >  47566 [ACK] Seq=4001 Ack=1981 Win=64240 Len=0"
"533","2.886676065","192.168.129.132","23.56.225.242","HTTP2","163","Magic, SETTINGS[0], WINDOW_UPDATE[0], GOAWAY[0]"
"534","2.887166904","23.56.225.242","192.168.129.132","TCP","60","443  >  47566 [ACK] Seq=4001 Ack=2090 Win=64240 Len=0"
"535","2.888652619","192.168.129.132","23.56.225.242","HTTP2","196","HEADERS[7]: GET /ClicksStatistics/entitlementsServicesV2.jsp?et=gdt&deviceId=d41837d9-79f5-4ec8-b9d8-4c23774c0d2c&appGroup=1, WINDOW_UPDATE[7]"
"536","2.888956125","23.56.225.242","192.168.129.132","TCP","60","443  >  47554 [ACK] Seq=4575 Ack=2652 Win=64240 Len=0"
"537","2.902410712","192.168.129.132","23.56.225.242","HTTP2","324","HEADERS[59]: GET /mako-vod/_next/static/chunks/pages/%5Bmako_vod_channel%5D/%5B...episode%5D-9344d91488a436d7.js, WINDOW_UPDATE[59]"
"538","2.902937186","23.56.225.242","192.168.129.132","TCP","60","443  >  47500 [ACK] Seq=1073208 Ack=11693 Win=64240 Len=0"
"539","2.909477306","23.56.225.242","192.168.129.132","HTTP2","9009","HEADERS[57]: 200 OK"
"540","2.909477613","23.56.225.242","192.168.129.132","TLSv1.3","23720","DATA[57]"
"541","2.909517825","192.168.129.132","23.56.225.242","TCP","54","47500  >  443 [ACK] Seq=11693 Ack=1082163 Win=65535 Len=0"
"542","2.909640277","192.168.129.132","23.56.225.242","TCP","54","47500  >  443 [ACK] Seq=11693 Ack=1105829 Win=65535 Len=0"
"543","2.909699519","23.56.225.242","192.168.129.132","TLSv1.3","519","[TLS segment of a reassembled PDU]"
"544","2.909850942","192.168.129.132","23.56.225.242","TCP","54","47500  >  443 [ACK] Seq=11693 Ack=1106294 Win=65535 Len=0"
"545","2.917281133","23.56.225.242","192.168.129.132","HTTP2","10218","DATA[57]"
"546","2.917281525","23.56.225.242","192.168.129.132","TLSv1.3","8766","DATA[57]"
"547","2.917376750","192.168.129.132","23.56.225.242","TCP","54","47500  >  443 [ACK] Seq=11693 Ack=1116458 Win=65535 Len=0"
"548","2.917630027","192.168.129.132","23.56.225.242","TCP","54","47500  >  443 [ACK] Seq=11693 Ack=1125170 Win=65535 Len=0"
"549","2.917828608","23.56.225.242","192.168.129.132","TCP","8766","443  >  47500 [PSH, ACK] Seq=1125170 Ack=11693 Win=64240 Len=8712 [TCP PDU reassembled in 551]"
"550","2.917876216","192.168.129.132","23.56.225.242","TCP","54","47500  >  443 [ACK] Seq=11693 Ack=1133882 Win=65535 Len=0"
"551","2.918351460","23.56.225.242","192.168.129.132","TLSv1.3","5862","DATA[57]"
"552","2.918351659","23.56.225.242","192.168.129.132","TCP","13122","443  >  47500 [PSH, ACK] Seq=1139690 Ack=11693 Win=64240 Len=13068 [TCP PDU reassembled in 555]"
"553","2.918387667","192.168.129.132","23.56.225.242","TCP","54","47500  >  443 [ACK] Seq=11693 Ack=1139690 Win=65535 Len=0"
"554","2.918476084","192.168.129.132","23.56.225.242","TCP","54","47500  >  443 [ACK] Seq=11693 Ack=1152758 Win=65535 Len=0"
"555","2.918503840","23.56.225.242","192.168.129.132","TLSv1.3","11670","DATA[57]"
"556","2.918552867","192.168.129.132","23.56.225.242","TCP","54","47500  >  443 [ACK] Seq=11693 Ack=1164374 Win=65535 Len=0"
"557","2.918658508","23.56.225.242","192.168.129.132","TLSv1.3","16026","DATA[57]"
"558","2.918676905","192.168.129.132","23.56.225.242","TCP","54","47500  >  443 [ACK] Seq=11693 Ack=1180346 Win=65535 Len=0"
"559","2.918811060","23.56.225.242","192.168.129.132","TCP","2958","443  >  47500 [PSH, ACK] Seq=1180346 Ack=11693 Win=64240 Len=2904 [TCP PDU reassembled in 560]"
"560","2.918811263","23.56.225.242","192.168.129.132","TLSv1.3","5862","DATA[57]"
"561","2.918835120","192.168.129.132","23.56.225.242","TCP","54","47500  >  443 [ACK] Seq=11693 Ack=1183250 Win=65535 Len=0"
"562","2.918942169","192.168.129.132","23.56.225.242","TCP","54","47500  >  443 [ACK] Seq=11693 Ack=1189058 Win=65535 Len=0"
"563","2.919685758","23.56.225.242","192.168.129.132","TCP","11670","443  >  47500 [PSH, ACK] Seq=1189058 Ack=11693 Win=64240 Len=11616 [TCP PDU reassembled in 565]"
"564","2.919777978","192.168.129.132","23.56.225.242","TCP","54","47500  >  443 [ACK] Seq=11693 Ack=1200674 Win=65535 Len=0"
"565","2.919981259","23.56.225.242","192.168.129.132","TLSv1.3","7314","DATA[57]"
"566","2.919981439","23.56.225.242","192.168.129.132","TCP","8766","443  >  47500 [PSH, ACK] Seq=1207934 Ack=11693 Win=64240 Len=8712 [TCP PDU reassembled in 570]"
"567","2.920010171","192.168.129.132","23.56.225.242","TCP","54","47500  >  443 [ACK] Seq=11693 Ack=1207934 Win=65535 Len=0"
"568","2.920081997","192.168.129.132","23.56.225.242","TCP","54","47500  >  443 [ACK] Seq=11693 Ack=1216646 Win=65535 Len=0"
"569","2.920145256","23.56.225.242","192.168.129.132","TCP","1506","443  >  47500 [PSH, ACK] Seq=1216646 Ack=11693 Win=64240 Len=1452 [TCP PDU reassembled in 570]"
"570","2.920145604","23.56.225.242","192.168.129.132","TLSv1.3","4410","DATA[57]"
"571","2.920145654","23.56.225.242","192.168.129.132","TCP","4410","443  >  47500 [PSH, ACK] Seq=1222454 Ack=11693 Win=64240 Len=4356 [TCP PDU reassembled in 577]"
"572","2.920145693","23.56.225.242","192.168.129.132","TCP","8766","443  >  47500 [PSH, ACK] Seq=1226810 Ack=11693 Win=64240 Len=8712 [TCP PDU reassembled in 577]"
"573","2.920163297","192.168.129.132","23.56.225.242","TCP","54","47500  >  443 [ACK] Seq=11693 Ack=1218098 Win=65535 Len=0"
"574","2.920855055","192.168.129.132","23.56.225.242","TCP","54","47500  >  443 [ACK] Seq=11693 Ack=1222454 Win=65535 Len=0"
"575","2.920921639","192.168.129.132","23.56.225.242","TCP","54","47500  >  443 [ACK] Seq=11693 Ack=1226810 Win=65535 Len=0"
"576","2.921035416","192.168.129.132","23.56.225.242","TCP","54","47500  >  443 [ACK] Seq=11693 Ack=1235522 Win=65535 Len=0"
"577","2.921044638","23.56.225.242","192.168.129.132","TLSv1.3","13122","DATA[57]"
"578","2.921187959","192.168.129.132","23.56.225.242","TCP","54","47500  >  443 [ACK] Seq=11693 Ack=1248590 Win=65535 Len=0"
"579","2.921393619","23.56.225.242","192.168.129.132","TCP","4410","443  >  47500 [PSH, ACK] Seq=1248590 Ack=11693 Win=64240 Len=4356 [TCP PDU reassembled in 581]"
"580","2.921540316","192.168.129.132","23.56.225.242","TCP","54","47500  >  443 [ACK] Seq=11693 Ack=1252946 Win=65535 Len=0"
"581","2.924708243","23.56.225.242","192.168.129.132","TLSv1.3","5862","DATA[57]"
"582","2.924708700","23.56.225.242","192.168.129.132","TLSv1.3","14574","DATA[57]"
"583","2.924769189","192.168.129.132","23.56.225.242","TCP","54","47500  >  443 [ACK] Seq=11693 Ack=1258754 Win=65535 Len=0"
"584","2.924867670","192.168.129.132","23.56.225.242","TCP","54","47500  >  443 [ACK] Seq=11693 Ack=1273274 Win=65535 Len=0"
"585","2.924913405","23.56.225.242","192.168.129.132","TLSv1.3","17478","DATA[57]"
"586","2.924920296","192.168.129.132","23.56.225.242","TCP","54","47500  >  443 [ACK] Seq=11693 Ack=1290698 Win=65535 Len=0"
"587","2.924964866","23.56.225.242","192.168.129.132","TCP","11670","443  >  47500 [PSH, ACK] Seq=1290698 Ack=11693 Win=64240 Len=11616 [TCP PDU reassembled in 589]"
"588","2.924969316","192.168.129.132","23.56.225.242","TCP","54","47500  >  443 [ACK] Seq=11693 Ack=1302314 Win=65535 Len=0"
"589","2.925918164","23.56.225.242","192.168.129.132","TLSv1.3","17478","DATA[57]"
"590","2.925954044","192.168.129.132","23.56.225.242","TCP","54","47500  >  443 [ACK] Seq=11693 Ack=1319738 Win=65535 Len=0"
"591","2.926066434","23.56.225.242","192.168.129.132","TLSv1.3","8766","DATA[57]"
"592","2.926066563","23.56.225.242","192.168.129.132","HTTP2","7314","DATA[57]"
"593","2.926265922","192.168.129.132","23.56.225.242","TCP","54","47500  >  443 [ACK] Seq=11693 Ack=1328450 Win=65535 Len=0"
"594","2.926569016","192.168.129.132","23.56.225.242","TCP","54","47500  >  443 [ACK] Seq=11693 Ack=1335710 Win=65535 Len=0"
"595","2.926625855","23.56.225.242","192.168.129.132","TCP","8766","443  >  47500 [PSH, ACK] Seq=1335710 Ack=11693 Win=64240 Len=8712 [TCP PDU reassembled in 599]"
"596","2.926625936","23.56.225.242","192.168.129.132","TCP","4410","443  >  47500 [PSH, ACK] Seq=1344422 Ack=11693 Win=64240 Len=4356 [TCP PDU reassembled in 599]"
"597","2.926643042","192.168.129.132","23.56.225.242","TCP","54","47500  >  443 [ACK] Seq=11693 Ack=1344422 Win=65535 Len=0"
"598","2.926689370","192.168.129.132","23.56.225.242","TCP","54","47500  >  443 [ACK] Seq=11693 Ack=1348778 Win=65535 Len=0"
"599","2.926754238","23.56.225.242","192.168.129.132","TLSv1.3","23286","DATA[57]"
"600","2.926763438","192.168.129.132","23.56.225.242","TCP","54","47500  >  443 [ACK] Seq=11693 Ack=1372010 Win=65535 Len=0"
"601","2.933278266","23.56.225.242","192.168.129.132","TLSv1.3","21834","DATA[57]"
"602","2.933361878","192.168.129.132","23.56.225.242","TCP","54","47500  >  443 [ACK] Seq=11693 Ack=1393790 Win=65535 Len=0"
"603","2.933558170","23.56.225.242","192.168.129.132","TLSv1.3","21834","DATA[57]"
"604","2.933986597","192.168.129.132","23.56.225.242","TCP","54","47500  >  443 [ACK] Seq=11693 Ack=1415570 Win=65535 Len=0"
"605","2.934144662","23.56.225.242","192.168.129.132","TLSv1.3","1506","DATA[57]"
"606","2.934144840","23.56.225.242","192.168.129.132","TCP","7314","443  >  47500 [PSH, ACK] Seq=1417022 Ack=11693 Win=64240 Len=7260 [TCP PDU reassembled in 607]"
"607","2.934144877","23.56.225.242","192.168.129.132","TLSv1.3","12021","DATA[57]"
"608","2.934169357","192.168.129.132","23.56.225.242","TCP","54","47500  >  443 [ACK] Seq=11693 Ack=1417022 Win=65535 Len=0"
"609","2.934234187","192.168.129.132","23.56.225.242","TCP","54","47500  >  443 [ACK] Seq=11693 Ack=1424282 Win=65535 Len=0"
"610","2.936382335","192.168.129.132","23.56.225.242","TCP","54","47500  >  443 [ACK] Seq=11693 Ack=1436249 Win=65535 Len=0"
"611","2.936431743","23.56.225.242","192.168.129.132","TLSv1.3","21834","DATA[57]"
"612","2.936460979","192.168.129.132","23.56.225.242","TCP","54","47500  >  443 [ACK] Seq=11693 Ack=1458029 Win=65535 Len=0"
"613","2.939124398","23.56.225.242","192.168.129.132","TLSv1.3","21834","DATA[57]"
"614","2.939611172","23.56.225.242","192.168.129.132","TLSv1.3","8766","DATA[57]"
"615","2.939611343","23.56.225.242","192.168.129.132","HTTP2","146","SETTINGS[0]"
"616","2.939642945","192.168.129.132","23.56.225.242","TCP","54","47500  >  443 [ACK] Seq=11693 Ack=1479809 Win=65535 Len=0"
"617","2.939867898","192.168.129.132","23.56.225.242","TCP","54","47500  >  443 [ACK] Seq=11693 Ack=1488521 Win=65535 Len=0"
"618","2.940195362","23.56.225.242","192.168.129.132","HTTP2","4745","DATA[57] (JPEG JFIF image)"
"619","2.940195721","23.56.225.242","192.168.129.132","TLSv1.3","628","New Session Ticket, New Session Ticket"
"620","2.940374741","192.168.129.132","23.56.225.242","TCP","54","47500  >  443 [ACK] Seq=11693 Ack=1493212 Win=65535 Len=0"
"621","2.942075369","192.168.129.132","23.56.225.242","HTTP2","85","SETTINGS[0]"
"622","2.942503026","23.56.225.242","192.168.129.132","TCP","60","443  >  47554 [ACK] Seq=4667 Ack=2683 Win=64240 Len=0"
"623","2.944037576","192.168.129.132","23.56.225.242","TLSv1.3","78","Alert (Level: Warning, Description: Close Notify)"
"624","2.944282027","192.168.129.132","23.56.225.242","TCP","54","47566  >  443 [FIN, ACK] Seq=2114 Ack=4575 Win=65535 Len=0"
"625","2.944389973","23.56.225.242","192.168.129.132","TCP","60","443  >  47566 [ACK] Seq=4575 Ack=2114 Win=64240 Len=0"
"626","2.944669004","23.56.225.242","192.168.129.132","TCP","60","443  >  47566 [ACK] Seq=4575 Ack=2115 Win=64239 Len=0"
"627","2.955703602","23.56.225.242","192.168.129.132","HTTP2","4337","DATA[59]"
"628","2.955898465","192.168.129.132","23.56.225.242","TCP","54","47500  >  443 [ACK] Seq=11693 Ack=1497495 Win=65535 Len=0"
"629","2.980949287","23.56.225.242","192.168.129.132","HTTP2","146","SETTINGS[0]"
"630","2.980988468","192.168.129.132","23.56.225.242","TCP","54","47566  >  443 [RST] Seq=2115 Win=0 Len=0"
"631","2.998551111","192.168.129.132","23.56.225.242","HTTP2","168","HEADERS[61]: GET /2023/11/19/haparlament_01_191123_vod_re_autoOrient_i.jpg, WINDOW_UPDATE[61]"
"632","2.999427521","23.56.225.242","192.168.129.132","TCP","60","443  >  47500 [ACK] Seq=1497495 Ack=11807 Win=64240 Len=0"
"633","3.007884522","192.168.129.132","23.56.225.242","HTTP2","166","HEADERS[63]: GET /2023/11/19/haparlament_02_191123_vod_autoOrient_i.jpg, WINDOW_UPDATE[63]"
"634","3.008224378","23.56.225.242","192.168.129.132","TCP","60","443  >  47500 [ACK] Seq=1497495 Ack=11919 Win=64240 Len=0"
"635","3.009908684","192.168.129.132","23.56.225.242","HTTP2","166","HEADERS[65]: GET /2023/11/19/haparlament_03_191123_vod_autoOrient_i.jpg, WINDOW_UPDATE[65]"
"636","3.010237197","23.56.225.242","192.168.129.132","TCP","60","443  >  47500 [ACK] Seq=1497495 Ack=12031 Win=64240 Len=0"
"637","3.010965457","192.168.129.132","23.56.225.242","HTTP2","166","HEADERS[67]: GET /2023/11/19/haparlament_04_191123_vod_autoOrient_i.jpg, WINDOW_UPDATE[67]"
"638","3.011288413","23.56.225.242","192.168.129.132","TCP","60","443  >  47500 [ACK] Seq=1497495 Ack=12143 Win=64240 Len=0"
"639","3.017229434","23.56.225.242","192.168.129.132","HTTP2","1120","DATA[3] (text/html)"
"640","3.017247577","192.168.129.132","23.56.225.242","HTTP2","166","HEADERS[69]: GET /2023/11/19/haparlament_05_191123_vod_autoOrient_i.jpg, WINDOW_UPDATE[69]"
"641","3.017628555","23.56.225.242","192.168.129.132","TCP","60","443  >  47500 [ACK] Seq=1497495 Ack=12255 Win=64240 Len=0"
"642","3.023671473","192.168.129.132","23.56.225.242","HTTP2","166","HEADERS[71]: GET /2023/11/19/haparlament_06_191123_vod_autoOrient_i.jpg, WINDOW_UPDATE[71]"
"643","3.024086747","23.56.225.242","192.168.129.132","TCP","60","443  >  47500 [ACK] Seq=1497495 Ack=12367 Win=64240 Len=0"
"644","3.030856667","192.168.129.132","23.56.225.242","HTTP2","166","HEADERS[73]: GET /2023/11/19/haparlament_07_191123_vod_autoOrient_i.jpg, WINDOW_UPDATE[73]"
"645","3.031256995","23.56.225.242","192.168.129.132","TCP","60","443  >  47500 [ACK] Seq=1497495 Ack=12479 Win=64240 Len=0"
"646","3.033612279","192.168.129.132","23.56.225.242","HTTP2","166","HEADERS[75]: GET /2023/11/19/haparlament_09_191123_vod_autoOrient_i.jpg, WINDOW_UPDATE[75]"
"647","3.034158293","23.56.225.242","192.168.129.132","TCP","60","443  >  47500 [ACK] Seq=1497495 Ack=12591 Win=64240 Len=0"
"648","3.041761131","192.168.129.132","23.56.225.242","HTTP2","166","HEADERS[77]: GET /2023/11/19/haparlament_08_191123_vod_autoOrient_i.jpg, WINDOW_UPDATE[77]"
"649","3.042386167","23.56.225.242","192.168.129.132","TCP","60","443  >  47500 [ACK] Seq=1497495 Ack=12703 Win=64240 Len=0"
"650","3.045370734","192.168.129.132","23.56.225.242","HTTP2","166","HEADERS[79]: GET /2023/11/19/haparlament_10_191123_vod_autoOrient_i.jpg, WINDOW_UPDATE[79]"
"651","3.045925976","23.56.225.242","192.168.129.132","TCP","60","443  >  47500 [ACK] Seq=1497495 Ack=12815 Win=64240 Len=0"
"652","3.046628618","23.56.225.242","192.168.129.132","HTTP2","6118","HEADERS[61]: 200 OK"
"653","3.046628691","23.56.225.242","192.168.129.132","TLSv1.3","10652","[TLS segment of a reassembled PDU]"
"654","3.046676604","192.168.129.132","23.56.225.242","TCP","54","47500  >  443 [ACK] Seq=12815 Ack=1503559 Win=65535 Len=0"
"655","3.046907618","192.168.129.132","23.56.225.242","TCP","54","47500  >  443 [ACK] Seq=12815 Ack=1514157 Win=65535 Len=0"
"656","3.048943620","23.56.225.242","192.168.129.132","HTTP2","4410","DATA[61]"
"657","3.048944346","23.56.225.242","192.168.129.132","TLSv1.3","12135","[TLS segment of a reassembled PDU]"
"658","3.049053245","192.168.129.132","23.56.225.242","TCP","54","47500  >  443 [ACK] Seq=12815 Ack=1518513 Win=65535 Len=0"
"659","3.049152282","192.168.129.132","23.56.225.242","TCP","54","47500  >  443 [ACK] Seq=12815 Ack=1530594 Win=65535 Len=0"
"660","3.049406725","23.56.225.242","192.168.129.132","HTTP2","12296","DATA[61] (JPEG JFIF image)"
"661","3.049443029","192.168.129.132","23.56.225.242","TCP","54","47500  >  443 [ACK] Seq=12815 Ack=1542836 Win=65535 Len=0"
"662","3.056143567","192.168.129.132","23.56.225.242","HTTP2","260","HEADERS[81]: GET /mako-vod/_next/static/chunks/pages/mako-vod-56ec0042ec2aec5b.js, WINDOW_UPDATE[81]"
"663","3.056744815","23.56.225.242","192.168.129.132","TCP","60","443  >  47500 [ACK] Seq=1542836 Ack=13021 Win=64240 Len=0"
"664","3.057123409","192.168.129.132","23.56.225.242","HTTP2","257","HEADERS[83]: GET /mako-vod/_next/static/chunks/pages/mako-vod-live-tv/%5B...slug%5D-6ca99bd2265af826.js, WINDOW_UPDATE[83]"
"665","3.057488249","23.56.225.242","192.168.129.132","TCP","60","443  >  47500 [ACK] Seq=1542836 Ack=13224 Win=64240 Len=0"
"666","3.057816261","192.168.129.132","23.56.225.242","TCP","54","47554  >  443 [ACK] Seq=2683 Ack=5733 Win=65535 Len=0"
"667","3.058769664","192.168.129.132","23.56.225.242","HTTP2","245","HEADERS[85]: GET /mako-vod/_next/static/chunks/pages/mako-vod-index-4074a8bd5a2b6b7c.js, WINDOW_UPDATE[85]"
"668","3.059531462","23.56.225.242","192.168.129.132","TCP","60","443  >  47500 [ACK] Seq=1542836 Ack=13415 Win=64240 Len=0"
"669","3.060963279","192.168.129.132","23.56.225.242","HTTP2","246","HEADERS[87]: GET /mako-vod/_next/static/chunks/pages/mako-vod-purchase-8cf777c135ab14ae.js, WINDOW_UPDATE[87]"
"670","3.061461676","23.56.225.242","192.168.129.132","TCP","60","443  >  47500 [ACK] Seq=1542836 Ack=13607 Win=64240 Len=0"
"671","3.065323127","192.168.129.132","23.56.225.242","HTTP2","232","HEADERS[89]: GET /mako-vod/_next/static/chunks/282-7e656415b873a52b.js, WINDOW_UPDATE[89]"
"672","3.065735999","23.56.225.242","192.168.129.132","TCP","60","443  >  47500 [ACK] Seq=1542836 Ack=13785 Win=64240 Len=0"
"673","3.069094847","192.168.129.132","23.56.225.242","HTTP2","245","HEADERS[91]: GET /mako-vod/_next/static/chunks/pages/mako-vod-login-6cf840fbb598fec5.js, WINDOW_UPDATE[91]"
"674","3.069627427","23.56.225.242","192.168.129.132","TCP","60","443  >  47500 [ACK] Seq=1542836 Ack=13976 Win=64240 Len=0"
"675","3.087025297","23.56.225.242","192.168.129.132","HTTP2/JSON","1100","DATA[5], JSON (application/json)"
"676","3.087229942","192.168.129.132","23.56.225.242","TCP","54","47554  >  443 [ACK] Seq=2683 Ack=6779 Win=65535 Len=0"
"677","3.096089796","23.56.225.242","192.168.129.132","HTTP2","16702","[TLS segment of a reassembled PDU]"
"678","3.096235957","192.168.129.132","23.56.225.242","TCP","54","47500  >  443 [ACK] Seq=13976 Ack=1559484 Win=65535 Len=0"
"679","3.100746900","23.56.225.242","192.168.129.132","HTTP2","45531","HEADERS[67]: 200 OK"
"680","3.100841266","192.168.129.132","23.56.225.242","TCP","54","47500  >  443 [ACK] Seq=13976 Ack=1604961 Win=65535 Len=0"
"681","3.101008244","23.56.225.242","192.168.129.132","TLSv1.3","13194","DATA[67]"
"682","3.101022435","192.168.129.132","23.56.225.242","TCP","54","47500  >  443 [ACK] Seq=13976 Ack=1618101 Win=65535 Len=0"
"683","3.101241877","23.56.225.242","192.168.129.132","TCP","5676","443  >  47500 [PSH, ACK] Seq=1618101 Ack=13976 Win=64240 Len=5622 [TCP PDU reassembled in 686]"
"684","3.101264654","192.168.129.132","23.56.225.242","TCP","54","47500  >  443 [ACK] Seq=13976 Ack=1623723 Win=65535 Len=0"
"685","3.101531343","23.56.225.242","192.168.129.132","TCP","1514","443  >  47500 [ACK] Seq=1623723 Ack=13976 Win=64240 Len=1460 [TCP PDU reassembled in 686]"
"686","3.101711368","23.56.225.242","192.168.129.132","TLSv1.3","7420","DATA[67]"
"687","3.101721308","192.168.129.132","23.56.225.242","TCP","54","47500  >  443 [ACK] Seq=13976 Ack=1632549 Win=65535 Len=0"
"688","3.103210881","23.56.225.242","192.168.129.132","TCP","4410","443  >  47500 [PSH, ACK] Seq=1632549 Ack=13976 Win=64240 Len=4356 [TCP PDU reassembled in 689]"
"689","3.103211156","23.56.225.242","192.168.129.132","TLSv1.3","13122","HEADERS[69]: 200 OK"
"690","3.103261267","192.168.129.132","23.56.225.242","TCP","54","47500  >  443 [ACK] Seq=13976 Ack=1636905 Win=65535 Len=0"
"691","3.103317014","192.168.129.132","23.56.225.242","TCP","54","47500  >  443 [ACK] Seq=13976 Ack=1649973 Win=65535 Len=0"
"692","3.103358645","23.56.225.242","192.168.129.132","TCP","10218","443  >  47500 [PSH, ACK] Seq=1649973 Ack=13976 Win=64240 Len=10164 [TCP PDU reassembled in 693]"
"693","3.103358686","23.56.225.242","192.168.129.132","TLSv1.3","16026","DATA[69]"
"694","3.103370570","192.168.129.132","23.56.225.242","TCP","54","47500  >  443 [ACK] Seq=13976 Ack=1660137 Win=65535 Len=0"
"695","3.103395815","192.168.129.132","23.56.225.242","TCP","54","47500  >  443 [ACK] Seq=13976 Ack=1676109 Win=65535 Len=0"
"696","3.103672625","23.56.225.242","192.168.129.132","TLSv1.3","11670","DATA[69]"
"697","3.103689731","192.168.129.132","23.56.225.242","TCP","54","47500  >  443 [ACK] Seq=13976 Ack=1687725 Win=65535 Len=0"
"698","3.103738968","23.56.225.242","192.168.129.132","TLSv1.3","10218","DATA[69]"
"699","3.103739007","23.56.225.242","192.168.129.132","TCP","5862","443  >  47500 [PSH, ACK] Seq=1697889 Ack=13976 Win=64240 Len=5808 [TCP PDU reassembled in 702]"
"700","3.103748083","192.168.129.132","23.56.225.242","TCP","54","47500  >  443 [ACK] Seq=13976 Ack=1697889 Win=65535 Len=0"
"701","3.103763601","192.168.129.132","23.56.225.242","TCP","54","47500  >  443 [ACK] Seq=13976 Ack=1703697 Win=65535 Len=0"
"702","3.103886778","23.56.225.242","192.168.129.132","HTTP2","10218","DATA[69] (JPEG JFIF image), HEADERS[71]: 200 OK"
"703","3.103892593","192.168.129.132","23.56.225.242","TCP","54","47500  >  443 [ACK] Seq=13976 Ack=1713861 Win=65535 Len=0"
"704","3.110867147","23.56.225.242","192.168.129.132","TLSv1.3","24738","HEADERS[73]: 200 OK"
"705","3.110907794","192.168.129.132","23.56.225.242","TCP","54","47500  >  443 [ACK] Seq=13976 Ack=1738545 Win=65535 Len=0"
"706","3.110975294","23.56.225.242","192.168.129.132","TLSv1.3","18930","DATA[73]"
"707","3.110984055","192.168.129.132","23.56.225.242","TCP","54","47500  >  443 [ACK] Seq=13976 Ack=1757421 Win=65535 Len=0"
"708","3.111023004","23.56.225.242","192.168.129.132","TLSv1.3","20382","DATA[73]"
"709","3.111028574","192.168.129.132","23.56.225.242","TCP","54","47500  >  443 [ACK] Seq=13976 Ack=1777749 Win=65535 Len=0"
"710","3.111061892","23.56.225.242","192.168.129.132","TCP","405","443  >  47500 [PSH, ACK] Seq=1777749 Ack=13976 Win=64240 Len=351 [TCP PDU reassembled in 711]"
"711","3.111290050","23.56.225.242","192.168.129.132","TLSv1.3","19034","HEADERS[75]: 200 OK"
"712","3.111377586","23.56.225.242","192.168.129.132","TLSv1.3","8311","DATA[75]"
"713","3.111406074","192.168.129.132","23.56.225.242","TCP","54","47500  >  443 [ACK] Seq=13976 Ack=1805337 Win=65535 Len=0"
"714","3.111500066","23.56.225.242","192.168.129.132","TCP","8766","443  >  47500 [PSH, ACK] Seq=1805337 Ack=13976 Win=64240 Len=8712 [TCP PDU reassembled in 716]"
"715","3.111506392","192.168.129.132","23.56.225.242","TCP","54","47500  >  443 [ACK] Seq=13976 Ack=1814049 Win=65535 Len=0"
"716","3.112020246","23.56.225.242","192.168.129.132","TLSv1.3","20382","HEADERS[77]: 200 OK"
"717","3.112042316","192.168.129.132","23.56.225.242","TCP","54","47500  >  443 [ACK] Seq=13976 Ack=1834377 Win=65535 Len=0"
"718","3.112155576","23.56.225.242","192.168.129.132","TCP","8766","443  >  47500 [PSH, ACK] Seq=1834377 Ack=13976 Win=64240 Len=8712 [TCP PDU reassembled in 720]"
"719","3.112164682","192.168.129.132","23.56.225.242","TCP","54","47500  >  443 [ACK] Seq=13976 Ack=1843089 Win=65535 Len=0"
"720","3.112935148","23.56.225.242","192.168.129.132","TLSv1.3","2958","DATA[77]"
"721","3.112935349","23.56.225.242","192.168.129.132","TCP","5862","443  >  47500 [PSH, ACK] Seq=1845993 Ack=13976 Win=64240 Len=5808 [TCP PDU reassembled in 724]"
"722","3.113111709","23.56.225.242","192.168.129.132","TCP","8766","443  >  47500 [PSH, ACK] Seq=1851801 Ack=13976 Win=64240 Len=8712 [TCP PDU reassembled in 724]"
"723","3.113171034","192.168.129.132","23.56.225.242","TCP","54","47500  >  443 [ACK] Seq=13976 Ack=1860513 Win=65535 Len=0"
"724","3.113322260","23.56.225.242","192.168.129.132","TLSv1.3","14574","HEADERS[79]: 200 OK"
"725","3.114140013","192.168.129.132","23.56.225.242","TCP","54","47500  >  443 [ACK] Seq=13976 Ack=1875033 Win=65535 Len=0"
"726","3.114239140","23.56.225.242","192.168.129.132","TCP","7314","443  >  47500 [PSH, ACK] Seq=1875033 Ack=13976 Win=64240 Len=7260 [TCP PDU reassembled in 727]"
"727","3.114239368","23.56.225.242","192.168.129.132","TLSv1.3","8766","DATA[79]"
"728","3.114264420","192.168.129.132","23.56.225.242","TCP","54","47500  >  443 [ACK] Seq=13976 Ack=1882293 Win=65535 Len=0"
"729","3.114289625","192.168.129.132","23.56.225.242","TCP","54","47500  >  443 [ACK] Seq=13976 Ack=1891005 Win=65535 Len=0"
"730","3.114309147","23.56.225.242","192.168.129.132","TLSv1.3","14574","DATA[79]"
"731","3.114343658","23.56.225.242","192.168.129.132","HTTP2","5943","DATA[79] (JPEG JFIF image)"
"732","3.114343692","23.56.225.242","192.168.129.132","HTTP2","13392","HEADERS[63]: 200 OK"
"733","3.114745498","23.56.225.242","192.168.129.132","TLSv1.3","21834","DATA[63]"
"734","3.114806439","23.56.225.242","192.168.129.132","TCP","8766","443  >  47500 [PSH, ACK] Seq=1946532 Ack=13976 Win=64240 Len=8712 [TCP PDU reassembled in 736]"
"735","3.116601542","192.168.129.132","23.56.225.242","TCP","54","47500  >  443 [ACK] Seq=13976 Ack=1955244 Win=65535 Len=0"
"736","3.117218730","23.56.225.242","192.168.129.132","HTTP2","5045","DATA[63] (JPEG JFIF image)"
"737","3.117606444","192.168.129.132","23.56.225.242","TCP","54","47500  >  443 [ACK] Seq=13976 Ack=1960235 Win=65535 Len=0"
"738","3.138629548","23.56.225.242","192.168.129.132","HTTP2/JSON","1161","DATA[7], JSON (application/json)"
"739","3.138711705","192.168.129.132","23.56.225.242","TCP","54","47554  >  443 [ACK] Seq=2683 Ack=7886 Win=65535 Len=0"
"740","3.144527271","23.56.225.242","192.168.129.132","HTTP2","13452","HEADERS[85]: 200 OK"
"741","3.144578786","192.168.129.132","23.56.225.242","TCP","54","47500  >  443 [ACK] Seq=13976 Ack=1973633 Win=65535 Len=0"
"742","3.144865234","23.56.225.242","192.168.129.132","HTTP2","7663","DATA[85], HEADERS[87]: 200 OK"
"743","3.144914589","192.168.129.132","23.56.225.242","TCP","54","47500  >  443 [ACK] Seq=13976 Ack=1981242 Win=65535 Len=0"
"744","3.148477961","23.56.225.242","192.168.129.132","HTTP2","10218","HEADERS[89]: 200 OK"
"745","3.148478398","23.56.225.242","192.168.129.132","HTTP2","5701","DATA[89], DATA[91]"
"746","3.148527052","192.168.129.132","23.56.225.242","TCP","54","47500  >  443 [ACK] Seq=13976 Ack=1991406 Win=65535 Len=0"
"747","3.148583619","192.168.129.132","23.56.225.242","TCP","54","47500  >  443 [ACK] Seq=13976 Ack=1997053 Win=65535 Len=0"
"748","3.148874370","192.168.129.132","23.56.225.242","HTTP2","166","HEADERS[93]: GET /2023/11/19/haparlament_11_191123_vod_autoOrient_i.jpg, WINDOW_UPDATE[93]"
"749","3.149226380","23.56.225.242","192.168.129.132","TCP","60","443  >  47500 [ACK] Seq=1997053 Ack=14088 Win=64240 Len=0"
"750","3.195945764","23.56.225.242","192.168.129.132","HTTP2","11912","HEADERS[93]: 200 OK"
"751","3.196011623","192.168.129.132","23.56.225.242","TCP","54","47500  >  443 [ACK] Seq=14088 Ack=2008911 Win=65535 Len=0"
"752","3.196110433","23.56.225.242","192.168.129.132","TLSv1.3","4844","[TLS segment of a reassembled PDU]"
"753","3.196120407","192.168.129.132","23.56.225.242","TCP","54","47500  >  443 [ACK] Seq=14088 Ack=2013701 Win=65535 Len=0"
"754","3.198853504","23.56.225.242","192.168.129.132","HTTP2","16491","[TLS segment of a reassembled PDU]"
"755","3.198991073","192.168.129.132","23.56.225.242","TCP","54","47500  >  443 [ACK] Seq=14088 Ack=2030138 Win=65535 Len=0"
"756","3.216601660","23.56.225.242","192.168.129.132","HTTP2","1506","DATA[93]"
"757","3.219261309","23.56.225.242","192.168.129.132","TCP","7314","443  >  47500 [PSH, ACK] Seq=2031590 Ack=14088 Win=64240 Len=7260 [TCP PDU reassembled in 761]"
"758","3.219262098","23.56.225.242","192.168.129.132","TCP","4410","443  >  47500 [PSH, ACK] Seq=2038850 Ack=14088 Win=64240 Len=4356 [TCP PDU reassembled in 761]"
"759","3.219439318","192.168.129.132","23.56.225.242","TCP","54","47500  >  443 [ACK] Seq=14088 Ack=2038850 Win=65535 Len=0"
"760","3.219671893","192.168.129.132","23.56.225.242","TCP","54","47500  >  443 [ACK] Seq=14088 Ack=2043206 Win=65535 Len=0"
"761","3.219670617","23.56.225.242","192.168.129.132","TLSv1.3","11670","DATA[93]"
"762","3.219958707","192.168.129.132","23.56.225.242","TCP","54","47500  >  443 [ACK] Seq=14088 Ack=2054822 Win=65535 Len=0"
"763","3.220242383","23.56.225.242","192.168.129.132","TLSv1.3","20382","DATA[93]"
"764","3.220297450","192.168.129.132","23.56.225.242","TCP","54","47500  >  443 [ACK] Seq=14088 Ack=2075150 Win=65535 Len=0"
"765","3.220573486","23.56.225.242","192.168.129.132","TCP","2958","443  >  47500 [PSH, ACK] Seq=2075150 Ack=14088 Win=64240 Len=2904 [TCP PDU reassembled in 766]"
"766","3.220573929","23.56.225.242","192.168.129.132","TLSv1.3","11966","DATA[93] (JPEG JFIF image)"
"767","3.220724320","192.168.129.132","23.56.225.242","TCP","54","47500  >  443 [ACK] Seq=14088 Ack=2078054 Win=65535 Len=0"
"768","3.221083825","192.168.129.132","23.56.225.242","TCP","54","47500  >  443 [ACK] Seq=14088 Ack=2089966 Win=65535 Len=0"
"769","7.464372733","192.168.129.132","23.56.225.242","HTTP2","168","HEADERS[95]: GET /appConfig/responsiveConfig.json, WINDOW_UPDATE[95]"
"770","7.464888099","23.56.225.242","192.168.129.132","TCP","60","443  >  47500 [ACK] Seq=2089966 Ack=14202 Win=64240 Len=0"
