"No.","Time","Source","Destination","Protocol","Length","Info"
"1","0.000000000","192.168.129.132","142.250.75.174","TLSv1.2","3632","Application Data"
"2","0.000741296","142.250.75.174","192.168.129.132","TCP","60","443  >  34372 [ACK] Seq=1 Ack=1461 Win=64240 Len=0"
"3","0.000741499","142.250.75.174","192.168.129.132","TCP","60","443  >  34372 [ACK] Seq=1 Ack=2921 Win=64240 Len=0"
"4","0.001063445","142.250.75.174","192.168.129.132","TCP","60","443  >  34372 [ACK] Seq=1 Ack=3579 Win=64240 Len=0"
"5","0.078796064","142.250.75.174","192.168.129.132","TLSv1.2","194","Application Data, Application Data, Application Data"
"6","0.080171762","192.168.129.132","142.250.75.174","TLSv1.2","93","Application Data"
"7","0.080823750","142.250.75.174","192.168.129.132","TCP","60","443  >  34372 [ACK] Seq=141 Ack=3618 Win=64240 Len=0"
"8","0.206742689","192.168.129.132","142.250.75.174","TLSv1.2","3168","Application Data"
"9","0.206997303","192.168.129.132","142.250.75.174","TLSv1.2","3844","Application Data"
"10","0.207306097","142.250.75.174","192.168.129.132","TCP","60","443  >  34372 [ACK] Seq=141 Ack=5078 Win=64240 Len=0"
"11","0.207306401","142.250.75.174","192.168.129.132","TCP","60","443  >  34372 [ACK] Seq=141 Ack=6538 Win=64240 Len=0"
"12","0.207306441","142.250.75.174","192.168.129.132","TCP","60","443  >  34372 [ACK] Seq=141 Ack=6732 Win=64240 Len=0"
"13","0.207646952","142.250.75.174","192.168.129.132","TCP","60","443  >  34372 [ACK] Seq=141 Ack=8192 Win=64240 Len=0"
"14","0.207647275","142.250.75.174","192.168.129.132","TCP","60","443  >  34372 [ACK] Seq=141 Ack=9652 Win=64240 Len=0"
"15","0.207647370","142.250.75.174","192.168.129.132","TCP","60","443  >  34372 [ACK] Seq=141 Ack=10522 Win=64240 Len=0"
"16","0.317242296","142.250.75.174","192.168.129.132","TLSv1.2","1899","Application Data, Application Data"
"17","0.317680320","192.168.129.132","142.250.75.174","TCP","54","34372  >  443 [ACK] Seq=10522 Ack=1986 Win=65535 Len=0"
"18","0.319090169","142.250.75.174","192.168.129.132","TLSv1.2","124","Application Data, Application Data"
"19","0.320050740","192.168.129.132","142.250.75.174","TLSv1.2","93","Application Data"
"20","0.320723616","142.250.75.174","192.168.129.132","TCP","60","443  >  34372 [ACK] Seq=2056 Ack=10561 Win=64240 Len=0"
"21","0.323638522","192.168.129.132","142.250.75.174","TLSv1.2","89","Application Data"
"22","0.323995769","142.250.75.174","192.168.129.132","TCP","60","443  >  34372 [ACK] Seq=2056 Ack=10596 Win=64240 Len=0"
"23","0.410918512","192.168.129.132","142.250.75.98","TLSv1.2","126","Application Data"
"24","0.411642844","142.250.75.98","192.168.129.132","TCP","60","443  >  33106 [ACK] Seq=1 Ack=73 Win=64240 Len=0"
"25","0.474373659","142.250.75.98","192.168.129.132","TLSv1.2","451","Application Data, Application Data"
"26","0.477822630","142.250.75.98","192.168.129.132","TLSv1.2","124","Application Data, Application Data"
"27","0.478291201","192.168.129.132","142.250.75.98","TCP","54","33106  >  443 [ACK] Seq=73 Ack=468 Win=65535 Len=0"
"28","0.478865148","192.168.129.132","142.250.75.98","TLSv1.2","93","Application Data"
"29","0.479351944","142.250.75.98","192.168.129.132","TCP","60","443  >  33106 [ACK] Seq=468 Ack=112 Win=64240 Len=0"
"30","0.532921627","192.168.129.132","142.250.75.174","TLSv1.2","3219","Application Data"
"31","0.533296871","192.168.129.132","142.250.75.174","TLSv1.2","6335","Application Data"
"32","0.533724486","142.250.75.174","192.168.129.132","TCP","60","443  >  34372 [ACK] Seq=2056 Ack=12056 Win=64240 Len=0"
"33","0.533724798","142.250.75.174","192.168.129.132","TCP","60","443  >  34372 [ACK] Seq=2056 Ack=13516 Win=64240 Len=0"
"34","0.533724843","142.250.75.174","192.168.129.132","TCP","60","443  >  34372 [ACK] Seq=2056 Ack=13761 Win=64240 Len=0"
"35","0.535566783","142.250.75.174","192.168.129.132","TCP","60","443  >  34372 [ACK] Seq=2056 Ack=15221 Win=64240 Len=0"
"36","0.535567271","142.250.75.174","192.168.129.132","TCP","60","443  >  34372 [ACK] Seq=2056 Ack=16681 Win=64240 Len=0"
"37","0.535567305","142.250.75.174","192.168.129.132","TCP","60","443  >  34372 [ACK] Seq=2056 Ack=18141 Win=64240 Len=0"
"38","0.535567339","142.250.75.174","192.168.129.132","TCP","60","443  >  34372 [ACK] Seq=2056 Ack=19601 Win=64240 Len=0"
"39","0.535567372","142.250.75.174","192.168.129.132","TCP","60","443  >  34372 [ACK] Seq=2056 Ack=20042 Win=64240 Len=0"
"40","0.595539536","192.168.129.132","142.250.75.174","TLSv1.2","3219","Application Data"
"41","0.595997438","192.168.129.132","142.250.75.174","TLSv1.2","1402","Application Data"
"42","0.596191472","142.250.75.174","192.168.129.132","TCP","60","443  >  34372 [ACK] Seq=2056 Ack=21502 Win=64240 Len=0"
"43","0.596191691","142.250.75.174","192.168.129.132","TCP","60","443  >  34372 [ACK] Seq=2056 Ack=22962 Win=64240 Len=0"
"44","0.596191728","142.250.75.174","192.168.129.132","TCP","60","443  >  34372 [ACK] Seq=2056 Ack=23207 Win=64240 Len=0"
"45","0.596191762","142.250.75.174","192.168.129.132","TCP","60","443  >  34372 [ACK] Seq=2056 Ack=24555 Win=64240 Len=0"
"46","0.617759836","142.250.75.174","192.168.129.132","TLSv1.2","714","Application Data, Application Data, Application Data, Application Data"
"47","0.619055822","192.168.129.132","142.250.75.174","TLSv1.2","93","Application Data"
"48","0.619683313","142.250.75.174","192.168.129.132","TCP","60","443  >  34372 [ACK] Seq=2716 Ack=24594 Win=64240 Len=0"
"49","0.672561332","142.250.75.174","192.168.129.132","TLSv1.2","714","Application Data, Application Data, Application Data, Application Data"
"50","0.673231091","192.168.129.132","142.250.75.174","TLSv1.2","93","Application Data"
"51","0.673623645","142.250.75.174","192.168.129.132","TCP","60","443  >  34372 [ACK] Seq=3376 Ack=24633 Win=64240 Len=0"
"52","0.817136990","192.168.129.132","142.250.75.99","TLSv1.2","157","Application Data"
"53","0.817539769","142.250.75.99","192.168.129.132","TCP","60","443  >  56278 [ACK] Seq=1 Ack=104 Win=64240 Len=0"
"54","0.817958632","192.168.129.132","142.250.75.99","TLSv1.2","93","Application Data"
"55","0.819037680","142.250.75.99","192.168.129.132","TCP","60","443  >  56278 [ACK] Seq=1 Ack=143 Win=64240 Len=0"
"56","0.825029968","142.250.75.99","192.168.129.132","TLSv1.2","424","Application Data, Application Data, Application Data"
"57","0.825101801","192.168.129.132","142.250.75.99","TCP","54","56278  >  443 [ACK] Seq=143 Ack=371 Win=65535 Len=0"
"58","0.826877114","192.168.129.132","142.250.75.99","TLSv1.2","93","Application Data"
"59","0.827351736","142.250.75.99","192.168.129.132","TLSv1.2","93","Application Data"
"60","0.827352110","142.250.75.99","192.168.129.132","TCP","60","443  >  56278 [ACK] Seq=410 Ack=182 Win=64240 Len=0"
"61","0.832666289","192.168.129.132","142.250.75.99","TLSv1.2","89","Application Data"
"62","0.833232198","142.250.75.99","192.168.129.132","TCP","60","443  >  56278 [ACK] Seq=410 Ack=217 Win=64240 Len=0"
"63","1.552840378","192.168.129.132","212.143.195.14","TLSv1.2","2286","Application Data"
"64","1.553258001","192.168.129.132","212.143.195.14","TLSv1.2","2090","Application Data"
"65","1.553624550","212.143.195.14","192.168.129.132","TCP","60","443  >  54820 [ACK] Seq=1 Ack=1461 Win=64240 Len=0"
"66","1.553624991","212.143.195.14","192.168.129.132","TCP","60","443  >  54820 [ACK] Seq=1 Ack=2233 Win=64240 Len=0"
"67","1.553625055","212.143.195.14","192.168.129.132","TCP","60","443  >  54820 [ACK] Seq=1 Ack=3693 Win=64240 Len=0"
"68","1.553625115","212.143.195.14","192.168.129.132","TCP","60","443  >  54820 [ACK] Seq=1 Ack=4269 Win=64240 Len=0"
"69","1.568749513","212.143.195.14","192.168.129.132","TLSv1.2","1246","Application Data, Application Data, Application Data, Application Data, Application Data, Application Data, Application Data, Application Data, Application Data"
"70","1.570303106","212.143.195.14","192.168.129.132","TLSv1.2","37047","Application Data, Application Data, Application Data, Application Data, Application Data, Application Data, Application Data, Application Data, Application Data, Application Data, Application Data, Application Data, Application Data, Application Data"
"71","1.572917932","192.168.129.132","212.143.195.14","TCP","54","54820  >  443 [ACK] Seq=4269 Ack=38186 Win=65535 Len=0"
"72","1.574514997","212.143.195.14","192.168.129.132","TLSv1.2","35600","Application Data, Application Data, Application Data, Application Data"
"73","1.574634863","192.168.129.132","212.143.195.14","TCP","54","54820  >  443 [ACK] Seq=4269 Ack=73732 Win=65535 Len=0"
"74","1.575082884","212.143.195.14","192.168.129.132","TLSv1.2","7114","Application Data, Application Data, Application Data, Application Data, Application Data, Application Data, Application Data, Application Data"
"75","1.575083212","212.143.195.14","192.168.129.132","TLSv1.2","21687","Application Data"
"76","1.575158922","192.168.129.132","212.143.195.14","TCP","54","54820  >  443 [ACK] Seq=4269 Ack=102425 Win=65535 Len=0"
"77","1.575494081","212.143.195.14","192.168.129.132","TLSv1.2","8073","Application Data"
"78","1.575630277","192.168.129.132","212.143.195.14","TCP","54","54820  >  443 [ACK] Seq=4269 Ack=110444 Win=65535 Len=0"
"79","1.580622194","212.143.195.14","192.168.129.132","TLSv1.2","39590","Application Data, Application Data"
"80","1.580939838","212.143.195.14","192.168.129.132","TCP","4290","443  >  54820 [PSH, ACK] Seq=149980 Ack=4269 Win=64240 Len=4236 [TCP PDU reassembled in 81]"
"81","1.580940322","212.143.195.14","192.168.129.132","TLSv1.2","20521","Application Data, Application Data"
"82","1.581035452","192.168.129.132","212.143.195.14","TCP","54","54820  >  443 [ACK] Seq=4269 Ack=174683 Win=65535 Len=0"
"83","1.582269244","212.143.195.14","192.168.129.132","TLSv1.2","64293","Application Data, Application Data, Application Data, Application Data"
"84","1.582387418","192.168.129.132","212.143.195.14","TCP","54","54820  >  443 [ACK] Seq=4269 Ack=238922 Win=65535 Len=0"
"85","1.583230739","212.143.195.14","192.168.129.132","TCP","9952","443  >  54820 [PSH, ACK] Seq=238922 Ack=4269 Win=64240 Len=9898 [TCP PDU reassembled in 87]"
"86","1.583362995","192.168.129.132","212.143.195.14","TCP","54","54820  >  443 [ACK] Seq=4269 Ack=248820 Win=65535 Len=0"
"87","1.589048980","212.143.195.14","192.168.129.132","TLSv1.2","28294","Application Data, Application Data, Application Data, Application Data, Application Data, Application Data, Application Data, Application Data, Application Data, Application Data, Application Data"
"88","1.589158874","212.143.195.14","192.168.129.132","TLSv1.2","11350","Application Data"
"89","1.589472880","212.143.195.14","192.168.129.132","TLSv1.2","18410","Application Data"
"90","1.589603267","212.143.195.14","192.168.129.132","TLSv1.2","6401","Application Data"
"91","1.589626229","192.168.129.132","212.143.195.14","TCP","54","54820  >  443 [ACK] Seq=4269 Ack=306712 Win=65535 Len=0"
"92","1.589889261","192.168.129.132","212.143.195.14","TCP","54","54820  >  443 [ACK] Seq=4269 Ack=313059 Win=65535 Len=0"
"93","1.590656158","212.143.195.14","192.168.129.132","TLSv1.2","57946","Application Data, Application Data, Application Data"
"94","1.590792704","212.143.195.14","192.168.129.132","TCP","6401","443  >  54820 [PSH, ACK] Seq=370951 Ack=4269 Win=64240 Len=6347 [TCP PDU reassembled in 97]"
"95","1.590820986","192.168.129.132","212.143.195.14","TCP","54","54820  >  443 [ACK] Seq=4269 Ack=370951 Win=65535 Len=0"
"96","1.591109507","192.168.129.132","212.143.195.14","TCP","54","54820  >  443 [ACK] Seq=4269 Ack=377298 Win=65535 Len=0"
"97","1.591577915","212.143.195.14","192.168.129.132","TLSv1.2","19972","Application Data, Application Data, Application Data, Application Data, Application Data, Application Data, Application Data, Application Data"
"98","1.591892484","192.168.129.132","212.143.195.14","TCP","54","54820  >  443 [ACK] Seq=4269 Ack=397216 Win=65535 Len=0"
"99","1.838127124","192.168.129.132","212.143.195.14","TLSv1.2","2286","Application Data"
"100","1.838719291","212.143.195.14","192.168.129.132","TCP","60","443  >  54820 [ACK] Seq=397216 Ack=5729 Win=64240 Len=0"
"101","1.838719606","212.143.195.14","192.168.129.132","TCP","60","443  >  54820 [ACK] Seq=397216 Ack=6501 Win=64240 Len=0"
"102","1.838772679","192.168.129.132","212.143.195.14","TLSv1.2","2090","Application Data"
"103","1.839230100","212.143.195.14","192.168.129.132","TCP","60","443  >  54820 [ACK] Seq=397216 Ack=7961 Win=64240 Len=0"
"104","1.839230183","212.143.195.14","192.168.129.132","TCP","60","443  >  54820 [ACK] Seq=397216 Ack=8537 Win=64240 Len=0"
"105","1.853022359","212.143.195.14","192.168.129.132","TLSv1.2","1557","Application Data, Application Data, Application Data, Application Data, Application Data, Application Data, Application Data, Application Data, Application Data, Application Data, Application Data, Application Data, Application Data, Application Data, Application Data, Application Data, Application Data"
"106","1.853341562","192.168.129.132","212.143.195.14","TCP","54","54820  >  443 [ACK] Seq=8537 Ack=398719 Win=65535 Len=0"
"107","2.152290221","192.168.129.132","142.250.75.86","TLSv1.2","220","Application Data"
"108","2.153202848","192.168.129.132","142.250.75.86","TLSv1.2","220","Application Data"
"109","2.153327147","142.250.75.86","192.168.129.132","TCP","60","443  >  40844 [ACK] Seq=1 Ack=167 Win=64240 Len=0"
"110","2.153486942","192.168.129.132","142.250.75.86","TLSv1.2","386","Application Data, Application Data"
"111","2.153525859","142.250.75.86","192.168.129.132","TCP","60","443  >  40844 [ACK] Seq=1 Ack=333 Win=64240 Len=0"
"112","2.153721316","142.250.75.86","192.168.129.132","TCP","60","443  >  40844 [ACK] Seq=1 Ack=665 Win=64240 Len=0"
"113","2.153731474","192.168.129.132","142.250.75.86","TLSv1.2","220","Application Data"
"114","2.153911894","142.250.75.86","192.168.129.132","TCP","60","443  >  40844 [ACK] Seq=1 Ack=831 Win=64240 Len=0"
"115","2.154008955","192.168.129.132","142.250.75.86","TLSv1.2","220","Application Data"
"116","2.154326760","142.250.75.86","192.168.129.132","TCP","60","443  >  40844 [ACK] Seq=1 Ack=997 Win=64240 Len=0"
"117","2.154352227","192.168.129.132","142.250.75.86","TLSv1.2","220","Application Data"
"118","2.154686245","142.250.75.86","192.168.129.132","TCP","60","443  >  40844 [ACK] Seq=1 Ack=1163 Win=64240 Len=0"
"119","2.161427458","142.250.75.86","192.168.129.132","TLSv1.2","21349","Application Data, Application Data, Application Data, Application Data, Application Data, Application Data, Application Data, Application Data, Application Data, Application Data, Application Data, Application Data, Application Data, Application Data, Application Data, Application Data"
"120","2.161668268","192.168.129.132","142.250.75.86","TCP","54","40844  >  443 [ACK] Seq=1163 Ack=21296 Win=65535 Len=0"
"121","2.163766190","142.250.75.86","192.168.129.132","TLSv1.2","24976","Application Data, Application Data, Application Data, Application Data, Application Data, Application Data, Application Data, Application Data, Application Data, Application Data, Application Data, Application Data, Application Data, Application Data, Application Data, Application Data, Application Data, Application Data, Application Data, Application Data"
"122","2.165849768","142.250.75.86","192.168.129.132","TLSv1.2","5817","Application Data, Application Data, Application Data, Application Data, Application Data"
"123","2.166041954","192.168.129.132","142.250.75.86","TCP","54","40844  >  443 [ACK] Seq=1163 Ack=51981 Win=65535 Len=0"
"124","2.168188246","142.250.75.86","192.168.129.132","TLSv1.2","37604","Application Data, Application Data, Application Data, Application Data, Application Data, Application Data, Application Data, Application Data, Application Data, Application Data, Application Data, Application Data, Application Data, Application Data, Application Data, Application Data, Application Data, Application Data, Application Data, Application Data, Application Data, Application Data, Application Data, Application Data, Application Data, Application Data, Application Data"
"125","2.171247367","142.250.75.86","192.168.129.132","TLSv1.2","17113","Application Data, Application Data, Application Data, Application Data, Application Data, Application Data, Application Data, Application Data, Application Data, Application Data, Application Data, Application Data, Application Data"
"126","2.171332267","142.250.75.86","192.168.129.132","TLSv1.2","9684","Application Data, Application Data, Application Data, Application Data, Application Data, Application Data, Application Data, Application Data"
"127","2.171462768","192.168.129.132","142.250.75.86","TLSv1.2","93","Application Data"
"128","2.171832905","142.250.75.86","192.168.129.132","TCP","60","443  >  40844 [ACK] Seq=116220 Ack=1202 Win=64240 Len=0"
"129","2.172180940","142.250.75.86","192.168.129.132","TLSv1.2","50220","Application Data, Application Data, Application Data, Application Data, Application Data, Application Data, Application Data, Application Data, Application Data, Application Data, Application Data, Application Data, Application Data, Application Data, Application Data, Application Data, Application Data, Application Data, Application Data, Application Data, Application Data, Application Data, Application Data, Application Data, Application Data, Application Data, Application Data, Application Data, Application Data, Application Data, Application Data, Application Data, Application Data, Application Data, Application Data, Application Data, Application Data"
"130","2.173136711","192.168.129.132","142.250.75.86","TCP","54","40844  >  443 [ACK] Seq=1202 Ack=166386 Win=65535 Len=0"
"131","2.178041959","142.250.75.86","192.168.129.132","TLSv1.2","25470","Application Data, Application Data, Application Data, Application Data, Application Data, Application Data, Application Data, Application Data, Application Data, Application Data, Application Data, Application Data, Application Data, Application Data, Application Data, Application Data, Application Data, Application Data, Application Data"
"132","2.178098251","192.168.129.132","142.250.75.86","TCP","54","40844  >  443 [ACK] Seq=1202 Ack=191802 Win=65535 Len=0"
"133","2.178262550","142.250.75.86","192.168.129.132","TLSv1.2","19822","Application Data, Application Data, Application Data, Application Data, Application Data, Application Data, Application Data, Application Data, Application Data, Application Data, Application Data, Application Data, Application Data, Application Data"
"134","2.178438624","142.250.75.86","192.168.129.132","TLSv1.2","19109","Application Data, Application Data, Application Data, Application Data, Application Data, Application Data, Application Data, Application Data, Application Data, Application Data, Application Data, Application Data, Application Data, Application Data, Application Data"
"135","2.178548320","142.250.75.86","192.168.129.132","TLSv1.2","25470","Application Data, Application Data, Application Data, Application Data, Application Data, Application Data, Application Data, Application Data, Application Data, Application Data, Application Data, Application Data, Application Data, Application Data, Application Data, Application Data, Application Data, Application Data, Application Data, Application Data"
"136","2.178560049","192.168.129.132","142.250.75.86","TCP","54","40844  >  443 [ACK] Seq=1202 Ack=230625 Win=65535 Len=0"
"137","2.179080731","142.250.75.86","192.168.129.132","TLSv1.2","22870","Application Data, Application Data, Application Data, Application Data, Application Data, Application Data, Application Data, Application Data, Application Data, Application Data, Application Data, Application Data, Application Data, Application Data, Application Data, Application Data, Application Data, Application Data"
"138","2.181301837","192.168.129.132","142.250.75.86","TCP","54","40844  >  443 [ACK] Seq=1202 Ack=278857 Win=65535 Len=0"
"139","2.369502346","192.168.129.132","212.143.195.14","TLSv1.2","2286","Application Data"
"140","2.369892073","192.168.129.132","212.143.195.14","TLSv1.2","2092","Application Data"
"141","2.370143072","212.143.195.14","192.168.129.132","TCP","60","443  >  54820 [ACK] Seq=398719 Ack=9997 Win=64240 Len=0"
"142","2.370143403","212.143.195.14","192.168.129.132","TCP","60","443  >  54820 [ACK] Seq=398719 Ack=10769 Win=64240 Len=0"
"143","2.370143453","212.143.195.14","192.168.129.132","TCP","60","443  >  54820 [ACK] Seq=398719 Ack=12229 Win=64240 Len=0"
"144","2.370143499","212.143.195.14","192.168.129.132","TCP","60","443  >  54820 [ACK] Seq=398719 Ack=12807 Win=64240 Len=0"
"145","2.384924999","212.143.195.14","192.168.129.132","TLSv1.2","1525","Application Data, Application Data, Application Data, Application Data, Application Data, Application Data, Application Data, Application Data, Application Data, Application Data, Application Data, Application Data, Application Data, Application Data, Application Data, Application Data"
"146","2.385138493","192.168.129.132","212.143.195.14","TCP","54","54820  >  443 [ACK] Seq=12807 Ack=400190 Win=65535 Len=0"
"147","2.386991995","212.143.195.14","192.168.129.132","TLSv1.2","31118","Application Data, Application Data, Application Data, Application Data, Application Data, Application Data"
"148","2.387112089","212.143.195.14","192.168.129.132","TLSv1.2","5702","Application Data, Application Data, Application Data, Application Data"
"149","2.389400852","192.168.129.132","212.143.195.14","TCP","54","54820  >  443 [ACK] Seq=12807 Ack=436902 Win=65535 Len=0"
"150","2.390224311","212.143.195.14","192.168.129.132","TLSv1.2","22646","Application Data"
"151","2.390365536","212.143.195.14","192.168.129.132","TLSv1.2","22246","Application Data, Application Data, Application Data, Application Data"
"152","2.390521748","212.143.195.14","192.168.129.132","TLSv1.2","19509","Application Data, Application Data, Application Data, Application Data, Application Data, Application Data, Application Data, Application Data"
"153","2.391278108","192.168.129.132","212.143.195.14","TCP","54","54820  >  443 [ACK] Seq=12807 Ack=501141 Win=65535 Len=0"
"154","2.391708459","212.143.195.14","192.168.129.132","TCP","1779","443  >  54820 [PSH, ACK] Seq=501141 Ack=12807 Win=64240 Len=1725 [TCP PDU reassembled in 156]"
"155","2.392365069","192.168.129.132","212.143.195.14","TCP","54","54820  >  443 [ACK] Seq=12807 Ack=502866 Win=65535 Len=0"
"156","2.396958590","212.143.195.14","192.168.129.132","TLSv1.2","42414","Application Data, Application Data, Application Data, Application Data, Application Data"
"157","2.397031281","192.168.129.132","212.143.195.14","TCP","54","54820  >  443 [ACK] Seq=12807 Ack=545226 Win=65535 Len=0"
"158","2.397245797","212.143.195.14","192.168.129.132","TLSv1.2","19822","Application Data, Application Data, Application Data"
"159","2.397330995","212.143.195.14","192.168.129.132","TLSv1.2","2165","Application Data, Application Data"
"160","2.397772230","212.143.195.14","192.168.129.132","TLSv1.2","42414","Application Data, Application Data, Application Data, Application Data, Application Data"
"161","2.398059565","192.168.129.132","212.143.195.14","TCP","54","54820  >  443 [ACK] Seq=12807 Ack=609465 Win=65535 Len=0"
"162","2.398751503","212.143.195.14","192.168.129.132","TLSv1.2","31831","Application Data, Application Data, Application Data, Application Data, Application Data"
"163","2.399794513","192.168.129.132","212.143.195.14","TCP","54","54820  >  443 [ACK] Seq=12807 Ack=641242 Win=65535 Len=0"
"164","2.403517493","212.143.195.14","192.168.129.132","TLSv1.2","24058","Application Data, Application Data, Application Data, Application Data, Application Data"
"165","2.403665196","192.168.129.132","212.143.195.14","TCP","54","54820  >  443 [ACK] Seq=12807 Ack=665246 Win=65535 Len=0"
"166","2.403767835","212.143.195.14","192.168.129.132","TLSv1.2","19822","Application Data"
"167","2.403828554","212.143.195.14","192.168.129.132","TLSv1.2","14174","Application Data, Application Data, Application Data, Application Data"
"168","2.403845704","192.168.129.132","212.143.195.14","TCP","54","54820  >  443 [ACK] Seq=12807 Ack=685014 Win=65535 Len=0"
"169","2.403875649","212.143.195.14","192.168.129.132","TCP","6401","443  >  54820 [PSH, ACK] Seq=699134 Ack=12807 Win=64240 Len=6347 [TCP PDU reassembled in 171]"
"170","2.403984808","192.168.129.132","212.143.195.14","TCP","54","54820  >  443 [ACK] Seq=12807 Ack=705481 Win=65535 Len=0"
"171","2.404140444","212.143.195.14","192.168.129.132","TLSv1.2","24058","Application Data, Application Data, Application Data, Application Data"
"172","2.404517855","212.143.195.14","192.168.129.132","TLSv1.2","40289","Application Data, Application Data, Application Data, Application Data, Application Data, Application Data, Application Data, Application Data, Application Data, Application Data, Application Data, Application Data"
"173","2.404686481","192.168.129.132","212.143.195.14","TCP","54","54820  >  443 [ACK] Seq=12807 Ack=769720 Win=65535 Len=0"
"174","2.405447400","212.143.195.14","192.168.129.132","TLSv1.2","42758","Application Data, Application Data, Application Data, Application Data, Application Data, Application Data"
"175","2.405482308","192.168.129.132","212.143.195.14","TCP","54","54820  >  443 [ACK] Seq=12807 Ack=812424 Win=65535 Len=0"
"176","2.411006666","212.143.195.14","192.168.129.132","TLSv1.2","39590","Application Data, Application Data, Application Data, Application Data, Application Data"
"177","2.411160960","192.168.129.132","212.143.195.14","TCP","54","54820  >  443 [ACK] Seq=12807 Ack=851960 Win=65535 Len=0"
"178","2.411454505","212.143.195.14","192.168.129.132","TLSv1.2","8526","Application Data, Application Data, Application Data, Application Data, Application Data, Application Data, Application Data"
"179","2.411454796","212.143.195.14","192.168.129.132","TCP","15586","443  >  54820 [PSH, ACK] Seq=860432 Ack=12807 Win=64240 Len=15532 [TCP PDU reassembled in 182]"
"180","2.411529427","192.168.129.132","212.143.195.14","TCP","54","54820  >  443 [ACK] Seq=12807 Ack=860432 Win=65535 Len=0"
"181","2.411677923","192.168.129.132","212.143.195.14","TCP","54","54820  >  443 [ACK] Seq=12807 Ack=875964 Win=65535 Len=0"
"182","2.411788369","212.143.195.14","192.168.129.132","TLSv1.2","753","Application Data"
"183","2.412083962","212.143.195.14","192.168.129.132","TLSv1.2","39590","Application Data, Application Data, Application Data, Application Data, Application Data"
"184","2.412233841","192.168.129.132","212.143.195.14","TCP","54","54820  >  443 [ACK] Seq=12807 Ack=916199 Win=65535 Len=0"
"185","2.412320436","212.143.195.14","192.168.129.132","TCP","8526","443  >  54820 [PSH, ACK] Seq=916199 Ack=12807 Win=64240 Len=8472 [TCP PDU reassembled in 186]"
"186","2.412320615","212.143.195.14","192.168.129.132","TLSv1.2","15586","Application Data, Application Data, Application Data, Application Data"
"187","2.412369586","192.168.129.132","212.143.195.14","TCP","54","54820  >  443 [ACK] Seq=12807 Ack=940203 Win=65535 Len=0"
"188","2.413480436","212.143.195.14","192.168.129.132","TLSv1.2","20535","Application Data, Application Data, Application Data, Application Data, Application Data, Application Data, Application Data, Application Data"
"189","2.413621582","192.168.129.132","212.143.195.14","TCP","54","54820  >  443 [ACK] Seq=12807 Ack=960684 Win=65535 Len=0"
"190","2.414289527","212.143.195.14","192.168.129.132","TLSv1.2","24058","Application Data"
"191","2.414351804","212.143.195.14","192.168.129.132","TLSv1.2","16998","Application Data, Application Data, Application Data, Application Data"
"192","2.414507465","212.143.195.14","192.168.129.132","TLSv1.2","19822","Application Data"
"193","2.414536117","192.168.129.132","212.143.195.14","TCP","54","54820  >  443 [ACK] Seq=12807 Ack=1001632 Win=65535 Len=0"
"194","2.414694433","212.143.195.14","192.168.129.132","TLSv1.2","3577","Application Data, Application Data, Application Data, Application Data"
"195","2.414864032","192.168.129.132","212.143.195.14","TCP","54","54820  >  443 [ACK] Seq=12807 Ack=1024923 Win=65535 Len=0"
"196","2.415129086","212.143.195.14","192.168.129.132","TCP","767","443  >  54820 [PSH, ACK] Seq=1024923 Ack=12807 Win=64240 Len=713 [TCP PDU reassembled in 197]"
"197","2.417731148","212.143.195.14","192.168.129.132","TLSv1.2","35354","Application Data, Application Data, Application Data, Application Data, Application Data"
"198","2.417895372","192.168.129.132","212.143.195.14","TCP","54","54820  >  443 [ACK] Seq=12807 Ack=1060936 Win=65535 Len=0"
"199","2.418169936","212.143.195.14","192.168.129.132","TCP","9938","443  >  54820 [PSH, ACK] Seq=1060936 Ack=12807 Win=64240 Len=9884 [TCP PDU reassembled in 201]"
"200","2.418728490","192.168.129.132","212.143.195.14","TCP","54","54820  >  443 [ACK] Seq=12807 Ack=1070820 Win=65535 Len=0"
"201","2.423822204","212.143.195.14","192.168.129.132","TLSv1.2","14174","Application Data"
"202","2.423865103","192.168.129.132","212.143.195.14","TCP","54","54820  >  443 [ACK] Seq=12807 Ack=1084940 Win=65535 Len=0"
"203","2.423982509","212.143.195.14","192.168.129.132","TLSv1.2","7114","Application Data, Application Data, Application Data, Application Data"
"204","2.423982821","212.143.195.14","192.168.129.132","TCP","9938","443  >  54820 [PSH, ACK] Seq=1092000 Ack=12807 Win=64240 Len=9884 [TCP PDU reassembled in 205]"
"205","2.424066650","212.143.195.14","192.168.129.132","TLSv1.2","9938","Application Data"
"206","2.424094980","192.168.129.132","212.143.195.14","TCP","54","54820  >  443 [ACK] Seq=12807 Ack=1111768 Win=65535 Len=0"
"207","2.424609049","212.143.195.14","192.168.129.132","TCP","8526","443  >  54820 [PSH, ACK] Seq=1111768 Ack=12807 Win=64240 Len=8472 [TCP PDU reassembled in 208]"
"208","2.424609261","212.143.195.14","192.168.129.132","TLSv1.2","21234","Application Data, Application Data, Application Data, Application Data, Application Data, Application Data, Application Data, Application Data, Application Data, Application Data, Application Data, Application Data, Application Data, Application Data"
"209","2.424720266","212.143.195.14","192.168.129.132","TCP","7813","443  >  54820 [PSH, ACK] Seq=1141420 Ack=12807 Win=64240 Len=7759 [TCP PDU reassembled in 210]"
"210","2.424720401","212.143.195.14","192.168.129.132","TLSv1.2","11908","Application Data"
"211","2.424738505","212.143.195.14","192.168.129.132","TLSv1.2","12762","Application Data, Application Data, Application Data, Application Data"
"212","2.425144854","192.168.129.132","212.143.195.14","TCP","54","54820  >  443 [ACK] Seq=12807 Ack=1173741 Win=65535 Len=0"
"213","2.428568027","192.168.129.132","142.250.75.86","TLSv1.2","221","Application Data"
"214","2.429172035","142.250.75.86","192.168.129.132","TCP","60","443  >  40844 [ACK] Seq=278857 Ack=1369 Win=64240 Len=0"
"215","2.429642114","212.143.195.14","192.168.129.132","TLSv1.2","35354","Application Data, Application Data, Application Data, Application Data, Application Data"
"216","2.429765161","192.168.129.132","212.143.195.14","TCP","54","54820  >  443 [ACK] Seq=12807 Ack=1209041 Win=65535 Len=0"
"217","2.429976451","212.143.195.14","192.168.129.132","TCP","8526","443  >  54820 [PSH, ACK] Seq=1209041 Ack=12807 Win=64240 Len=8472 [TCP PDU reassembled in 218]"
"218","2.429976728","212.143.195.14","192.168.129.132","TLSv1.2","20521","Application Data, Application Data, Application Data, Application Data, Application Data"
"219","2.430030663","192.168.129.132","212.143.195.14","TCP","54","54820  >  443 [ACK] Seq=12807 Ack=1217513 Win=65535 Len=0"
"220","2.430231266","212.143.195.14","192.168.129.132","TLSv1.2","35354","Application Data, Application Data, Application Data, Application Data, Application Data"
"221","2.430374923","192.168.129.132","212.143.195.14","TCP","54","54820  >  443 [ACK] Seq=12807 Ack=1273280 Win=65535 Len=0"
"222","2.430548533","212.143.195.14","192.168.129.132","TCP","8526","443  >  54820 [PSH, ACK] Seq=1273280 Ack=12807 Win=64240 Len=8472 [TCP PDU reassembled in 224]"
"223","2.430765836","192.168.129.132","212.143.195.14","TCP","54","54820  >  443 [ACK] Seq=12807 Ack=1281752 Win=65535 Len=0"
"224","2.430899759","212.143.195.14","192.168.129.132","TLSv1.2","36067","Application Data, Application Data, Application Data, Application Data, Application Data"
"225","2.431587705","192.168.129.132","212.143.195.14","TCP","54","54820  >  443 [ACK] Seq=12807 Ack=1317765 Win=65535 Len=0"
"226","2.435833807","212.143.195.14","192.168.129.132","TLSv1.2","32530","Application Data, Application Data, Application Data, Application Data, Application Data"
"227","2.435968752","192.168.129.132","212.143.195.14","TCP","54","54820  >  443 [ACK] Seq=12807 Ack=1350241 Win=65535 Len=0"
"228","2.436146715","212.143.195.14","192.168.129.132","TLSv1.2","15586","Application Data"
"229","2.436185835","212.143.195.14","192.168.129.132","TLSv1.2","9938","Application Data, Application Data, Application Data, Application Data"
"230","2.436205753","192.168.129.132","212.143.195.14","TCP","54","54820  >  443 [ACK] Seq=12807 Ack=1365773 Win=65535 Len=0"
"231","2.436185901","212.143.195.14","192.168.129.132","TCP","6401","443  >  54820 [PSH, ACK] Seq=1375657 Ack=12807 Win=64240 Len=6347 [TCP PDU reassembled in 232]"
"232","2.436575184","212.143.195.14","192.168.129.132","TLSv1.2","17574","Application Data, Application Data, Application Data, Application Data, Application Data, Application Data, Application Data, Application Data"
"233","2.436610394","192.168.129.132","212.143.195.14","TCP","54","54820  >  443 [ACK] Seq=12807 Ack=1399524 Win=65535 Len=0"
"234","2.436802948","212.143.195.14","192.168.129.132","TLSv1.2","15010","Application Data"
"235","2.436882392","212.143.195.14","192.168.129.132","TLSv1.2","15586","Application Data, Application Data, Application Data, Application Data"
"236","2.436967936","192.168.129.132","212.143.195.14","TCP","54","54820  >  443 [ACK] Seq=12807 Ack=1430012 Win=65535 Len=0"
"237","2.437115207","212.143.195.14","192.168.129.132","TLSv1.2","33805","Application Data, Application Data, Application Data, Application Data, Application Data, Application Data, Application Data, Application Data, Application Data, Application Data, Application Data"
"238","2.437133564","192.168.129.132","212.143.195.14","TCP","54","54820  >  443 [ACK] Seq=12807 Ack=1463763 Win=65535 Len=0"
"239","2.437448611","212.143.195.14","192.168.129.132","TCP","1547","443  >  54820 [PSH, ACK] Seq=1463763 Ack=12807 Win=64240 Len=1493 [TCP PDU reassembled in 241]"
"240","2.437505448","192.168.129.132","212.143.195.14","TCP","54","54820  >  443 [ACK] Seq=12807 Ack=1465256 Win=65535 Len=0"
"241","2.439646391","212.143.195.14","192.168.129.132","TLSv1.2","14174","Application Data, Application Data, Application Data, Application Data, Application Data, Application Data, Application Data"
"242","2.439759837","212.143.195.14","192.168.129.132","TCP","4290","443  >  54820 [PSH, ACK] Seq=1479376 Ack=12807 Win=64240 Len=4236 [TCP PDU reassembled in 244]"
"243","2.439759975","212.143.195.14","192.168.129.132","TCP","11350","443  >  54820 [PSH, ACK] Seq=1483612 Ack=12807 Win=64240 Len=11296 [TCP PDU reassembled in 244]"
"244","2.439812156","212.143.195.14","192.168.129.132","TLSv1.2","4290","Application Data"
"245","2.439812275","212.143.195.14","192.168.129.132","TCP","4290","443  >  54820 [PSH, ACK] Seq=1499144 Ack=12807 Win=64240 Len=4236 [TCP PDU reassembled in 250]"
"246","2.439824997","192.168.129.132","212.143.195.14","TCP","54","54820  >  443 [ACK] Seq=12807 Ack=1494908 Win=65535 Len=0"
"247","2.439986540","192.168.129.132","212.143.195.14","TCP","54","54820  >  443 [ACK] Seq=12807 Ack=1503380 Win=65535 Len=0"
"248","2.440009166","212.143.195.14","192.168.129.132","TCP","7114","443  >  54820 [PSH, ACK] Seq=1503380 Ack=12807 Win=64240 Len=7060 [TCP PDU reassembled in 250]"
"249","2.440086913","192.168.129.132","212.143.195.14","TCP","54","54820  >  443 [ACK] Seq=12807 Ack=1510440 Win=65535 Len=0"
"250","2.440171629","212.143.195.14","192.168.129.132","TLSv1.2","21234","Application Data, Application Data, Application Data, Application Data, Application Data"
"251","2.440595904","192.168.129.132","212.143.195.14","TCP","54","54820  >  443 [ACK] Seq=12807 Ack=1531620 Win=65535 Len=0"
"252","2.446570936","212.143.195.14","192.168.129.132","TLSv1.2","32530","Application Data, Application Data, Application Data, Application Data, Application Data"
"253","2.446721945","212.143.195.14","192.168.129.132","TCP","12762","443  >  54820 [PSH, ACK] Seq=1564096 Ack=12807 Win=64240 Len=12708 [TCP PDU reassembled in 255]"
"254","2.446825626","192.168.129.132","212.143.195.14","TCP","54","54820  >  443 [ACK] Seq=12807 Ack=1576804 Win=65535 Len=0"
"255","2.446864553","212.143.195.14","192.168.129.132","TLSv1.2","19109","Application Data, Application Data, Application Data, Application Data, Application Data"
"256","2.447063850","192.168.129.132","212.143.195.14","TCP","54","54820  >  443 [ACK] Seq=12807 Ack=1595859 Win=65535 Len=0"
"257","2.447485761","212.143.195.14","192.168.129.132","TLSv1.2","45238","Application Data, Application Data, Application Data, Application Data, Application Data"
"258","2.447582498","192.168.129.132","212.143.195.14","TCP","54","54820  >  443 [ACK] Seq=12807 Ack=1641043 Win=65535 Len=0"
"259","2.447584452","212.143.195.14","192.168.129.132","TLSv1.2","19109","Application Data, Application Data, Application Data, Application Data, Application Data"
"260","2.447751751","192.168.129.132","212.143.195.14","TCP","54","54820  >  443 [ACK] Seq=12807 Ack=1660098 Win=65535 Len=0"
"261","2.447966938","212.143.195.14","192.168.129.132","TCP","15600","443  >  54820 [PSH, ACK] Seq=1660098 Ack=12807 Win=64240 Len=15546 [TCP PDU reassembled in 263]"
"262","2.447995137","192.168.129.132","212.143.195.14","TCP","54","54820  >  443 [ACK] Seq=12807 Ack=1675644 Win=65535 Len=0"
"263","2.452397859","212.143.195.14","192.168.129.132","TLSv1.2","38178","Application Data, Application Data, Application Data, Application Data, Application Data, Application Data, Application Data, Application Data, Application Data"
"264","2.452573462","212.143.195.14","192.168.129.132","TLSv1.2","15586","Application Data"
"265","2.452604853","212.143.195.14","192.168.129.132","TCP","10637","443  >  54820 [PSH, ACK] Seq=1729300 Ack=12807 Win=64240 Len=10583 [TCP PDU reassembled in 270]"
"266","2.452623037","192.168.129.132","212.143.195.14","TCP","54","54820  >  443 [ACK] Seq=12807 Ack=1713768 Win=65535 Len=0"
"267","2.452811144","142.250.75.86","192.168.129.132","TLSv1.2","7229","Application Data, Application Data, Application Data, Application Data, Application Data, Application Data"
"268","2.452872961","142.250.75.86","192.168.129.132","TLSv1.2","22646","Application Data, Application Data, Application Data, Application Data, Application Data, Application Data, Application Data, Application Data, Application Data, Application Data, Application Data, Application Data, Application Data, Application Data, Application Data, Application Data"
"269","2.452947341","192.168.129.132","212.143.195.14","TCP","54","54820  >  443 [ACK] Seq=12807 Ack=1739883 Win=65535 Len=0"
"270","2.453469850","212.143.195.14","192.168.129.132","TLSv1.2","38178","Application Data, Application Data, Application Data, Application Data, Application Data, Application Data, Application Data, Application Data, Application Data, Application Data, Application Data, Application Data"
"271","2.453514884","192.168.129.132","212.143.195.14","TCP","54","54820  >  443 [ACK] Seq=12807 Ack=1778007 Win=65535 Len=0"
"272","2.453640149","192.168.129.132","142.250.75.86","TCP","54","40844  >  443 [ACK] Seq=1369 Ack=308624 Win=65535 Len=0"
"273","2.453957703","212.143.195.14","192.168.129.132","TLSv1.2","17711","Application Data"
"274","2.454090413","142.250.75.86","192.168.129.132","TLSv1.2","9938","Application Data, Application Data, Application Data, Application Data, Application Data, Application Data, Application Data"
"275","2.454090674","212.143.195.14","192.168.129.132","TCP","8512","443  >  54820 [PSH, ACK] Seq=1795664 Ack=12807 Win=64240 Len=8458 [TCP PDU reassembled in 280]"
"276","2.454129533","192.168.129.132","142.250.75.86","TCP","54","40844  >  443 [ACK] Seq=1369 Ack=318508 Win=65535 Len=0"
"277","2.454396323","142.250.75.86","192.168.129.132","TLSv1.2","4131","Application Data, Application Data, Application Data, Application Data"
"278","2.454425408","192.168.129.132","142.250.75.86","TCP","54","40844  >  443 [ACK] Seq=1369 Ack=322585 Win=65535 Len=0"
"279","2.454554179","192.168.129.132","212.143.195.14","TCP","54","54820  >  443 [ACK] Seq=12807 Ack=1804122 Win=65535 Len=0"
"280","2.454710718","212.143.195.14","192.168.129.132","TLSv1.2","15600","Application Data, Application Data, Application Data, Application Data"
"281","2.454784806","192.168.129.132","212.143.195.14","TCP","54","54820  >  443 [ACK] Seq=12807 Ack=1819668 Win=65535 Len=0"
"282","2.458019172","212.143.195.14","192.168.129.132","TLSv1.2","10075","Application Data, Application Data, Application Data, Application Data, Application Data, Application Data, Application Data"
"283","2.458020605","142.250.75.86","192.168.129.132","TLSv1.2","93","Application Data"
"284","2.458090911","192.168.129.132","212.143.195.14","TCP","54","54820  >  443 [ACK] Seq=12807 Ack=1829689 Win=65535 Len=0"
"285","2.459220094","192.168.129.132","142.250.75.86","TLSv1.2","93","Application Data"
"286","2.459493439","142.250.75.86","192.168.129.132","TCP","60","443  >  40844 [ACK] Seq=322624 Ack=1408 Win=64240 Len=0"
"287","2.495950793","192.168.129.132","212.143.195.14","TLSv1.2","2286","Application Data"
"288","2.496352570","192.168.129.132","212.143.195.14","TLSv1.2","2173","Application Data"
"289","2.496593771","212.143.195.14","192.168.129.132","TCP","60","443  >  54820 [ACK] Seq=1829689 Ack=14267 Win=64240 Len=0"
"290","2.496594051","212.143.195.14","192.168.129.132","TCP","60","443  >  54820 [ACK] Seq=1829689 Ack=15039 Win=64240 Len=0"
"291","2.496594141","212.143.195.14","192.168.129.132","TCP","60","443  >  54820 [ACK] Seq=1829689 Ack=16499 Win=64240 Len=0"
"292","2.496594198","212.143.195.14","192.168.129.132","TCP","60","443  >  54820 [ACK] Seq=1829689 Ack=17158 Win=64240 Len=0"
"293","2.545520951","212.143.195.14","192.168.129.132","TLSv1.2","1555","Application Data, Application Data, Application Data, Application Data, Application Data, Application Data, Application Data, Application Data, Application Data, Application Data, Application Data, Application Data, Application Data, Application Data, Application Data, Application Data, Application Data"
"294","2.545705849","192.168.129.132","212.143.195.14","TCP","54","54820  >  443 [ACK] Seq=17158 Ack=1831190 Win=65535 Len=0"
"295","4.456203846","192.168.129.132","142.250.75.86","TLSv1.2","221","Application Data"
"296","4.456857832","142.250.75.86","192.168.129.132","TCP","60","443  >  40844 [ACK] Seq=322624 Ack=1575 Win=64240 Len=0"
"297","4.477154863","142.250.75.86","192.168.129.132","TLSv1.2","15702","Application Data, Application Data, Application Data, Application Data, Application Data, Application Data, Application Data, Application Data, Application Data, Application Data, Application Data, Application Data"
"298","4.477567917","192.168.129.132","142.250.75.86","TCP","54","40844  >  443 [ACK] Seq=1575 Ack=338272 Win=65535 Len=0"
"299","4.478220645","142.250.75.86","192.168.129.132","TLSv1.2","19800","Application Data, Application Data, Application Data, Application Data, Application Data, Application Data, Application Data, Application Data, Application Data, Application Data, Application Data, Application Data, Application Data, Application Data, Application Data, Application Data"
"300","4.478499731","192.168.129.132","142.250.75.86","TCP","54","40844  >  443 [ACK] Seq=1575 Ack=358018 Win=65535 Len=0"
"301","4.481266122","192.168.129.132","142.250.75.86","TLSv1.2","93","Application Data"
"302","4.481779078","142.250.75.86","192.168.129.132","TCP","60","443  >  40844 [ACK] Seq=358018 Ack=1614 Win=64240 Len=0"
"303","4.482093685","192.168.129.132","142.250.75.86","TLSv1.2","89","Application Data"
"304","4.482284930","142.250.75.86","192.168.129.132","TCP","60","443  >  40844 [ACK] Seq=358018 Ack=1649 Win=64240 Len=0"
"305","4.615847102","192.168.129.132","212.143.195.14","TLSv1.2","2286","Application Data"
"306","4.616491699","212.143.195.14","192.168.129.132","TCP","60","443  >  54820 [ACK] Seq=1831190 Ack=18618 Win=64240 Len=0"
"307","4.616491918","212.143.195.14","192.168.129.132","TCP","60","443  >  54820 [ACK] Seq=1831190 Ack=19390 Win=64240 Len=0"
"308","4.616691260","192.168.129.132","212.143.195.14","TLSv1.2","2172","Application Data"
"309","4.617012511","212.143.195.14","192.168.129.132","TCP","60","443  >  54820 [ACK] Seq=1831190 Ack=20850 Win=64240 Len=0"
"310","4.617012759","212.143.195.14","192.168.129.132","TCP","60","443  >  54820 [ACK] Seq=1831190 Ack=21508 Win=64240 Len=0"
"311","4.629277199","212.143.195.14","192.168.129.132","TLSv1.2","1525","Application Data, Application Data, Application Data, Application Data, Application Data, Application Data, Application Data, Application Data, Application Data, Application Data, Application Data, Application Data, Application Data, Application Data, Application Data, Application Data"
"312","4.629629833","192.168.129.132","212.143.195.14","TCP","54","54820  >  443 [ACK] Seq=21508 Ack=1832661 Win=65535 Len=0"
"313","4.630874107","212.143.195.14","192.168.129.132","TLSv1.2","36766","Application Data, Application Data, Application Data, Application Data, Application Data, Application Data, Application Data, Application Data, Application Data, Application Data"
"314","4.632241626","212.143.195.14","192.168.129.132","TLSv1.2","27581","Application Data"
"315","4.634890403","192.168.129.132","212.143.195.14","TCP","54","54820  >  443 [ACK] Seq=21508 Ack=1896900 Win=65535 Len=0"
"316","4.635587694","212.143.195.14","192.168.129.132","TLSv1.2","1779","Application Data, Application Data"
"317","4.635955783","192.168.129.132","212.143.195.14","TCP","54","54820  >  443 [ACK] Seq=21508 Ack=1898625 Win=65535 Len=0"
"318","4.640364001","212.143.195.14","192.168.129.132","TLSv1.2","24058","Application Data, Application Data, Application Data"
"319","4.640412777","192.168.129.132","212.143.195.14","TCP","54","54820  >  443 [ACK] Seq=21508 Ack=1922629 Win=65535 Len=0"
"320","4.640500398","212.143.195.14","192.168.129.132","TLSv1.2","14174","Application Data, Application Data, Application Data, Application Data"
"321","4.640572992","212.143.195.14","192.168.129.132","TCP","4290","443  >  54820 [PSH, ACK] Seq=1936749 Ack=21508 Win=64240 Len=4236 [TCP PDU reassembled in 322]"
"322","4.640573110","212.143.195.14","192.168.129.132","TLSv1.2","21933","Application Data, Application Data, Application Data, Application Data, Application Data, Application Data, Application Data, Application Data, Application Data, Application Data, Application Data"
"323","4.640926607","212.143.195.14","192.168.129.132","TLSv1.2","24058","Application Data"
"324","4.641179922","192.168.129.132","212.143.195.14","TCP","54","54820  >  443 [ACK] Seq=21508 Ack=1986868 Win=65535 Len=0"
"325","4.641989677","212.143.195.14","192.168.129.132","TLSv1.2","64293","Application Data, Application Data, Application Data, Application Data, Application Data, Application Data, Application Data, Application Data, Application Data, Application Data"
"326","4.642032549","192.168.129.132","212.143.195.14","TCP","54","54820  >  443 [ACK] Seq=21508 Ack=2051107 Win=65535 Len=0"
"327","4.642612944","212.143.195.14","192.168.129.132","TLSv1.2","16887","Application Data, Application Data, Application Data, Application Data"
"328","4.642968384","192.168.129.132","212.143.195.14","TCP","54","54820  >  443 [ACK] Seq=21508 Ack=2067940 Win=65535 Len=0"
"329","4.645755526","212.143.195.14","192.168.129.132","TLSv1.2","45017","Application Data, Application Data, Application Data, Application Data, Application Data, Application Data, Application Data, Application Data, Application Data, Application Data, Application Data, Application Data"
"330","4.645917921","192.168.129.132","212.143.195.14","TCP","54","54820  >  443 [ACK] Seq=21508 Ack=2112903 Win=65535 Len=0"
"331","4.646129740","212.143.195.14","192.168.129.132","TLSv1.2","19330","Application Data, Application Data, Application Data, Application Data"
"332","4.646631223","212.143.195.14","192.168.129.132","TLSv1.2","45017","Application Data, Application Data, Application Data, Application Data, Application Data, Application Data, Application Data, Application Data, Application Data"
"333","4.647354315","192.168.129.132","212.143.195.14","TCP","54","54820  >  443 [ACK] Seq=21508 Ack=2177142 Win=65535 Len=0"
"334","4.647763977","212.143.195.14","192.168.129.132","TLSv1.2","62781","Application Data, Application Data, Application Data, Application Data, Application Data, Application Data, Application Data, Application Data, Application Data"
"335","4.648626788","192.168.129.132","212.143.195.14","TCP","54","54820  >  443 [ACK] Seq=21508 Ack=2239869 Win=65535 Len=0"
"336","4.653341551","212.143.195.14","192.168.129.132","TLSv1.2","16998","Application Data, Application Data, Application Data, Application Data, Application Data"
"337","4.653388897","192.168.129.132","212.143.195.14","TCP","54","54820  >  443 [ACK] Seq=21508 Ack=2256813 Win=65535 Len=0"
"338","4.653717873","212.143.195.14","192.168.129.132","TLSv1.2","29264","Application Data"
"339","4.653750354","212.143.195.14","192.168.129.132","TLSv1.2","18139","Application Data, Application Data, Application Data, Application Data"
"340","4.653826696","212.143.195.14","192.168.129.132","TLSv1.2","16998","Application Data"
"341","4.654343867","192.168.129.132","212.143.195.14","TCP","54","54820  >  443 [ACK] Seq=21508 Ack=2321052 Win=65535 Len=0"
"342","4.654937424","212.143.195.14","192.168.129.132","TLSv1.2","64293","Application Data, Application Data, Application Data, Application Data, Application Data, Application Data, Application Data, Application Data, Application Data, Application Data"
"343","4.655162635","192.168.129.132","212.143.195.14","TCP","54","54820  >  443 [ACK] Seq=21508 Ack=2385291 Win=65535 Len=0"
"344","4.655596251","212.143.195.14","192.168.129.132","TLSv1.2","6934","Application Data, Application Data, Application Data, Application Data"
"345","4.655708441","192.168.129.132","212.143.195.14","TCP","54","54820  >  443 [ACK] Seq=21508 Ack=2392171 Win=65535 Len=0"
"346","4.656727031","212.143.195.14","192.168.129.132","TCP","8526","443  >  54820 [PSH, ACK] Seq=2392171 Ack=21508 Win=64240 Len=8472 [TCP PDU reassembled in 347]"
"347","4.656727523","212.143.195.14","192.168.129.132","TLSv1.2","18410","Application Data"
"348","4.656770365","192.168.129.132","212.143.195.14","TCP","54","54820  >  443 [ACK] Seq=21508 Ack=2400643 Win=65535 Len=0"
"349","4.656873465","212.143.195.14","192.168.129.132","TLSv1.2","5124","Application Data, Application Data, Application Data, Application Data"
"350","4.657478053","192.168.129.132","212.143.195.14","TCP","54","54820  >  443 [ACK] Seq=21508 Ack=2424069 Win=65535 Len=0"
"351","4.660650235","212.143.195.14","192.168.129.132","TCP","9938","443  >  54820 [PSH, ACK] Seq=2424069 Ack=21508 Win=64240 Len=9884 [TCP PDU reassembled in 352]"
"352","4.660650617","212.143.195.14","192.168.129.132","TLSv1.2","12762","Application Data"
"353","4.660738479","192.168.129.132","212.143.195.14","TCP","54","54820  >  443 [ACK] Seq=21508 Ack=2433953 Win=65535 Len=0"
"354","4.660864684","212.143.195.14","192.168.129.132","TLSv1.2","16164","Application Data, Application Data, Application Data, Application Data, Application Data, Application Data, Application Data, Application Data, Application Data, Application Data, Application Data, Application Data, Application Data, Application Data"
"355","4.660912269","212.143.195.14","192.168.129.132","TCP","5569","443  >  54820 [PSH, ACK] Seq=2462771 Ack=21508 Win=64240 Len=5515 [TCP PDU reassembled in 357]"
"356","4.660994025","192.168.129.132","212.143.195.14","TCP","54","54820  >  443 [ACK] Seq=21508 Ack=2462771 Win=65535 Len=0"
"357","4.661140296","212.143.195.14","192.168.129.132","TLSv1.2","12762","Application Data"
"358","4.661164125","192.168.129.132","212.143.195.14","TCP","54","54820  >  443 [ACK] Seq=21508 Ack=2480994 Win=65535 Len=0"
"359","4.661215600","212.143.195.14","192.168.129.132","TLSv1.2","16998","Application Data, Application Data, Application Data, Application Data"
"360","4.661257809","212.143.195.14","192.168.129.132","TCP","308","443  >  54820 [PSH, ACK] Seq=2497938 Ack=21508 Win=64240 Len=254 [TCP PDU reassembled in 362]"
"361","4.661313498","192.168.129.132","212.143.195.14","TCP","54","54820  >  443 [ACK] Seq=21508 Ack=2498192 Win=65535 Len=0"
"362","4.661392290","212.143.195.14","192.168.129.132","TLSv1.2","15747","Application Data"
"363","4.661477868","192.168.129.132","212.143.195.14","TCP","54","54820  >  443 [ACK] Seq=21508 Ack=2513885 Win=65535 Len=0"
"364","4.661576165","212.143.195.14","192.168.129.132","TLSv1.2","12762","Application Data, Application Data, Application Data, Application Data"
"365","4.661628526","212.143.195.14","192.168.129.132","TCP","12762","443  >  54820 [PSH, ACK] Seq=2526593 Ack=21508 Win=64240 Len=12708 [TCP PDU reassembled in 367]"
"366","4.661807908","192.168.129.132","212.143.195.14","TCP","54","54820  >  443 [ACK] Seq=21508 Ack=2539301 Win=65535 Len=0"
"367","4.661819101","212.143.195.14","192.168.129.132","TLSv1.2","18410","Application Data, Application Data, Application Data, Application Data, Application Data"
"368","4.661945317","192.168.129.132","212.143.195.14","TCP","54","54820  >  443 [ACK] Seq=21508 Ack=2557657 Win=65535 Len=0"
"369","4.662057152","212.143.195.14","192.168.129.132","TCP","5260","443  >  54820 [PSH, ACK] Seq=2557657 Ack=21508 Win=64240 Len=5206 [TCP PDU reassembled in 371]"
"370","4.662105531","192.168.129.132","212.143.195.14","TCP","54","54820  >  443 [ACK] Seq=21508 Ack=2562863 Win=65535 Len=0"
"371","4.668081060","212.143.195.14","192.168.129.132","TLSv1.2","32945","Application Data, Application Data, Application Data, Application Data, Application Data"
"372","4.668297422","212.143.195.14","192.168.129.132","TCP","8526","443  >  54820 [PSH, ACK] Seq=2595754 Ack=21508 Win=64240 Len=8472 [TCP PDU reassembled in 373]"
"373","4.668297564","212.143.195.14","192.168.129.132","TLSv1.2","12762","Application Data"
"374","4.668401325","212.143.195.14","192.168.129.132","TLSv1.2","10222","Application Data, Application Data, Application Data, Application Data"
"375","4.668456345","192.168.129.132","212.143.195.14","TCP","54","54820  >  443 [ACK] Seq=21508 Ack=2627102 Win=65535 Len=0"
"376","4.669123434","212.143.195.14","192.168.129.132","TLSv1.2","64293","Application Data, Application Data, Application Data, Application Data, Application Data, Application Data, Application Data, Application Data, Application Data, Application Data"
"377","4.669187893","192.168.129.132","212.143.195.14","TCP","54","54820  >  443 [ACK] Seq=21508 Ack=2691341 Win=65535 Len=0"
"378","4.669678534","212.143.195.14","192.168.129.132","TLSv1.2","41453","Application Data, Application Data, Application Data, Application Data, Application Data, Application Data, Application Data, Application Data, Application Data, Application Data, Application Data, Application Data, Application Data, Application Data, Application Data"
"379","4.670026442","192.168.129.132","212.143.195.14","TCP","54","54820  >  443 [ACK] Seq=21508 Ack=2732740 Win=65535 Len=0"
"380","4.683539381","212.143.195.14","192.168.129.132","TLSv1.2","15586","Application Data"
"381","4.683628927","192.168.129.132","212.143.195.14","TCP","54","54820  >  443 [ACK] Seq=21508 Ack=2748272 Win=65535 Len=0"
"382","4.683735336","212.143.195.14","192.168.129.132","TCP","7114","443  >  54820 [PSH, ACK] Seq=2748272 Ack=21508 Win=64240 Len=7060 [TCP PDU reassembled in 384]"
"383","4.683745820","192.168.129.132","212.143.195.14","TCP","54","54820  >  443 [ACK] Seq=21508 Ack=2755332 Win=65535 Len=0"
"384","4.690820597","212.143.195.14","192.168.129.132","TLSv1.2","11765","Application Data, Application Data, Application Data, Application Data"
"385","4.690892192","212.143.195.14","192.168.129.132","TLSv1.2","12762","Application Data"
"386","4.690989664","192.168.129.132","212.143.195.14","TCP","54","54820  >  443 [ACK] Seq=21508 Ack=2779751 Win=65535 Len=0"
"387","4.691233032","212.143.195.14","192.168.129.132","TLSv1.2","25470","Application Data, Application Data, Application Data, Application Data"
"388","4.691251099","212.143.195.14","192.168.129.132","TLSv1.2","11350","Application Data"
"389","4.691285289","212.143.195.14","192.168.129.132","TLSv1.2","3162","Application Data, Application Data, Application Data, Application Data, Application Data, Application Data, Application Data, Application Data, Application Data, Application Data"
"390","4.691334362","192.168.129.132","212.143.195.14","TCP","54","54820  >  443 [ACK] Seq=21508 Ack=2819571 Win=65535 Len=0"
"391","4.691434418","212.143.195.14","192.168.129.132","TCP","10888","443  >  54820 [PSH, ACK] Seq=2819571 Ack=21508 Win=64240 Len=10834 [TCP PDU reassembled in 395]"
"392","4.691520981","212.143.195.14","192.168.129.132","TCP","4290","443  >  54820 [PSH, ACK] Seq=2830405 Ack=21508 Win=64240 Len=4236 [TCP PDU reassembled in 395]"
"393","4.691529408","192.168.129.132","212.143.195.14","TCP","54","54820  >  443 [ACK] Seq=21508 Ack=2830405 Win=65535 Len=0"
"394","4.691678790","192.168.129.132","212.143.195.14","TCP","54","54820  >  443 [ACK] Seq=21508 Ack=2834641 Win=65535 Len=0"
"395","4.691705270","212.143.195.14","192.168.129.132","TLSv1.2","9403","Application Data"
"396","4.691880986","212.143.195.14","192.168.129.132","TCP","4825","443  >  54820 [PSH, ACK] Seq=2843990 Ack=21508 Win=64240 Len=4771 [TCP PDU reassembled in 398]"
"397","4.692013448","192.168.129.132","212.143.195.14","TCP","54","54820  >  443 [ACK] Seq=21508 Ack=2848761 Win=65535 Len=0"
"398","4.697143390","212.143.195.14","192.168.129.132","TLSv1.2","19822","Application Data, Application Data, Application Data, Application Data"
"399","4.697273444","212.143.195.14","192.168.129.132","TLSv1.2","19257","Application Data, Application Data, Application Data, Application Data, Application Data"
"400","4.697355018","212.143.195.14","192.168.129.132","TCP","5702","443  >  54820 [PSH, ACK] Seq=2887732 Ack=21508 Win=64240 Len=5648 [TCP PDU reassembled in 402]"
"401","4.697355237","212.143.195.14","192.168.129.132","TCP","7114","443  >  54820 [PSH, ACK] Seq=2893380 Ack=21508 Win=64240 Len=7060 [TCP PDU reassembled in 402]"
"402","4.697398438","212.143.195.14","192.168.129.132","TLSv1.2","12614","Application Data"
"403","4.697413380","192.168.129.132","212.143.195.14","TCP","54","54820  >  443 [ACK] Seq=21508 Ack=2893380 Win=65535 Len=0"
"404","4.697630280","192.168.129.132","212.143.195.14","TCP","54","54820  >  443 [ACK] Seq=21508 Ack=2913000 Win=65535 Len=0"
"405","4.697829698","212.143.195.14","192.168.129.132","TLSv1.2","10274","Application Data, Application Data, Application Data, Application Data"
"406","4.697848391","192.168.129.132","212.143.195.14","TCP","54","54820  >  443 [ACK] Seq=21508 Ack=2923220 Win=65535 Len=0"
"407","4.698100070","212.143.195.14","192.168.129.132","TLSv1.2","34453","Application Data, Application Data, Application Data, Application Data, Application Data"
"408","4.698190879","192.168.129.132","212.143.195.14","TCP","54","54820  >  443 [ACK] Seq=21508 Ack=2957619 Win=65535 Len=0"
"409","4.698498456","212.143.195.14","192.168.129.132","TLSv1.2","29894","Application Data, Application Data, Application Data, Application Data, Application Data, Application Data, Application Data, Application Data"
"410","4.698521177","192.168.129.132","212.143.195.14","TCP","54","54820  >  443 [ACK] Seq=21508 Ack=2987459 Win=65535 Len=0"
"411","4.698626267","212.143.195.14","192.168.129.132","TLSv1.2","34453","Application Data, Application Data, Application Data, Application Data, Application Data"
"412","4.698667480","192.168.129.132","212.143.195.14","TCP","54","54820  >  443 [ACK] Seq=21508 Ack=3021858 Win=65535 Len=0"
"413","4.699060550","212.143.195.14","192.168.129.132","TLSv1.2","8063","Application Data, Application Data, Application Data, Application Data, Application Data, Application Data, Application Data"
"414","4.699284855","192.168.129.132","212.143.195.14","TCP","54","54820  >  443 [ACK] Seq=21508 Ack=3029867 Win=65535 Len=0"
"415","4.975934506","192.168.129.132","212.143.195.14","TLSv1.2","2286","Application Data"
"416","4.976372573","212.143.195.14","192.168.129.132","TCP","60","443  >  54820 [ACK] Seq=3029867 Ack=22968 Win=64240 Len=0"
"417","4.976373032","212.143.195.14","192.168.129.132","TCP","60","443  >  54820 [ACK] Seq=3029867 Ack=23740 Win=64240 Len=0"
"418","4.976520697","192.168.129.132","212.143.195.14","TLSv1.2","2257","Application Data"
"419","4.976954358","212.143.195.14","192.168.129.132","TCP","60","443  >  54820 [ACK] Seq=3029867 Ack=25200 Win=64240 Len=0"
"420","4.976954723","212.143.195.14","192.168.129.132","TCP","60","443  >  54820 [ACK] Seq=3029867 Ack=25943 Win=64240 Len=0"
"421","4.990746991","212.143.195.14","192.168.129.132","TLSv1.2","1246","Application Data, Application Data, Application Data, Application Data, Application Data, Application Data, Application Data, Application Data, Application Data"
"422","4.990747692","212.143.195.14","192.168.129.132","TLSv1.2","36554","Application Data, Application Data, Application Data, Application Data, Application Data, Application Data, Application Data, Application Data, Application Data, Application Data, Application Data, Application Data, Application Data, Application Data"
"423","4.990992276","212.143.195.14","192.168.129.132","TCP","545","443  >  54820 [PSH, ACK] Seq=3067559 Ack=25943 Win=64240 Len=491 [TCP PDU reassembled in 426]"
"424","4.991011705","192.168.129.132","212.143.195.14","TCP","54","54820  >  443 [ACK] Seq=25943 Ack=3067559 Win=65535 Len=0"
"425","4.992064261","212.143.195.14","192.168.129.132","TCP","8526","443  >  54820 [PSH, ACK] Seq=3068050 Ack=25943 Win=64240 Len=8472 [TCP PDU reassembled in 426]"
"426","4.992064418","212.143.195.14","192.168.129.132","TLSv1.2","7114","Application Data"
"427","4.992166172","212.143.195.14","192.168.129.132","TCP","8526","443  >  54820 [PSH, ACK] Seq=3083582 Ack=25943 Win=64240 Len=8472 [TCP PDU reassembled in 429]"
"428","4.992166480","212.143.195.14","192.168.129.132","TCP","1466","443  >  54820 [PSH, ACK] Seq=3092054 Ack=25943 Win=64240 Len=1412 [TCP PDU reassembled in 429]"
"429","4.992166562","212.143.195.14","192.168.129.132","TLSv1.2","7114","Application Data"
"430","4.992260985","212.143.195.14","192.168.129.132","TCP","1466","443  >  54820 [PSH, ACK] Seq=3100526 Ack=25943 Win=64240 Len=1412 [TCP PDU reassembled in 433]"
"431","4.992261313","212.143.195.14","192.168.129.132","TCP","2878","443  >  54820 [PSH, ACK] Seq=3101938 Ack=25943 Win=64240 Len=2824 [TCP PDU reassembled in 433]"
"432","4.994261818","192.168.129.132","212.143.195.14","TCP","54","54820  >  443 [ACK] Seq=25943 Ack=3104762 Win=65535 Len=0"
"433","4.995138111","212.143.195.14","192.168.129.132","TLSv1.2","29706","Application Data, Application Data"
"434","4.995172597","192.168.129.132","212.143.195.14","TCP","54","54820  >  443 [ACK] Seq=25943 Ack=3134414 Win=65535 Len=0"
"435","4.995336637","212.143.195.14","192.168.129.132","TLSv1.2","15586","Application Data"
"436","4.995391919","212.143.195.14","192.168.129.132","TCP","7114","443  >  54820 [PSH, ACK] Seq=3149946 Ack=25943 Win=64240 Len=7060 [TCP PDU reassembled in 437]"
"437","4.995392079","212.143.195.14","192.168.129.132","TLSv1.2","12049","Application Data"
"438","4.995526406","212.143.195.14","192.168.129.132","TCP","9239","443  >  54820 [PSH, ACK] Seq=3169001 Ack=25943 Win=64240 Len=9185 [TCP PDU reassembled in 440]"
"439","4.995920609","192.168.129.132","212.143.195.14","TCP","54","54820  >  443 [ACK] Seq=25943 Ack=3178186 Win=65535 Len=0"
"440","4.998483183","212.143.195.14","192.168.129.132","TLSv1.2","35354","Application Data, Application Data, Application Data"
"441","4.998613814","192.168.129.132","212.143.195.14","TCP","54","54820  >  443 [ACK] Seq=25943 Ack=3213486 Win=65535 Len=0"
"442","4.998860657","212.143.195.14","192.168.129.132","TCP","9938","443  >  54820 [PSH, ACK] Seq=3213486 Ack=25943 Win=64240 Len=9884 [TCP PDU reassembled in 443]"
"443","4.998861096","212.143.195.14","192.168.129.132","TLSv1.2","19109","Application Data"
"444","4.998927043","192.168.129.132","212.143.195.14","TCP","54","54820  >  443 [ACK] Seq=25943 Ack=3223370 Win=65535 Len=0"
"445","4.999227644","192.168.129.132","212.143.195.14","TCP","54","54820  >  443 [ACK] Seq=25943 Ack=3242425 Win=65535 Len=0"
"446","4.999451534","212.143.195.14","192.168.129.132","TLSv1.2","29007","Application Data, Application Data"
"447","4.999848834","192.168.129.132","212.143.195.14","TCP","54","54820  >  443 [ACK] Seq=25943 Ack=3271378 Win=65535 Len=0"
"448","5.003510288","212.143.195.14","192.168.129.132","TCP","1466","443  >  54820 [PSH, ACK] Seq=3271378 Ack=25943 Win=64240 Len=1412 [TCP PDU reassembled in 450]"
"449","5.003510651","212.143.195.14","192.168.129.132","TCP","4290","443  >  54820 [PSH, ACK] Seq=3272790 Ack=25943 Win=64240 Len=4236 [TCP PDU reassembled in 450]"
"450","5.003510684","212.143.195.14","192.168.129.132","TLSv1.2","11734","Application Data"
"451","5.003651101","192.168.129.132","212.143.195.14","TCP","54","54820  >  443 [ACK] Seq=25943 Ack=3277026 Win=65535 Len=0"
"452","5.003757197","192.168.129.132","212.143.195.14","TCP","54","54820  >  443 [ACK] Seq=25943 Ack=3288706 Win=65535 Len=0"
"453","5.003901417","212.143.195.14","192.168.129.132","TCP","1082","443  >  54820 [PSH, ACK] Seq=3288706 Ack=25943 Win=64240 Len=1028 [TCP PDU reassembled in 454]"
"454","5.003901539","212.143.195.14","192.168.129.132","TLSv1.2","8526","Application Data, Application Data, Application Data, Application Data, Application Data, Application Data, Application Data"
"455","5.003901579","212.143.195.14","192.168.129.132","TCP","5702","443  >  54820 [PSH, ACK] Seq=3298206 Ack=25943 Win=64240 Len=5648 [TCP PDU reassembled in 457]"
"456","5.003944435","192.168.129.132","212.143.195.14","TCP","54","54820  >  443 [ACK] Seq=25943 Ack=3303854 Win=65535 Len=0"
"457","5.003998683","212.143.195.14","192.168.129.132","TLSv1.2","8526","Application Data"
"458","5.004110823","192.168.129.132","212.143.195.14","TCP","54","54820  >  443 [ACK] Seq=25943 Ack=3312326 Win=65535 Len=0"
"459","5.004326688","212.143.195.14","192.168.129.132","TLSv1.2","20494","Application Data"
"460","5.004460120","192.168.129.132","212.143.195.14","TCP","54","54820  >  443 [ACK] Seq=25943 Ack=3332766 Win=65535 Len=0"
"461","5.004528968","212.143.195.14","192.168.129.132","TCP","794","443  >  54820 [PSH, ACK] Seq=3332766 Ack=25943 Win=64240 Len=740 [TCP PDU reassembled in 463]"
"462","5.004529103","212.143.195.14","192.168.129.132","TCP","7114","443  >  54820 [PSH, ACK] Seq=3333506 Ack=25943 Win=64240 Len=7060 [TCP PDU reassembled in 463]"
"463","5.004529142","212.143.195.14","192.168.129.132","TLSv1.2","18410","Application Data"
"464","5.004673690","192.168.129.132","212.143.195.14","TCP","54","54820  >  443 [ACK] Seq=25943 Ack=3358922 Win=65535 Len=0"
"465","5.004701425","212.143.195.14","192.168.129.132","TLSv1.2","15586","Application Data"
"466","5.004750278","212.143.195.14","192.168.129.132","TLSv1.2","15586","Application Data"
"467","5.004793635","212.143.195.14","192.168.129.132","TLSv1.2","5894","Application Data"
"468","5.004809229","192.168.129.132","212.143.195.14","TCP","54","54820  >  443 [ACK] Seq=25943 Ack=3389986 Win=65535 Len=0"
"469","5.004935289","192.168.129.132","212.143.195.14","TCP","54","54820  >  443 [ACK] Seq=25943 Ack=3395826 Win=65535 Len=0"
"470","5.004946116","212.143.195.14","192.168.129.132","TCP","1233","443  >  54820 [PSH, ACK] Seq=3395826 Ack=25943 Win=64240 Len=1179 [TCP PDU reassembled in 473]"
"471","5.004946243","212.143.195.14","192.168.129.132","TCP","4331","443  >  54820 [PSH, ACK] Seq=3397005 Ack=25943 Win=64240 Len=4277 [TCP PDU reassembled in 473]"
"472","5.005306276","192.168.129.132","212.143.195.14","TCP","54","54820  >  443 [ACK] Seq=25943 Ack=3401282 Win=65535 Len=0"
"473","5.005330287","212.143.195.14","192.168.129.132","TLSv1.2","26552","Application Data, Application Data, Application Data, Application Data, Application Data, Application Data, Application Data, Application Data, Application Data, Application Data, Application Data, Application Data, Application Data, Application Data"
"474","5.005596170","192.168.129.132","212.143.195.14","TCP","54","54820  >  443 [ACK] Seq=25943 Ack=3427780 Win=65535 Len=0"
"475","5.020613744","192.168.129.132","142.250.75.174","TLSv1.2","3377","Application Data"
"476","5.021066288","192.168.129.132","142.250.75.174","TLSv1.2","653","Application Data"
"477","5.021511847","142.250.75.174","192.168.129.132","TCP","60","443  >  34372 [ACK] Seq=3376 Ack=26093 Win=64240 Len=0"
"478","5.021512204","142.250.75.174","192.168.129.132","TCP","60","443  >  34372 [ACK] Seq=3376 Ack=27553 Win=64240 Len=0"
"479","5.021512308","142.250.75.174","192.168.129.132","TCP","60","443  >  34372 [ACK] Seq=3376 Ack=27956 Win=64240 Len=0"
"480","5.021512416","142.250.75.174","192.168.129.132","TCP","60","443  >  34372 [ACK] Seq=3376 Ack=28555 Win=64240 Len=0"
"481","5.051914895","192.168.129.132","212.143.195.14","TLSv1.2","2286","Application Data"
"482","5.052277837","212.143.195.14","192.168.129.132","TCP","60","443  >  54820 [ACK] Seq=3427780 Ack=27403 Win=64240 Len=0"
"483","5.052317418","192.168.129.132","212.143.195.14","TLSv1.2","2256","Application Data"
"484","5.052898856","212.143.195.14","192.168.129.132","TCP","60","443  >  54820 [ACK] Seq=3427780 Ack=28175 Win=64240 Len=0"
"485","5.052899173","212.143.195.14","192.168.129.132","TCP","60","443  >  54820 [ACK] Seq=3427780 Ack=29635 Win=64240 Len=0"
"486","5.052899281","212.143.195.14","192.168.129.132","TCP","60","443  >  54820 [ACK] Seq=3427780 Ack=30377 Win=64240 Len=0"
"487","5.067633051","212.143.195.14","192.168.129.132","TLSv1.2","1555","Application Data, Application Data, Application Data, Application Data, Application Data, Application Data, Application Data, Application Data, Application Data, Application Data, Application Data, Application Data, Application Data, Application Data, Application Data, Application Data, Application Data"
"488","5.067966990","192.168.129.132","212.143.195.14","TCP","54","54820  >  443 [ACK] Seq=30377 Ack=3429281 Win=65535 Len=0"
"489","5.100663044","142.250.75.174","192.168.129.132","TLSv1.2","197","Application Data, Application Data, Application Data"
"490","5.101999186","192.168.129.132","142.250.75.174","TLSv1.2","93","Application Data"
"491","5.102462745","142.250.75.174","192.168.129.132","TCP","60","443  >  34372 [ACK] Seq=3519 Ack=28594 Win=64240 Len=0"
"492","6.093505034","192.168.129.132","142.250.75.86","TLSv1.2","221","Application Data"
"493","6.094035663","142.250.75.86","192.168.129.132","TCP","60","443  >  40844 [ACK] Seq=358018 Ack=1816 Win=64240 Len=0"
"494","6.101207175","142.250.75.86","192.168.129.132","TLSv1.2","2997","Application Data, Application Data, Application Data"
"495","6.101600599","192.168.129.132","142.250.75.86","TCP","54","40844  >  443 [ACK] Seq=1816 Ack=360961 Win=65535 Len=0"
"496","6.102116575","142.250.75.86","192.168.129.132","TLSv1.2","22646","Application Data, Application Data, Application Data, Application Data, Application Data, Application Data, Application Data, Application Data, Application Data, Application Data, Application Data, Application Data, Application Data, Application Data, Application Data, Application Data"
"497","6.102398601","192.168.129.132","142.250.75.86","TCP","54","40844  >  443 [ACK] Seq=1816 Ack=383553 Win=65535 Len=0"
"498","6.104235955","142.250.75.86","192.168.129.132","TLSv1.2","21850","Application Data, Application Data, Application Data, Application Data, Application Data, Application Data, Application Data, Application Data, Application Data, Application Data, Application Data, Application Data, Application Data, Application Data, Application Data, Application Data, Application Data"
"499","6.104299687","192.168.129.132","142.250.75.86","TCP","54","40844  >  443 [ACK] Seq=1816 Ack=405349 Win=65535 Len=0"
"500","6.105991447","192.168.129.132","142.250.75.86","TLSv1.2","93","Application Data"
"501","6.106687002","142.250.75.86","192.168.129.132","TCP","60","443  >  40844 [ACK] Seq=405349 Ack=1855 Win=64240 Len=0"
"502","6.241011102","192.168.129.132","212.143.195.14","TLSv1.2","2286","Application Data"
"503","6.241579065","212.143.195.14","192.168.129.132","TCP","60","443  >  54820 [ACK] Seq=3429281 Ack=31837 Win=64240 Len=0"
"504","6.241579449","212.143.195.14","192.168.129.132","TCP","60","443  >  54820 [ACK] Seq=3429281 Ack=32609 Win=64240 Len=0"
"505","6.241676655","192.168.129.132","212.143.195.14","TLSv1.2","2254","Application Data"
"506","6.242089756","212.143.195.14","192.168.129.132","TCP","60","443  >  54820 [ACK] Seq=3429281 Ack=34069 Win=64240 Len=0"
"507","6.242090064","212.143.195.14","192.168.129.132","TCP","60","443  >  54820 [ACK] Seq=3429281 Ack=34809 Win=64240 Len=0"
"508","6.257646944","212.143.195.14","192.168.129.132","TLSv1.2","1246","Application Data, Application Data, Application Data, Application Data, Application Data, Application Data, Application Data, Application Data, Application Data"
"509","6.257647582","212.143.195.14","192.168.129.132","TLSv1.2","37045","Application Data, Application Data, Application Data, Application Data, Application Data, Application Data, Application Data, Application Data, Application Data, Application Data, Application Data, Application Data, Application Data, Application Data, Application Data, Application Data, Application Data"
"510","6.257989760","192.168.129.132","212.143.195.14","TCP","54","54820  >  443 [ACK] Seq=34809 Ack=3467464 Win=65535 Len=0"
"511","6.260893011","212.143.195.14","192.168.129.132","TLSv1.2","44838","Application Data, Application Data, Application Data, Application Data, Application Data, Application Data, Application Data, Application Data"
"512","6.260978130","212.143.195.14","192.168.129.132","TLSv1.2","19509","Application Data, Application Data, Application Data, Application Data, Application Data"
"513","6.261228873","192.168.129.132","212.143.195.14","TCP","54","54820  >  443 [ACK] Seq=34809 Ack=3531703 Win=65535 Len=0"
"514","6.261747782","212.143.195.14","192.168.129.132","TLSv1.2","38491","Application Data, Application Data, Application Data, Application Data, Application Data"
"515","6.261777151","192.168.129.132","212.143.195.14","TCP","54","54820  >  443 [ACK] Seq=34809 Ack=3570140 Win=65535 Len=0"
"516","6.266010823","212.143.195.14","192.168.129.132","TLSv1.2","56534","Application Data, Application Data, Application Data, Application Data, Application Data, Application Data"
"517","6.266222668","212.143.195.14","192.168.129.132","TLSv1.2","7813","Application Data, Application Data, Application Data, Application Data"
"518","6.266290446","192.168.129.132","212.143.195.14","TCP","54","54820  >  443 [ACK] Seq=34809 Ack=3634379 Win=65535 Len=0"
"519","6.266743014","212.143.195.14","192.168.129.132","TLSv1.2","37479","Application Data, Application Data, Application Data, Application Data, Application Data"
"520","6.266796164","192.168.129.132","212.143.195.14","TCP","54","54820  >  443 [ACK] Seq=34809 Ack=3671804 Win=65535 Len=0"
"521","6.271600947","212.143.195.14","192.168.129.132","TLSv1.2","22646","Application Data, Application Data, Application Data, Application Data, Application Data"
"522","6.271671917","192.168.129.132","212.143.195.14","TCP","54","54820  >  443 [ACK] Seq=34809 Ack=3694396 Win=65535 Len=0"
"523","6.272156510","212.143.195.14","192.168.129.132","TLSv1.2","22646","Application Data"
"524","6.272212080","192.168.129.132","212.143.195.14","TCP","54","54820  >  443 [ACK] Seq=34809 Ack=3716988 Win=65535 Len=0"
"525","6.272216729","212.143.195.14","192.168.129.132","TLSv1.2","19109","Application Data, Application Data, Application Data, Application Data"
"526","6.272401525","192.168.129.132","212.143.195.14","TCP","54","54820  >  443 [ACK] Seq=34809 Ack=3736043 Win=65535 Len=0"
"527","6.272715852","212.143.195.14","192.168.129.132","TLSv1.2","45238","Application Data, Application Data, Application Data, Application Data, Application Data, Application Data"
"528","6.272838221","212.143.195.14","192.168.129.132","TLSv1.2","19109","Application Data, Application Data, Application Data, Application Data"
"529","6.272857558","192.168.129.132","212.143.195.14","TCP","54","54820  >  443 [ACK] Seq=34809 Ack=3781227 Win=65535 Len=0"
"530","6.273031399","192.168.129.132","212.143.195.14","TCP","54","54820  >  443 [ACK] Seq=34809 Ack=3800282 Win=65535 Len=0"
"531","6.273266344","212.143.195.14","192.168.129.132","TLSv1.2","31101","Application Data, Application Data, Application Data, Application Data, Application Data, Application Data, Application Data, Application Data, Application Data, Application Data, Application Data, Application Data, Application Data, Application Data"
"532","6.273318706","192.168.129.132","212.143.195.14","TCP","54","54820  >  443 [ACK] Seq=34809 Ack=3831329 Win=65535 Len=0"
"533","6.277969609","212.143.195.14","192.168.129.132","TLSv1.2","19822","Application Data, Application Data, Application Data, Application Data, Application Data"
"534","6.278059799","192.168.129.132","212.143.195.14","TCP","54","54820  >  443 [ACK] Seq=34809 Ack=3851097 Win=65535 Len=0"
"535","6.278177083","212.143.195.14","192.168.129.132","TLSv1.2","21234","Application Data, Application Data, Application Data, Application Data"
"536","6.278209226","192.168.129.132","212.143.195.14","TCP","54","54820  >  443 [ACK] Seq=34809 Ack=3872277 Win=65535 Len=0"
"537","6.278228068","212.143.195.14","192.168.129.132","TCP","4290","443  >  54820 [PSH, ACK] Seq=3872277 Ack=34809 Win=64240 Len=4236 [TCP PDU reassembled in 538]"
"538","6.278228165","212.143.195.14","192.168.129.132","TLSv1.2","19109","Application Data"
"539","6.278363125","192.168.129.132","212.143.195.14","TCP","54","54820  >  443 [ACK] Seq=34809 Ack=3895568 Win=65535 Len=0"
"540","6.278549153","212.143.195.14","192.168.129.132","TLSv1.2","19822","Application Data, Application Data, Application Data, Application Data, Application Data, Application Data, Application Data, Application Data"
"541","6.278568548","192.168.129.132","212.143.195.14","TCP","54","54820  >  443 [ACK] Seq=34809 Ack=3915336 Win=65535 Len=0"
"542","6.278874602","212.143.195.14","192.168.129.132","TLSv1.2","44525","Application Data, Application Data, Application Data, Application Data, Application Data"
"543","6.279003856","192.168.129.132","212.143.195.14","TCP","54","54820  >  443 [ACK] Seq=34809 Ack=3959807 Win=65535 Len=0"
"544","6.279267701","212.143.195.14","192.168.129.132","TLSv1.2","19822","Application Data, Application Data, Application Data, Application Data, Application Data, Application Data, Application Data, Application Data, Application Data, Application Data, Application Data, Application Data, Application Data, Application Data"
"545","6.279391305","192.168.129.132","212.143.195.14","TCP","54","54820  >  443 [ACK] Seq=34809 Ack=3979575 Win=65535 Len=0"
"546","6.279468544","212.143.195.14","192.168.129.132","TLSv1.2","26392","Application Data, Application Data, Application Data, Application Data, Application Data"
"547","6.280110446","192.168.129.132","212.143.195.14","TCP","54","54820  >  443 [ACK] Seq=34809 Ack=4005913 Win=65535 Len=0"
"548","6.285285963","212.143.195.14","192.168.129.132","TLSv1.2","43826","Application Data, Application Data, Application Data, Application Data, Application Data"
"549","6.285469468","212.143.195.14","192.168.129.132","TLSv1.2","20521","Application Data, Application Data, Application Data, Application Data, Application Data"
"550","6.285529750","192.168.129.132","212.143.195.14","TCP","54","54820  >  443 [ACK] Seq=34809 Ack=4070152 Win=65535 Len=0"
"551","6.286476902","212.143.195.14","192.168.129.132","TLSv1.2","64293","Application Data, Application Data, Application Data, Application Data, Application Data, Application Data, Application Data, Application Data, Application Data, Application Data"
"552","6.286556004","192.168.129.132","212.143.195.14","TCP","54","54820  >  443 [ACK] Seq=34809 Ack=4134391 Win=65535 Len=0"
"553","6.287197418","212.143.195.14","192.168.129.132","TLSv1.2","40319","Application Data, Application Data, Application Data, Application Data, Application Data"
"554","6.287349383","192.168.129.132","212.143.195.14","TCP","54","54820  >  443 [ACK] Seq=34809 Ack=4174656 Win=65535 Len=0"
"555","6.294005375","212.143.195.14","192.168.129.132","TLSv1.2","18410","Application Data"
"556","6.294087278","192.168.129.132","212.143.195.14","TCP","54","54820  >  443 [ACK] Seq=34809 Ack=4193012 Win=65535 Len=0"
"557","6.294236792","212.143.195.14","192.168.129.132","TLSv1.2","14174","Application Data, Application Data, Application Data, Application Data"
"558","6.294259735","212.143.195.14","192.168.129.132","TLSv1.2","12762","Application Data"
"559","6.294289667","192.168.129.132","212.143.195.14","TCP","54","54820  >  443 [ACK] Seq=34809 Ack=4219840 Win=65535 Len=0"
"560","6.294298645","212.143.195.14","192.168.129.132","TLSv1.2","14778","Application Data, Application Data, Application Data, Application Data, Application Data, Application Data, Application Data, Application Data, Application Data, Application Data"
"561","6.294377727","212.143.195.14","192.168.129.132","TLSv1.2","4385","Application Data"
"562","6.294529324","192.168.129.132","212.143.195.14","TCP","54","54820  >  443 [ACK] Seq=34809 Ack=4238895 Win=65535 Len=0"
"563","6.294618362","212.143.195.14","192.168.129.132","TLSv1.2","18410","Application Data, Application Data, Application Data, Application Data"
"564","6.294655786","192.168.129.132","212.143.195.14","TCP","54","54820  >  443 [ACK] Seq=34809 Ack=4257251 Win=65535 Len=0"
"565","6.294680221","212.143.195.14","192.168.129.132","TLSv1.2","18315","Application Data"
"566","6.294720063","212.143.195.14","192.168.129.132","TCP","8621","443  >  54820 [PSH, ACK] Seq=4275512 Ack=34809 Win=64240 Len=8567 [TCP PDU reassembled in 568]"
"567","6.294780773","192.168.129.132","212.143.195.14","TCP","54","54820  >  443 [ACK] Seq=34809 Ack=4284079 Win=65535 Len=0"
"568","6.294953496","212.143.195.14","192.168.129.132","TLSv1.2","23963","Application Data, Application Data, Application Data, Application Data, Application Data"
"569","6.295111979","192.168.129.132","212.143.195.14","TCP","54","54820  >  443 [ACK] Seq=34809 Ack=4307988 Win=65535 Len=0"
"570","6.295125049","212.143.195.14","192.168.129.132","TLSv1.2","16114","Application Data, Application Data, Application Data, Application Data"
"571","6.295249903","192.168.129.132","212.143.195.14","TCP","54","54820  >  443 [ACK] Seq=34809 Ack=4324048 Win=65535 Len=0"
"572","6.295272510","212.143.195.14","192.168.129.132","TCP","3762","443  >  54820 [PSH, ACK] Seq=4324048 Ack=34809 Win=64240 Len=3708 [TCP PDU reassembled in 573]"
"573","6.295272617","212.143.195.14","192.168.129.132","TLSv1.2","18410","Application Data, Application Data, Application Data, Application Data, Application Data, Application Data, Application Data, Application Data"
"574","6.295437226","212.143.195.14","192.168.129.132","TCP","2260","443  >  54820 [PSH, ACK] Seq=4346112 Ack=34809 Win=64240 Len=2206 [TCP PDU reassembled in 578]"
"575","6.295437539","212.143.195.14","192.168.129.132","TCP","6320","443  >  54820 [PSH, ACK] Seq=4348318 Ack=34809 Win=64240 Len=6266 [TCP PDU reassembled in 578]"
"576","6.295488739","192.168.129.132","212.143.195.14","TCP","54","54820  >  443 [ACK] Seq=34809 Ack=4348318 Win=65535 Len=0"
"577","6.295794842","192.168.129.132","212.143.195.14","TCP","54","54820  >  443 [ACK] Seq=34809 Ack=4354584 Win=65535 Len=0"
"578","6.296014357","212.143.195.14","192.168.129.132","TLSv1.2","24058","Application Data, Application Data, Application Data, Application Data, Application Data"
"579","6.296126249","212.143.195.14","192.168.129.132","TCP","7114","443  >  54820 [PSH, ACK] Seq=4378588 Ack=34809 Win=64240 Len=7060 [TCP PDU reassembled in 580]"
"580","6.296126660","212.143.195.14","192.168.129.132","TLSv1.2","26963","Application Data, Application Data, Application Data, Application Data, Application Data, Application Data, Application Data, Application Data, Application Data, Application Data, Application Data"
"581","6.296251569","212.143.195.14","192.168.129.132","TCP","1681","443  >  54820 [PSH, ACK] Seq=4412557 Ack=34809 Win=64240 Len=1627 [TCP PDU reassembled in 585]"
"582","6.296506640","192.168.129.132","212.143.195.14","TCP","54","54820  >  443 [ACK] Seq=34809 Ack=4414184 Win=65535 Len=0"
"583","6.296662161","212.143.195.14","192.168.129.132","TCP","4693","443  >  54820 [PSH, ACK] Seq=4414184 Ack=34809 Win=64240 Len=4639 [TCP PDU reassembled in 585]"
"584","6.296747643","192.168.129.132","212.143.195.14","TCP","54","54820  >  443 [ACK] Seq=34809 Ack=4418823 Win=65535 Len=0"
"585","6.297209410","212.143.195.14","192.168.129.132","TLSv1.2","59654","Application Data, Application Data, Application Data, Application Data, Application Data, Application Data, Application Data, Application Data, Application Data, Application Data, Application Data, Application Data, Application Data"
"586","6.297310229","212.143.195.14","192.168.129.132","TCP","4693","443  >  54820 [PSH, ACK] Seq=4478423 Ack=34809 Win=64240 Len=4639 [TCP PDU reassembled in 588]"
"587","6.297662348","192.168.129.132","212.143.195.14","TCP","54","54820  >  443 [ACK] Seq=34809 Ack=4483062 Win=65535 Len=0"
"588","6.298003294","212.143.195.14","192.168.129.132","TLSv1.2","13072","Application Data"
"589","6.298037974","192.168.129.132","212.143.195.14","TCP","54","54820  >  443 [ACK] Seq=34809 Ack=4496080 Win=65535 Len=0"
"590","6.302854948","212.143.195.14","192.168.129.132","TLSv1.2","48062","Application Data, Application Data, Application Data, Application Data, Application Data, Application Data, Application Data, Application Data, Application Data"
"591","6.302967471","192.168.129.132","212.143.195.14","TCP","54","54820  >  443 [ACK] Seq=34809 Ack=4544088 Win=65535 Len=0"
"592","6.303073677","212.143.195.14","192.168.129.132","TLSv1.2","16285","Application Data"
"593","6.303143693","192.168.129.132","212.143.195.14","TCP","54","54820  >  443 [ACK] Seq=34809 Ack=4560319 Win=65535 Len=0"
"594","6.304083621","212.143.195.14","192.168.129.132","TLSv1.2","64293","Application Data, Application Data, Application Data, Application Data, Application Data, Application Data, Application Data, Application Data, Application Data, Application Data"
"595","6.304151666","192.168.129.132","212.143.195.14","TCP","54","54820  >  443 [ACK] Seq=34809 Ack=4624558 Win=65535 Len=0"
"596","6.304504333","212.143.195.14","192.168.129.132","TLSv1.2","19836","Application Data, Application Data, Application Data, Application Data"
"597","6.304559747","192.168.129.132","212.143.195.14","TCP","54","54820  >  443 [ACK] Seq=34809 Ack=4644340 Win=65535 Len=0"
"598","6.325436726","212.143.195.14","192.168.129.132","TLSv1.2","15586","Application Data"
"599","6.325620282","192.168.129.132","212.143.195.14","TCP","54","54820  >  443 [ACK] Seq=34809 Ack=4659872 Win=65535 Len=0"
"600","6.325879808","212.143.195.14","192.168.129.132","TLSv1.2","15586","Application Data, Application Data, Application Data, Application Data"
"601","6.325996400","212.143.195.14","192.168.129.132","TCP","8526","443  >  54820 [PSH, ACK] Seq=4675404 Ack=34809 Win=64240 Len=8472 [TCP PDU reassembled in 602]"
"602","6.325996628","212.143.195.14","192.168.129.132","TLSv1.2","15586","Application Data"
"603","6.326673010","192.168.129.132","212.143.195.14","TCP","54","54820  >  443 [ACK] Seq=34809 Ack=4699408 Win=65535 Len=0"
"604","6.329224724","212.143.195.14","192.168.129.132","TLSv1.2","42414","Application Data, Application Data, Application Data, Application Data, Application Data, Application Data, Application Data, Application Data, Application Data"
"605","6.329366499","212.143.195.14","192.168.129.132","TLSv1.2","21933","Application Data"
"606","6.329763505","192.168.129.132","212.143.195.14","TCP","54","54820  >  443 [ACK] Seq=34809 Ack=4763647 Win=65535 Len=0"
"607","6.330175144","212.143.195.14","192.168.129.132","TLSv1.2","16114","Application Data, Application Data, Application Data, Application Data, Application Data, Application Data, Application Data, Application Data"
"608","6.330646411","212.143.195.14","192.168.129.132","TLSv1.2","48233","Application Data, Application Data, Application Data, Application Data, Application Data, Application Data, Application Data, Application Data, Application Data, Application Data, Application Data, Application Data"
"609","6.330868726","192.168.129.132","212.143.195.14","TCP","54","54820  >  443 [ACK] Seq=34809 Ack=4827886 Win=65535 Len=0"
"610","6.331501870","212.143.195.14","192.168.129.132","TLSv1.2","6379","Application Data, Application Data, Application Data, Application Data, Application Data, Application Data, Application Data"
"611","6.331631970","192.168.129.132","212.143.195.14","TCP","54","54820  >  443 [ACK] Seq=34809 Ack=4834211 Win=65535 Len=0"
"612","6.656610285","192.168.129.132","212.143.195.14","TLSv1.2","2286","Application Data"
"613","6.656910027","192.168.129.132","212.143.195.14","TLSv1.2","2340","Application Data"
"614","6.657184826","212.143.195.14","192.168.129.132","TCP","60","443  >  54820 [ACK] Seq=4834211 Ack=36269 Win=64240 Len=0"
"615","6.657184945","212.143.195.14","192.168.129.132","TCP","60","443  >  54820 [ACK] Seq=4834211 Ack=37041 Win=64240 Len=0"
"616","6.657184980","212.143.195.14","192.168.129.132","TCP","60","443  >  54820 [ACK] Seq=4834211 Ack=38501 Win=64240 Len=0"
"617","6.657583691","212.143.195.14","192.168.129.132","TCP","60","443  >  54820 [ACK] Seq=4834211 Ack=39327 Win=64240 Len=0"
"618","6.673271555","212.143.195.14","192.168.129.132","TLSv1.2","1555","Application Data, Application Data, Application Data, Application Data, Application Data, Application Data, Application Data, Application Data, Application Data, Application Data, Application Data, Application Data, Application Data, Application Data, Application Data, Application Data, Application Data"
"619","6.673582248","192.168.129.132","212.143.195.14","TCP","54","54820  >  443 [ACK] Seq=39327 Ack=4835712 Win=65535 Len=0"
"620","7.590587063","192.168.129.132","142.250.75.97","TCP","54","53550  >  443 [ACK] Seq=1 Ack=1 Win=65535 Len=0"
"621","7.591168372","192.168.129.132","142.250.75.163","TCP","54","35152  >  443 [ACK] Seq=1 Ack=1 Win=65535 Len=0"
"622","7.591319628","192.168.129.132","142.250.75.174","TCP","54","38092  >  443 [ACK] Seq=1 Ack=1 Win=65535 Len=0"
"623","7.591462111","192.168.129.132","142.250.102.188","TCP","54","36242  >  5228 [ACK] Seq=1 Ack=1 Win=65535 Len=0"
"624","7.591716031","142.250.75.97","192.168.129.132","TCP","60","[TCP ACKed unseen segment] 443  >  53550 [ACK] Seq=1 Ack=2 Win=64240 Len=0"
"625","7.591716213","142.250.75.163","192.168.129.132","TCP","60","[TCP ACKed unseen segment] 443  >  35152 [ACK] Seq=1 Ack=2 Win=64240 Len=0"
"626","7.591716313","142.250.75.174","192.168.129.132","TCP","60","[TCP ACKed unseen segment] 443  >  38092 [ACK] Seq=1 Ack=2 Win=64240 Len=0"
"627","7.591716394","142.250.102.188","192.168.129.132","TCP","60","[TCP ACKed unseen segment] 5228  >  36242 [ACK] Seq=1 Ack=2 Win=64240 Len=0"
"628","9.550105471","192.168.129.132","142.250.75.174","TLSv1.2","176","Application Data"
"629","9.550579146","142.250.75.174","192.168.129.132","TCP","60","443  >  38102 [ACK] Seq=1 Ack=123 Win=64240 Len=0"
"630","9.550763562","192.168.129.132","142.250.75.174","TLSv1.2","93","Application Data"
"631","9.551008611","192.168.129.132","142.250.75.174","TLSv1.2","2788","Application Data"
"632","9.551080773","142.250.75.174","192.168.129.132","TCP","60","443  >  38102 [ACK] Seq=1 Ack=162 Win=64240 Len=0"
"633","9.551610883","142.250.75.174","192.168.129.132","TCP","60","443  >  38102 [ACK] Seq=1 Ack=1622 Win=64240 Len=0"
"634","9.551611345","142.250.75.174","192.168.129.132","TCP","60","443  >  38102 [ACK] Seq=1 Ack=2896 Win=64240 Len=0"
"635","9.557248751","142.250.75.174","192.168.129.132","TLSv1.2","93","Application Data"
"636","9.597513094","192.168.129.132","142.250.75.174","TCP","54","38102  >  443 [ACK] Seq=2896 Ack=40 Win=65535 Len=0"
"637","9.654149152","142.250.75.174","192.168.129.132","TLSv1.2","993","Application Data, Application Data, Application Data, Application Data"
"638","9.654242134","192.168.129.132","142.250.75.174","TCP","54","38102  >  443 [ACK] Seq=2896 Ack=979 Win=65535 Len=0"
"639","9.655719935","142.250.75.174","192.168.129.132","TLSv1.2","93","Application Data"
"640","9.655757455","192.168.129.132","142.250.75.174","TCP","54","38102  >  443 [ACK] Seq=2896 Ack=1018 Win=65535 Len=0"
"641","9.657030827","192.168.129.132","142.250.75.174","TLSv1.2","89","Application Data"
"642","9.657306109","192.168.129.132","142.250.75.174","TLSv1.2","93","Application Data"
"643","9.657510491","142.250.75.174","192.168.129.132","TCP","60","443  >  38102 [ACK] Seq=1018 Ack=2931 Win=64240 Len=0"
"644","9.657510851","142.250.75.174","192.168.129.132","TCP","60","443  >  38102 [ACK] Seq=1018 Ack=2970 Win=64240 Len=0"
"645","9.977368184","192.168.129.132","142.250.75.174","TLSv1.2","3700","Application Data"
"646","9.978078587","142.250.75.174","192.168.129.132","TCP","60","443  >  34372 [ACK] Seq=3519 Ack=30054 Win=64240 Len=0"
"647","9.978079000","142.250.75.174","192.168.129.132","TCP","60","443  >  34372 [ACK] Seq=3519 Ack=31514 Win=64240 Len=0"
"648","9.978079048","142.250.75.174","192.168.129.132","TCP","60","443  >  34372 [ACK] Seq=3519 Ack=32240 Win=64240 Len=0"
"649","10.058721440","142.250.75.174","192.168.129.132","TLSv1.2","195","Application Data, Application Data, Application Data"
"650","10.059579914","192.168.129.132","142.250.75.174","TLSv1.2","93","Application Data"
"651","10.060235702","142.250.75.174","192.168.129.132","TCP","60","443  >  34372 [ACK] Seq=3660 Ack=32279 Win=64240 Len=0"
